language,text,source
Igbo,"Ego ego nwere obere volatility - ego ego ndị ahụ ọnụego mgbanwe nwere ntakịrị mgbanwe. Ma ọ bụghị ya, enwere ike ịkpọ ego ego nwere obere volatility ego ego na ọnụego mgbanwe kwụsiri ike.",glot500
Igbo,"Adam, December 9, 2018 December 23, 2018 , Video Club, enyi nwoke na-amakarị nwa agbọghọ, anụmanụ mmekọahụ porn, ụmụ anụmanụ na ụmụ nwanyị, ihe nkiri anụ ọhịa, vidiyo nke anụ ọhịa, vidiyo kacha mma, Mụ na nkịta m nwere mmekọahụ, mmekọahụ na nkịta, vidiyo zoophila, zoophilia nkiri, zoophilia videos, zooskool nkiri, 60",glot500
Igbo,"Shampoo megide dandruff ""Horsepower"" Ncha akwa! Nedu! Ha sachara ha otu narị afọ, lee, “Horse Slava” O nyeere m aka, ma ọ nweghị ihe laghachiri! N'ihi ya, ọ bụ na m, ama ọtụtụ afọ ...",glot500
Igbo,"Islamic Blog in Hindi, Islamic Knowledge and Hadees in Hindi: शबे क़द्र की दुआ नमाज़ और इबादत (Shab-e-Qadr ki Dua Namaz or Ibadat)",glot500
Igbo,"Na 19 Eprel 2008, ọ laghachiri India wee binye aka na nkwekọrịta ọrụ ngo dị ka onyeisi nkụzi nke otu bọọlụ ya mbụ Churchill Brothers SC  na 5 Septemba 2008 a tọhapụrụ ya pụọ na nkwekọrịta ya.",glot500
Igbo,"In the years of independence of Ukraine Institute continued to develop. na 1992, the postgraduate program at the Faculty of Philology created additional pedagogical skills and retraining of Ukrainian Philology and Foreign Languages.",glot500
Igbo,"Nnukwu ụlọ ụlọ 4 gbara agba maka ire ere na Playa de la Arena, Tenerife! Ebe zuru oke dị mita 150 site n'oké osimiri na mita 300 site na ...",glot500
Igbo,"11. 7:12 Ọ bụ ezie na m maara Ụkpụrụ Ọma ahụ, ugboro ole ka m na-etinye ndụmọdụ a n’ọrụ n’otú m si emeso ndị ọzọ ihe?",glot500
Igbo,"Nleta Mgbakọ Bishkek nke EGO; Onye isi oche EGO General Nihat ALKAŞ natara ndị nnọchi anya nke Ruslanbek ZHAKYSHOV, onye isi na Mayor nke Bishkek Municipal Council nke obodo nwanyị Republic of Kyrgyzstan. Na nnabata, General Directorate nke EGO 77 [More ...]",glot500
Igbo,"Aliza Ayaz bụ onye na-ahụ maka ihu igwe nke mba ụwa, na onye nnọchi anya United Nations Goodwill. O jikọtara aka wee merie United Kingdom Youth Outstanding Commitment to Sustainability Award na University College London (UCL), ma kwuo okwu na United Nations, London International Model United Nations, na ihe omume UK Parliamentary. Ọ bụ onye otu National Youth Council Pakistan . A maara ya maka ịmepụta Climate Action Society na UCL nke nyere aka kpalie ndị ntorobịa UK niile na-eme ihe megide mgbanwe ihu igwe, na-eduga na nkwupụta mberede ihu igwe na UK Parliament. N'ọnwa Ọktoba afọ 2020, a họpụtara ya dị ka onye nnọchi anya ndị ntorobịa nke United Nations maka Goal 13 (SDG13), nwa akwụkwọ Pakistani nke abụọ na-esote Malala Yousafzai natara nsọpụrụ a.",glot500
Igbo,Bhubaneswar Puri 1 Night / 2 Days - Njem Ntugharị India - Onye na-eme njem na Bhubaneswar - 91-993.702.7574,glot500
Igbo,"Nke a bụ nke e mere ka a mara site n'ọnụ ode akwụkwọ mgbasa ozi ndị otu a, bụ maazị Emma Powerful site n'ozi ọ kụpụrụ ụbọchị ụka.",glot500
Igbo,Onye isi oche mbụ nke Isolo LCDA bụ Mrs. Mary Modupeola Fafowora-Oseghale onye jere ozi ugboro abụọ n'ọchịchị nakwa dị ka onye isi odeakwụkwọ n'etiti afọ 2004 na 2011.,glot500
Igbo,too ogologo. Onye ọrụ nwere ike ịnweta otu adreesị ozi na iche na ekwentị na-eme ka n'aka na email na-abụghị nanị anya ma Mgbakwụnye na-ebudatara.,glot500
Igbo,"< start=""162.769"" dur=""4.382""> Dị ka ụmụ nwoke nọ ebe ahụ na-enwe mmasị ikwu ọtụtụ ihe, ọ bụ ndụ nke kachasị mma, yabụ ọ bụrụ na ịnweghị >",glot500
Igbo,"One of the best houses in Lamu - it just works. - Review of Forodhani House, on Shela Beach, in Lamu, Kenya, Lamu Island, Kenya - TripAdvisor",glot500
Igbo,"400gbọ elu ndị agha A400M, nke ndị Turkish Air Force Command na-arụ ọrụ, enwetala asambodo ikike mbugharị njem n'otu oge. AXNUMXM Ọgbọ Ọhụụ mepụtara site na Airbus [More ...]",glot500
Igbo,"Ọ bụrụ na ị na-agbaso mgba ule ihe, ị nwere ike họrọ a-atọ ndị ọzọ preparatory N'ezie iji hụ na ị maara na ihe na njikere rue.",glot500
Igbo,"Otú ọ dị , Izrel setịrị aka nri ya wee tụkwasị ya n’ isi Ifrem , ọ bụ ezie na ọ bụ nke nwata , ọ tụkwasịkwara aka ekpe ya n’ isi Manase .",glot500
Igbo,"Na fancy azụmahịa aha nwere ike ịpụta ""gold"" gị olumba na pụtara ""na na na"" na asụsụ ọzọ, nke pụtara na ha ga-efek gị ụlọ ahịa. Ya mere eme gị research.",glot500
Igbo,"Mmiri jupụtara na ikuku oxygen na-akpali mkpụrụ nke ọka ma na-emepụta disinfection ọzọ. Mgbe ọgwụgwọ a gasịrị, a na-akụkọta ihe ndị a na-agha mkpụrụ maka ala, ma ọ bụrụ na a ga-akụ ya n'ọhịa mgbe ụfọdụ. Ọ bụrụ na a na-agha mkpụrụ na seedlings, mgbe ahụ, ọ ga-adị mma ịme ya ozugbo ị tụsịrị ya. A na-ererịrị mkpụrụ osisi ahụ na F1 akara ma na-edozi ahụ, yabụ na nke a, ị kwesịrị ịkpachara anya n'ịkwadebe ala.",glot500
Igbo,"Mfe ego na-enweghị mgbalị ọ bụla bụ ihe Ọnwa ahia EA bụ ihe niile. Ọ bụ atụmatụ Forex akpaghị aka na-enye gị ohere izu ike na naanị ilele FX Trading Robot na-eme aghụghọ ya. Mgbe emesiri inye gị, Robot weghachitere gị azụmahịa gị niile. Nke a na-enyere gị aka ijide onwe gị ebe ị na-etinye ike gị n'ihe ndị ọzọ dị mkpa.",glot500
Igbo,2018 US Open bannister ọdọ Broadcast Engineer Broadcast Engineering ogwumagala mwekota software Ụgha & Akụrụ ndorondoro TV Technology video Engineer	2018-12-05,glot500
Igbo,"Ajakaiye amatala maka ma ọganihu sayensị ya na enyemaka o nyere mba Nigeria. Nigerian Mining and Geosciences Society kwanyere ya ugwu maka ọrụ ya, na-eme ka ọ bụrụ nwanyị mbụ nwetara ihe nrite ahụ. Ọ bụkwa onye isi ojii mbụ nke Afrịka a ga-akpọ aha onye otu Geological Society of London .",glot500
Igbo,"3. Ozugbo download zuru ezu, họrọ chọrọ nkwado ndabere na mpaghara faịlụ site n'aka-ekpe n'akụkụ menu na iti ""Malite Copy"" nyefee ya ndị Android ngwaọrụ jikọọ gị na laptọọpụ / kọmputa.",glot500
Igbo,"E mesịa , eze Asiria dọọrọ Izrel n’ agha laa Asiria , meekwa ka ha biri na Hela nakwa na Hebọ , nke dị n’ akụkụ osimiri Gozan nakwa n’ obodo dị iche iche nke ndị Midia ,",glot500
Igbo,"A pụrụ iji Sigma isii mee ihe dịka akụkụ nke mgbanwe nke usoro ọrụ ugbu a nke dị ugbu a na-eji usoro ITIL ma ọ bụ na-agagharị na ya. N'elu ohere na ọ bụ na-akpụ akpụ, nzukọ nwere ike iji usoro nke imebi ihe ize ndụ ahụ, chọpụta ihe a ga-eme iji mee usoro ITIL-ọ dị mma na mgbe ejiri ya mee ihe azụmahịa iji mara otú ọ ga-esi kwaga ebe ọzọ. Ọnọdụ ITIL zuru okè.",glot500
Igbo,Ịmepụta nlele na nkwado ọrụ dị ala. Nkọwa abụọ dị mkpa n'azụ ịnakwere ọchịchị igwe ojii bụ ego ego na arụmọrụ nke ọma. Otu ụzọ ị ga-esi mezuo ya bụ site n'ịbelata nlekota nlekọta ụmụ mmadụ chọrọ ka ị na-atamu ntamu.,glot500
Igbo,"Toth gara Mahadum Northern Arizona na Flagstaff, Arizona, ebe ọ na-asọ mpi na otu egwuregwu ụmụ nwanyị, wee gụsịrị akwụkwọ na afọ 2009 na nzere bachelọ na nchịkwa azụmaahịa-ego na ahịa.",glot500
Igbo,"O kwuru; ""bọjeetị afọ a na nke afọ gara aga m wegara n'ụlọ omeiwu bụ nke kachasị na mmapụta akụ e ji arụ ọrụ gbara ọkpụrụkpụ; ọ karịrị naịra otu tari na nde atọ (1.",glot500
Igbo,"5 Mgbe Ndị Mmụta Baịbụl malitere ọhụrụ, ha chọpụtara na ha kwesịrị ịrụ ebe ndị ha ga-anọ na-efe Chineke. Ọ dị ka ebe mbụ ha rụrụ ha ga-anọ na-efe Chineke bụ na West Vejinia, nke dị n’Amerịka. Ha rụrụ ya n’afọ 1890. N’agbata afọ 1931 na afọ 1939, ndị Jehova arụọla ọtụtụ ụlọ ndị ha na-anọ efe Chineke, e nwekwara ndị ha rụzigharịrị. Ma, o nwebeghị aha ha na-akpọ ụlọ ndị ahụ ha na-anọ efe Chineke. N’afọ 1935, Nwanna Rutherford gara Hawaii ka ọ hụ alaka ụlọ ọrụ anyị a rụrụ ọhụrụ nakwa otu ụlọ nzukọ a rụrụ na ya. Mgbe ụmụnna jụrụ Nwanna Rutherford ihe a ga-akpọ ụlọ ahụ, ọ gwara ha, sị: “Ùnu chere na ọ dịghị mma ka anyị kpọọ ya ‘Ụlọ Nzukọ Alaeze,’ ebe ọ bụkwanụ na anyị na-ezi ndị mmadụ ozi ọma Alaeze Chineke?” (Mat. 24:14) Aha a a kpọrọ ụlọ a dabara adaba. Ọ bụkwa aha a ka e mechara kpọwa ọtụtụ ebe Ndịàmà Jehova n’ụwa niile na-anọ enwe ọmụmụ ihe ha.",glot500
Igbo,Gabriel guzobere Ụlọ Egwuregwu Ncheta Tinus de Jongh na Stellenbosch na 1981 wee ghọọ nnukwu ihe na-adọrọ mmasị ndị njem nleta na ụzọ mmanya. Ụlọ ngosi ahụ mechiri afọ iri ka e mesịrị mgbè Lanzerac Hotel gbanwere aka.,glot500
Igbo,"Site na sistemụ SMS ha, U-Report, UNICEF jisiri ike mee ngwa ngwa na ọdachi na-abịanụ, ebe ọ na-enye nwata ahụ ihe ọmụma na nkwupụta okwu. N'ihi U-Report, ya na nkà na ụzụ texting ya na njikarịcha ọdịyo, ntụziaka nchekwa dị ngwa gbasaa n'ime iri na ọkara nde ndị na-eto eto bụ ndị na-eche ihu ifufe ahụ, na-azọpụta ọtụtụ ndụ. Ugbu a, UNICEF na-eziga nri ndị ọzọ na ihe enyemaka ndị ọzọ. N'ozuzu ya, olile anya agaghị anwụ ma ọ bụrụhaala na ndị mmadụ na-anọgide na-arụ ọrụ n'inyere ndị ọzọ aka.",glot500
Igbo,"Igwe ọkụ nke anwụrụ ọkụ nke 30w Led Street na- abịa na mgbawa dị elu-lumen leds, 30W nke ike LED, ultra-shine 3450Lm, 5000k, nnukwu arụmọrụ nke ìhè. Nke a Igwe ọkụ na-acha anwụ ọkụ na-enwu ọkụ n'abalị nwere ike ịgbanye n'abalị (ọnọdụ dim), gbanyụọ ụtụtụ wee bido ịgba ụgwọ. The Street Light Panel t on on...",glot500
Igbo,"Ụlọ Nnọchiteanya nke Iteghete: APC nwere mmadụ Narị abụọ na iti na otu, PDP nwere otu narị na iri na otu...",glot500
Igbo,"Ugbu a, anyị na-ọtụtụ ama na ụlọ ọrụ ndị na-okwu nkwado ibe, dị otú ahụ dị ka LG, OPPO, BYD, incase, TTPOD, LAWA, Kate spade, etc.",glot500
Igbo,27 Koro etie mi nte iwụtke eti ibuot ndinọ owo–n̄kpọkọbi aka ndien n̄wụtke n̄ko ikọ emi ẹdoride enye.”,glot500
Igbo,"Ọkpọka , ụbọchị ume gị ga- agbada , Mejọ ga- akpụpụ gị ahịa ma ọ bụ gbuo gị were chie nna ya echichi .",glot500
Igbo,Ikike imezi - nke pụtara na ị nwere ikikere ịrịọ nhazigharị ma ọ bụ nkwụsị nke Personal Data nke na-ezighị ezi ma ọ bụ ezughị oke.,glot500
Igbo,"Oke ego KingN Coin ọnụego mgbanwe maka taa bụ 28/05/2020 - egosiri na tebụl azụmahịa niile maka taa. Kachasị mma KingN Coin ịzụta na ire ọnụ ahịa maka taa bụ 28/05/2020 n'isi nke ibe. N'ime tebụl ọnụego kacha mma KingN Coin, ị nwere ike ịchekwa ego dị iche iche KingN Coin ma họrọ nke kachasị mma na nke gbanwere gbanwere Ọ ka mma ịchọrọ maka mgbanwe ego ego. Ọrụ saịtị cryptoratesxe.com ""Kachasị mma KingN Coin"" maka ọnụahịa nke taa 28/05/2020 ""na-eme ka enwere ike ịtụle ọnụego crypto kacha mma site gburugburu. ụwa n'ịntanetị.",glot500
Igbo,"Daniel Engman singing `Pilatus & Jesus` (Pilate & Christ) in the swedish arena tour of Jesus Christ Superstar The musical was translated into swedish by . och samarbete med våra kunder stärker vi kundens konkurrenskraft med produkter inom automation och elektronik. billigt garn linköping iso jesus födelse i. hvor ligger roma Här hittar du all utrustning som du kan tänkas behöva för gång och löpning. attributter ved visjon Båda dessa träningsformer är skonsamma mot . och samarbete med våra kunder stärker vi kundens konkurrenskraft med produkter inom automation och elektronik. billigt garn linköping iso jesus födelse i. vinna på triss tips · gym torvalla östersund · när lyktorna tänds på andra sidan bron metallica whiskey in the jar lyrics übersetzung. fysisk aktivitet psykiska hälsan. hvor ligger roma Här hittar du all utrustning som du kan tänkas behöva för gång och löpning. attributter ved visjon Båda dessa träningsformer är skonsamma mot . Ọ bụ n'ebe dị anya site na European ụkpụrụ. Nzube Chineke bụ na-eme ka ụlọ maka ihe n'alaeze ebighị ebi, mgbe alaeze niile n'oge na narị afọ nke oge: Ọ bụrụ n'ezie na amateur busen na-aghọta na ịghọta Alaeze Chineke ịdị aberdeen personals na otuto ga-agaghị ebibi ebibi, mgbe ahụ, ọ ga-abụ a ezi obi ụtọ: Gelboory Mail site Nils N'ikpeazụ, mgbe girls brunettes mgbe niile arụmụka kostlose sexfilme ntuli celebrity vagina shots abalị dị n'elu, na ntuli aka fever emen ịnọgide na-agha local pussey na ike. Ọ ga-akụri ma na-etinye njedebe ndị ọzọ handjob girls na-achị, ma, ị ga-eguzo ruo mgbe ebighị ebi. Alaeze Chineke dabeere yiri ụgha, na-emegiderịta na anyị mere, ihe atụ. Nzube Chineke bụ na-eme ka ụlọ maka ihe n'alaeze ebighị ebi, mgbe alaeze niile n'oge na narị afọ nke oge: Det var bra Stefan. The Swedish ntuli aka bụ ihe kasị undemocratic ntuli aka dị ka ihe ntuli aka nke hụrụ si OSCE ozi hụrụ ""Na nke ọ bụla ntuli aka chọpụtara m na na, Ahụtụbeghị m ihe nhoputa ndi ochichi ka undemocratic dị ka Swedish. Mgbe alaeze Chineke guzobere Iso, Jesus Christ, ajụla niile n'ụwa ike na ebube site n'ọnwụ ihere Ọ tachiri obi dị ka a mpụ, ọ ghọrọ Real Forces Winner! Humanity-esiwanye kpughere onwe ya site na nkpuru nke mgbalị anyị ga-eme ka ụmụ mmadụ ndị ọzọ na ndị ọzọ ka a ikpeazụ ọdịda! Isiokwu na-e dere site ndị mmadụ ndị ọzọ karịa Apg",glot500
Igbo,Ụmụ nwanyị Brown na-etinye aka na-enweghị aka ga-ahụ Ụdị Tribal n'akụkụ; egbu egbu egbu a na-eme ka ha yie ihe mara mma,glot500
Igbo,"Na-arụ ọrụ n'ime Excel, mgbe ụfọdụ ị ga-eche ihu na ọ dị mkpa ka ịwapụ usoro na ebe. E nwere ụzọ dị iche iche a nwapụtara maka nke a. Ụfọdụ n'ime ha na-arụ ọrụ ahụ n'ụzọ nkịtị na ntinye pịa, ebe ndị ọzọ chọrọ oge dị ukwuu maka usoro a. N'ụzọ dị mwute, ọ bụghị ndị ọrụ niile maara ihe ndị a nile, ya mere, ha na-etinye oge dị ukwuu na usoro ndị ahụ a ga-eme ngwa ngwa n'ụzọ ndị ọzọ.",glot500
Igbo,Ụlọ mposi bụ ụdị nke ụlọ mposi na ekpokọta nsị mmadụ n’oghere dị n’ime ala. Ha anaghị eji mmiri ma ọ bụ jiri otu lita ma ọ bụ atọ kwa mgbacha n’ụlọ mposi na enweghị ihe mgbacha dị mma.  Mgbe arụrụ ma dowe ya nke ọma ha nwere ike ịwedata nkesa nke ọrịa site na ibelata ọnụ nke nsị mmadụ dị na gburugburu sitere na ịnyụ nsị na gburugburu. Nke a na ewedata nnyefe nke ahụhụ n’etiti nsị yana nri si n’aka ijiji. Ahụhụ ndị a bụ ihe ndị kachasị ebute afọ ọsịsa na efe efe yana ọrịa okpo nke mgbiri afọ. Afọ ọsịsa na efe efe dapụtara n’ọnwụ nde 0.7 n’ụmụaka ndị na erughi afọ ise na 2011 yana nde 250 tufuru ụbọchị agụmakwụkwọ. Ụlọ mposi bụ ụzọ kachasị ọnụ ala nke ịkewa ndị mmadụ na nsị.,glot500
Igbo,"1 na-now nwere wuru na-na abalị mode, nke Aims iji belata acha anụnụ anụnụ-aj u si ngosi aka n'awa ole nke-acha anụnụ anụnụ ìhè nwuo n'ime anya n'oge awa nke ọchịchịrị.",glot500
Igbo,Ọnụ na-ekwụchitere Gọvanọ Rochas Okorocha bụ Sam Onwuemedo agọọla akụkọ kwuru na aka Okorocha dị na ihe na-eme na ọlụ omeiwu nke Imo steeti nke mere ụfọdụ ndị omeiwu enyere ezumike ike ji bo ya ebubo na ọ bụ ya bụ osisi dachiri ha ụzọ.,glot500
Igbo,"31Tọ dụ iya bụ, ndu Ízurẹlu buru l'alị ndu Amọru. 32Mósisu zhia ndu l'e-je ngge lẹ mkpụkpu Jaza, whẹ jegelewho, ndu Ízurẹlu je alwụta mkpụkpu, dụ iya nụ chịkashia ndu Amọru, shi buru l'ẹka ono.",glot500
Igbo,"N'ọnwa Disemba afọ 2007, Trzebinski bụ otu n'ime ndị omenkà ise nke onye nlekọta na onye omenkà Michael Guidry kpọrọ ka ha gosipụta ihe ha ji kpọrọ ihe na ihe ngosi ahụ, Little Known Facts, na Lawndale Art Center site n'ịmezigharị mpaghara nke ụlọ ọrụ ha. O jupụtara na oghere mgbidi ahụ na akwụkwọ akụkọ, ọtụtụ n'ime ha metụtara Africa, ma gosipụta ụfọdụ ihe osise, na-akpata ""ihe na-adọrọ mmasị na nke na-emetụ n'ahụ"" na ọzụzụ Africa nke Trzebinski na ndụ na United States dị ka onye ọcha Africa.",glot500
Igbo,"1. Na windo 8, wepụ ya na ọnọdụ dị mma site na ịpị bọtịnụ Windows + C.Wee pịa ike, ijide bọtịnụ ike ma malitegharịa. Họrọ nsogbu, nhọrọ dị elu, họrọ mmalite mmalite ma malitegharịa.Ozugbo ọ gaghachiri, họrọ nọmba 5 iji mee ka ọ bụrụ na ị nwere ike ịmalite ịkwanye ọnọdụ.",glot500
Igbo,"Obere oge ka afọ 1919 gachara, ụmụnna anyị e tere mmanụ gbawara mbọ ka ha ghọta ihe amụma Aịzaya na-ekwu.",glot500
Igbo,"Lee ihe iri gbara ọkpụrụkpụ ọ gwara ha: Ihe Charly Boy kwuru maka ndị ndọrọndọrọ na ndị ntoroọbịa N'aka nke ọzọ, Nnamdị Kanu site n'aka ọkaiwu ya bụ Ifeanyi Ejiofor, gwara ụlọikpe Naijirịa na ọ dị njikere ịbịa zara ọnụ ya ma ọ bụrụ na ha ga-echekwa ya. Mana ọkaiwu gọọmentị bụ Labaran Shuaibu ekwenyeghi na nke ahụ, bụ nke mere Ọkaikpe Nyako ji buga ikpe ruo ụbọchị iri na isii nke ọnwa Jenụwarị 2020. Nnamdi Kanu: Azikiwe tinyere ndi Igbo n'ọmị ha nọ na ya Akụko ga-amasị gị",glot500
Igbo,"Anyị ga-ekwetakwa na ikpe nke onye ọ bụla na-ebu nnukwu mmetụta uche nke ezigbo ndị nta akụkọ na-agwa ndị na-ege ha ntị. Ọ pụkwara ịdị iche na ịtụgharị, nke abụghị isiokwu nke ederede a.",glot500
Igbo,"Ịhụnanya bụ ihe ùgwù. Gị mkpa itinye na ihe ị na-atụ anya ga-esi. Ya mere, ọ bụrụ na ị na-achọghị ya ịgbanwe gị mgbe ahụ n'aka gị kwesịrị inwe nkwanye ùgwù bụghị ịgbanwe ya. E wezụga ọ bụrụ na ị hụrụ ya n'anya n'ezie echiche nke na-agbanwe agbanwe bụla nke ya na-adịghị agafe uche gị. M na-ekwu na ị gaghị ahụ a-adịru ogologo ndụ onye site na iji dum taming / na-agbanwe agbanwe na obibia ma ị gaghị ahụ ezi ịhụnanya na ụzọ. Ya mere, ndị bụ mkpebi gị. Ị chọrọ onye ma ọ bụ onye?",glot500
Igbo,"The 'Mr atụ ogho Casino Review' Review site 'Thor thunderstruck', n'ihi na 'mobilecasinofreebonus.com’",glot500
Igbo,"Ot? ? d?, ga-enwe na-enwegh? echiche ot? ? b? na-ezo aka ? b?la akw?kw? kwukwara na nrubeisi nke ego na-egosi.",glot500
Igbo,"Iche dị ka a ga-asị na ị kwụsịrị ihe m mere n'oge gara aga. Ana m eme ya niile site n'akwụkwọ na / ma ọ bụ ""ịgụ-m"". N'ihe banyere ụgbọ elu ọ bụla, echere m na m kwuru, ụgbọelu ọ bụla nwere ihe karịrị 2 engines. Enwere m ike ịmepụta ikikere ụgbọ elu X-56 na otu ụzọ, ma ọzọ. Ngbanwe ọ bụla na-emetụta ihe niile engines ndị ọzọ ma ọ bụ ụgbọelu niile kwesịrị ekwesị ka ha nọrọ na-abaghị uru mgbe ndị ọzọ na-atụgharị. Ana m eji mbipụta sfx steam. M kpọtụrụ gị n'ihi na enwere m nsogbu ogologo oge gara aga ma ị kwadoro m na nke ahụ. M rịọ mgbaghara maka iwepụta oge gị na ọnọdụ a, na echere na mmadụ nwere nsogbu yiri ya ma gwọọ ya. Enweghị ihe ọ bụla dị na FAQ gị.",glot500
Igbo,"Otutu ndi mmadu kwenyere na achoro iji ndi nyocha eme nke onwe ka ha soro onye di ya bu aghụghọ na-acho, nke a bu 21st narị afọ na teknụzụ dị ukwuu. Dokwesighi iku onye nchoputa ihe ruru puku dọla naanị ka o wee rụọ ọrụ dị ka nke a, nwee sọsọ na-eji satelaiti agha ịchọta ọnọdụ. Wayzọ a ị na-echekwa ego na ịdị na-ahụ maka nyocha gị.",glot500
Igbo,"Mgbe ọ na-abịa njem na London si Amsterdam na Berlin, si Amsterdam, i nwere ike na-Eurostar iduzi ma ọ bụ ọzọ ezi nhọrọ ga na-akpa-esi na-Brussels via Thalys na mgbe ahụ banye Eurostar na Brussels na London. The njem ewe ihe awa anọ na ụzọ na bụ ihe ndị kasị ụzọ iru London si Amsterdam ụgbọ okporo ígwè.",glot500
Igbo,"N’ ụbọchị ahụ , ụmụ agbọghọ na- amaghị nwoke , bụ́ ndị mara mma , ga- atụbọ , tinyere ụmụ okorobịa , n’ ihi akpịrị ịkpọ nkụ ;",glot500
Igbo,"Ugbu a, ịzọpụta gị n'ụzọ ziri ezi na-agba gburugburu video laghachi isi menu on VLC Media Player na họrọ Ngwaọrụ> Mmasị.",glot500
Igbo,"Na ihe karịrị 40 afọ ọhụụ ụlọ ọrụ na iri puku kwuru iri puku arịa dị mma, Solar Solve bụ ụlọ ọrụ ị nwere ike ịtụkwasị obi na ịnye kachasị mma mmiri na-acha mmiri ozuzo na windo na-ekpuchi anya na ụzọ a na-esi enwetaghị ọrụ ndị ahịa.",glot500
Igbo,"Anyị nwere ike ịsị niile cha cha chaa chaa na Prague dị na etiti obodo. Ya mere, ọ bụrụ na ịchọrọ ịchọta ụlọ ọrụ kwesịrị ekwesị maka egwuregwu ahụ agaghị esiri onye ọ bụla egwu egwu, ọbụnakwa buru ụzọ bata n'isi obodo Czech.",glot500
Igbo,"April 1, 2016. Mercury Drug - Official Site (https://www.mercurydrug.com/index.html) It is available in convenient sachets worth 15 pesos at Watsons Drugstores and some Mercury Drug... na sa United States na naglabas... based lubricants...",glot500
Igbo,"Ọtụtụ ndị na-arịọ ma ọ bụrụ na-ewere ụgbọ okporo ígwè pụtara ihe ize ndụ nke ibute ọrịa. Azịza ya dị nkenke bụ na ọ bụrụ na ị na-nọ ọdụ na a ụgbọ okporo ígwè na n'ime 1-2 mita nke nje onye coughs, ị nọ n'ihe ize ndụ nke ibute ọrịa.",glot500
Igbo,A na-eji ihe nchịkọta a na ọtụtụ tattoos na-anọchite anya ọtụtụ ihe n'agbanyeghị na ha dị #obere na akụkụ ọ bụla nke ahụ.,glot500
Igbo,"Dị ka nke a na-emekarị, a na-eme ka UAE UAE na-eme ka ndị ọzọ na-eme ihe. Nke a na-emekarị ka ọ dị mma Ọ bụrụ na ị na-enweta ihe ọ bụla na-ekwu banyere gị Ọ bụrụ na ị na-achọ. Otú ọ dị, ọ bụrụ na ị na-eme ka ndị ọzọ na-eme ka gị na ndị ọzọ na-eme ka gị na ndị ọzọ na-eme ka gị na ndị ọzọ na- 10 Gbanyụọ gị ozi ahịa. Gbanyụọ mkpokọta Ọzọkwa, Ị na-agụ ma ọ bụ na-eme ka gị na ndị ọzọ na-eme ihe Ọ dị.",glot500
Igbo,"Odisha - Ala nke dị n'Ebe Ọdịda Anyanwụ nke India, na-ebi ndụ mgbe nile n'eziokwu ya na ọdịnala ya, & a maara ya nke ọma gburugburu ụwa maka ọdịbendị ya na ebe obibi ya.",glot500
Igbo,"Dafnedesign.com - n ° 2 akwa stools - akụkụ: cm 76X34X34 - TESSIL COVER, oche a kpara - ALUSILVER ALUMINUM FRAME - - ntụ ntụ kpuchie aluminum etiti, - akwa-eguzogide Tessil ekpuchi, - mfe mfe, anaghị ejigide dirt - (DF9)",glot500
Igbo,"10, 11. (a) Nso idomo ke ediwak uyen ẹsisobo ke ufọkn̄wed? (b) Nso ikeme ndin̄wam mme uyen nnyịn ẹkûyak idem unọ idomo?",glot500
Igbo,"Ma oru ndi mmadu, ego, nzuko, ochichi, ma obu ihe ndi ozo di iche iche ma o bu ihe ndi ozo... Isii Sigma Green Belt Training zuru oke maka onye obula n'ele anya inweta ihe kariri oru ha. Ndị nyocha ga-achọpụta otú ị ga-esi tinye usoro ntanetị maka ịkwalite mgbanwe ịzụ ahịa dị ka:",glot500
Igbo,"A na-azụkarị ọkụkọ broiler n'ọhịa ugbo. Ndị agha na-enweta ntanye akwa maka broeding ozuzu. Mgbe ụfọdụ, ndị nwe ha na-azụta ọkụkọ n'onwe ha, ma n'echi ya, ha na-achọta otu ma ọ bụ karịa ndị nwụrụ anwụ. Kedu ihe kpatara ihe ndị dị otú a, anyị ga-agbalị ịghọta isiokwu a?",glot500
Igbo,Ngwaọrụ ọ bụla ejikọrọ na PC chọrọ nhazi mmemme pụrụ iche maka ọrụ ha. Anyị ga-etinye isiokwu a na mkparịta ụka nke ntụziaka nwụnye software maka ụdị Samsung ML 1660. Ịwụnye ngwanrọ maka Samsung ML 1660 Ị nwere ike nweta nchọta chọrọ na ọtụtụ ụzọ.,glot500
Igbo,"Adrenosterone ntụ ntụ, nke a makwaara dị ka ihe onwunwe Reichstein G, nakwa 11-keto (11-KA4), 11-oxoandrostenedione (11-OXO), na Androst-4-ene-3,11,17-trione, bụ horroone steroid na mmetụta na-adịghị ike androgenic , na etiti / prohormone nke 11-ketotestosterone. A na-akpa ya na 1936 site na adadeal cortex site na Tadeus Reichstein na Ụlọ ọgwụ na Mahadum Basel. Na mbụ, a na-akpọ adrenosterone ihe onwunwe Reichstein G. Adrenosterone pụtara na ụmụ mmadụ na ọtụtụ anụ mammals na ọtụtụ azụ, ebe ọ bụ ihe na-aga n'ihu na androgen, 11-ketotetosterone.",glot500
Igbo,"Ndị a bụ mba Jehova kwere ka ha nọrọ ka o wee site n’ aka ha lee Izrel ule , ya bụ , ndị niile na- ahụghị nke ọ bụla n’ agha niile a lụrụ na Kenan ;",glot500
Igbo,"Zenmate Crack na-ndinọ site n'enyemaka nke Zen-nche GmbH, a na-amalite na-elu-nzukọ dabeere kpam kpam na Berlin.",glot500
Igbo,"Agusia Iwu ọ bula, ha gāriọ Chineke ebere n'ihi njehie ha jehiere n'Iwu ahu na mbe gara aga, ha gāriọ kwa amara idebe ya na mbe di n'iru, dilea o si so.",glot500
Igbo,"N’ ihi na ụgwọ ọrụ nke mmehie na- akwụ bụ ọnwụ , ma onyinye nke Chineke na- enye bụ ndụ ebighị ebi site n’ aka Kraịst Jizọs Onyenwe anyị .",glot500
