language,text,source
Igbo,"8 Ọfọn ika iso ikot mme owo mbono esop nnyịn, ọkpọkọm edi usen kiet, sia emi ayanam mmọ ẹkụt ke Mme Ntiense Jehovah kpọt ẹkpep se isịnede ke Bible ẹnyụn̄ ẹn̄wam mme owo ẹdiọn̄ọ Abasi. (Isa. 65:13) Se Ray ye Linda an̄wan esie ke United States ẹkekụtde edi oro isua ifan̄ emi ebede. Mmọ ẹma ẹbiere nditọn̄ọ ufọkabasi. Mmọ ẹma ẹnịm ke Abasi do, ke edi se ikperede enye. Ntre mmọ ẹma ẹbiere ndika kpukpru ufọkabasi ke edem mmọ mbemiso ẹmekde enye emi mmọ ẹdidụkde. Ufọkabasi ama awak etieti, edi enyene n̄kpọ iba emi mmọ ẹkeyomde. Akpa, akana osụk enyene se mmọ ẹkpepde, ọyọhọ iba, ana mbon ufọkabasi oro ẹsịne n̄kpọ nte nditọ Abasi. Mmọ ẹma ẹsan̄a ke nsio nsio ufọkabasi ke ediwak isua tutu ẹka kpukpru ufọkabasi ke edem mmọ ẹma. Mmọ ikekpepke n̄kpọ ndomokiet, ikonyụn̄ ikwe mbon ufọkabasi ẹsịnede n̄kpọ nte nditọ Abasi. Usen emi mmọ ẹwọrọde ke akpatre ufọkabasi emi mmọ ẹkekade, Linda ama oto do aka itieutom, Ray ebe ọnyọn̄ ufọk. Nte Ray awatde aka, enye ama okụt Ufọkmbono Obio Ubọn̄ onyụn̄ ọdọhọ ke esịt esie ete, ‘Yak ndụk n̄kese nte enye emi etiede.’ Se enye okokụtde ama enem enye tutu. Kpukpru owo do ẹketie ufan ufan ẹnyụn̄ ẹsịne ọfọn̄ nte nditọ Abasi. Ray eketie ke iso, ama onyụn̄ ama se enye okokopde. Okonyụn̄ etie nte se apostle Paul eketịn̄de ete ke akpa ini emi owo edide mbono esop nnyịn ke enye edidọhọ: “Ke akpanikọ Abasi odu ke otu mbufo.” (1 Cor. 14:​23-25) Tọn̄ọ usen oro, Ray ama odụk mbono esop kpukpru Sunday, ekem odụk kpukpru eke ufọturua. Linda ama etiene ọtọn̄ọ. Kpa ye oro mmọ ẹkebede isua 70, mmọ ẹma ẹnyịme ẹkpep mmimọ Bible ẹnyụn̄ ẹna baptism.",glot500
Igbo,"29 Chineke wee na-enye Sọlọmọn amamihe+ na nghọta+ n’ebe ọ dị ukwuu nakwa obi nwere nghọta dị ukwuu,+ dị ka ájá dị n’ụsọ oké osimiri.+",glot500
Igbo,"Anyị chọrọ ochichi onye kwuo uche ya na China. Na obodo ndị nwere Uyghur, Hong Kong, Taiwan & Tibet. A ga-agbaze Thetù Kọmunist ozugbo. Ìhè amụma ọkụ",glot500
Igbo,"SynciOS iPod transfer, dị ka aha ya na-egosi, ọ bụ a Senuti maka Windows omume dị ka mma. Ọ na-enyere ndị ọrụ na-nyefee media faịlụ, dị ka music, pọdkastị, video, iTunes U, wdg na kọmputa. Ma ọ nwere ike adịghị nyefee music na listi ọkpụkpọ ozugbo na iTunes Library. Ka naanị foneelu na duplicated songs. Mgbe iji SynciOS iPod transfer iji nweta music na PC gị na, ị ga-mkpa ka ịgbakwunye ha gị iTunes Library. Adịghị m chọta Ama na ya website maka nkwado iTunes 12 na ọhụrụ iOS 9. Ị nwere ike na-agbalị ya iji hụ ma gị Apple ngwaọrụ a na-akwado ma ọ bụ.",glot500
Igbo,"Arctic region, Russia - August 16, 2017 - Na kasị open-n'olulu m nke Russia, na loaders na ndị kasị ibu tonnage na China - XCMG LW1200K na abụọ wheeled bulldozers XCMG DL900A na-arụ ọrụ ruo ihe karịrị 20,000 awa na-enweghị na-agbasa ala kefriza -cold gburugburu ebe obibi.",glot500
Igbo,"Ha zutere mgbe ụmụ akwụkwọ na Hochschule für bildende Künste Hamburg ma kemgbe ahụ, ha mepụtara ọtụtụ ihe ngosi na omume ọha na eze na Germany, Denmark na Austria n'okpuru aha ""Enfants Terribles"". N'afọ 2014–2015 ha ghọrọ ndị na-ese ihe na ụlọ nka na Meinersen na agụmakwụkwọ nke Foundation Bösenberg na n'afọ 2016 ndị na-ese ihe na ụlọ nka Künstlerhaus im Schlossgarten na Cuxhaven. Kemgbe afọ 2015, ha na-arụ ọrụ n'okpuru aha Nana ET Matvey na Berlin na Copenhagen.",glot500
Igbo,"Ọnụnọ nke njikọ nwere njikọ, ọ bụ ezie na ọ siri ike, anaghị egosi njikọ sitere n'etiti mgbanwe abụọ ahụ (lee kwa Welkowits, Cohen na Ewen, Statistics maka agwa akparamaagwa, 2009).",glot500
Igbo,"7 koro owo ekededi ke ufọk Israel m̀mê ke otu isenowo eke odụn̄de nte esenowo ke Israel, oro adian̄arede ada etre nditiene mi+ onyụn̄ anamde mme mbubiam mbiet esie ẹdọk ẹdi esịt esie onyụn̄ adade n̄kpọ iduọ oro edide ntak ndudue esie enịm ke iso esie onyụn̄ edide ebịne prọfet man edibụp mi n̄kpọ aban̄a idemesie,+ ami Jehovah nyọbọrọ enye.",glot500
Igbo,"Kosiladị, mkpebi ya kwụrụ ụgwọ n'afọ 2011, mgbe ọ meriri oche ịnọchite anya mpaghara Uhunmwode na State House.",glot500
Igbo,"13 Ọ na-emekwa ihe ịrịba ama ndị dị ukwuu,+ nke na ọ na-eme ọbụna ka ọkụ si n’eluigwe daa n’ụwa n’ihu ụmụ mmadụ.",glot500
Igbo,"Na mba ofesi Ebe foto si, AFP Otu meriri na ntuliaka e mere na mba SawỤt Afrịka bụ ANC ekweela ndị mba ahụ nkwa na ha ga-enye ha mbido ọhụrụ.",glot500
Igbo,"N’oge ihu igwe na-ekpo ọkụ, ọkachasị ma ọ bụrụ na ifuru ahụ dị n’ebe anwụ na-acha, ọ dị mkpa ka ị na-agba ihe ọkụkụ ahụ mmiri kwa ụbọchị ntakịrị. Ọnọdụ mmiri agaghị etolite. Isgbara mmiri ka mma jiri mmiri oyi dozie n'uhuruchi.",glot500
Igbo,"A mụrụ Mahder na 5 Ọktoba 1987 na Addis Ababa, Ethiopia nke dị gburugburu Shero Meda na Rebeka Feyessa na Assefa Demelash. Ọ biri n'ebe ahụ ruo mgbe ọ dị afọ ise, mgbe ahụ ọ kwagara na mpaghara Kera dị nso. Ọ gara ụlọ akwụkwọ elementrị na Atse Zeray Yacob wee gaa ụlọ akwụkwọ sekọndrị na Shemeles Habte School, ebe ọ gụsịrị akwụkwọ n'afọ 2011. Ọ gụsịrị akwụkwọ kọleji ya na Admas College, na-amụ sayensị odeakwụkwọ. Mgbe ọ na-aga kọleji, ọ rụrụ ọrụ dị ka onye na-ere ahịa.",glot500
Igbo,"Accessibility nke Njem Transport Services na Turkey Project Erzurum Onodi Transportation na Infrastructure Minister biaruru obodo ịga Mehmet Cahit Turhan, Erzurum gaa Gọvanọ Office, na-zubere n'etiti Baku-Kapıkule ngwa ngwa ígwè ụzọ ọ na-eru nso ọgwụgwụ nke ha oru ngo-arụ ọrụ.",glot500
Igbo,Malware na - ezo aka na mmemme nke mmemme dịka nje na ransomwarenke na-enye ndị na-ebute mgbochi - all-in-one mobility in portland oregon.,glot500
Igbo,"14:8 Na mgbe ụbọchị ụfọdụ gasịrị, alọta ịlụ ya, o wezugara onwe-ya mere ka ọ hụ na ozu ọdụm. Ma, le, enwere a igweahuhu aṅụ na n'ọnụ ọdụm, na a n'ụgbụgbọ mmanụ aṅụ.",glot500
Igbo,"Olee otú ị ga-esi mee ka ihe ọma ndị ị na-echeta mere mgbe gị na onye ị lụburu bi ghara ịkpatara gị na di gị ma ọ bụ nwunye gị nsogbu? Otu nwoke aha ya bụ Jared sịrị: “O nwere mgbe m gwara nwunye m na m nwere ike iji otú mụ na nwunye mbụ m si bie tụnyere ọmarịcha akwụkwọ mụ na nwunye m ahụ dere. Na ọ na-abụ m nọtụ, mụ ewere akwụkwọ ahụ gụọ ma cheta ihe ọma ndị mere mgbe ahụ. Ma ihe e dere n’akwụkwọ ahụ aghọọla ihe mgbe ochie.” Jared sịkwara na ‘ya na nwunye ya na-edezi akwụkwọ ọhụrụ ugbu a, na ọ bụ ihe ndị ha na-ede n’akwụkwọ a na-emezi ya obi ụtọ.’",glot500
Igbo,"A mụrụ Young ma zụlite ya na Birmingham, Alabama. Ọ na-akpọ égwu kemgbe ọ dị afọ anọ ma too na ụka na-akpọ ụbọ. Snipe gụrụ teknụzụ egwu na Mahadum Alabama na Birmingham.",glot500
Igbo,"ọ bụrụ na a na-eme atụmatụ ahụ na ụdị oge a, ị nwere ike ịchọta lemon Roman blinds, ha ga-ejikọta ya na ihe ndị na-egbuke egbuke nke ụlọ;",glot500
Igbo,"Spotify, otu nke kasị mma online music gụgharia ọrụ ruo ụbọchị, awade ya ọrụ a nnukwu ndepụta nke artists, listi ọkpụkpọ, albums, genre ma ọ bụ ndekọ labeelu na-agagharị na site na-egwu ihe ọ bụla music ha na-amasị for free. N'ezie, dị ka bụ nkịtị na ụwa nke internet, a adịchaghị otu on Spotify ga-ị ọzọ; ad free ọrụ ahụmahụ na mma audio àgwà na nhọrọ ibudata music maka offline ebre.",glot500
Igbo,"Badoo – a software ikwurịta okwu na-ewu ewu na-elekọta mmadụ na netwọk na ọrụ gburugburu ụwa. The software-enye gị ohere ikwurịta okwu na chat, òkù ọrụ izute, echiche na peeji nke ọbịa, nyochaa photos, wdg The peculiarity nke Badoo bụ ikike chọta ọrụ nso gị ugbu a ebe site na iji geolocation. The software na-enyere ịchọ ọrụ site gosiri parameters na ọdịmma na họrọ mpaghara. Badoo nwere ngwaọrụ hazi software maka mkpa nke ọrụ.",glot500
Igbo,Ụmụ nwanyị na-ahụ ụdị egbu egbu a na-achacha achacha na odo odo; egbu egbu egbu egbu a na-eme ka ha yie ihe dị mma,glot500
Igbo,"Ọ bụrụ na ajụjụ ọ bụla, biko na-eche free kpaliri m na carrie@szkepuai.com, ma ọ bụ na-akpọ na +86 137 6034 3155.",glot500
Igbo,A na-eme ntinye 1000 nke oge 3 nke e-Government 1 TL nkwado ọrịa. Akwụghachi ego nke 2 na nke abụọ nke ego enyemaka maka ndị nọ na mkpa. Nkọwa etu esi etinye maka usoro enyemaka mmadụ na-elekọta mmadụ 3 TL [More ...],glot500
Igbo,"ọ bụ Ezra nke a si na Babịlọn lawa ; ọ bụkwa ọkà n’ idepụta ihe dị n’ iwu Mozis , nke Jehova bụ́ Chineke Izrel nyere , nke mere ka eze nye ya ihe niile ọ rịọrọ , dị ka aka Jehova bụ́ Chineke ya nke dị n’ ahụ́ ya si dị .",glot500
Igbo,"Gọọmentị nwere ọganihu doro anya na mbọ ndị mmanye iwu ya megide ịzụ ahịa mmadụ n'oge akụkọ ahụ. Iceland machibidoro ịzụ ahịa maka mmegbu mmekọahụ na ọrụ mmanye site na Nkebi nke 227 nke iwu mpụ ya. N'ọnwa Disemba n'afọ 2009, ndị omeiwu gbanwere nkọwa nke ịzụ ahịa na koodu ahụ iji mee ka ọ kwekọọ na nkọwa mba ụwa n'okpuru 2000 UN TIP Protocol . Ntaramahụhụ e nyere maka ịzụ ahịa n'okpuru Nkebi nke 227 ruru afọ asatọ n'ụlọ mkpọrọ, nke zuru oke n'agbanyeghị na ọ bụghị ntaramahụhụ e nyere maka mpụ ndị ọzọ dị egwu dịka ndina n'ike. Ikpe n'ezie maka ndị omekome na-azụ ahịa kwekọrọ na ikpe ndina n'ike. Ndị uwe ojii mere nyocha atọ n'oge akụkọ ahụ, gọọmentị malitekwara ikpe asatọ n'oge akụkọ ahụ, ma e jiri ya tụnyere enweghị ikpe ọ bụla n'afọ gara aga. A mara ndị omekome ise ikpe n'okpuru Nkebi nke 227; a mara onye nke ọ bụla ikpe ịga mkpọrọ afọ ise. A tọhapụrụ otu onye a na-ebo ebubo na ọ na-azụ ahịa mmadụ na ebubo ịzụ ahịa mmadụ mana a mara ya ikpe na ebubo ndị ọzọ ma maa ya ikpe ịga mkpọrọ afọ abụọ. Kemgbe ahụ, e jidere ya maka ebubo ịzụ ahịa metụtara ikpe dị iche ma nọrọ n'ụlọ mkpọrọ. Enweghị akụkọ ọ bụla a maara banyere njikọ aka metụtara ịzụ ahịa. Ndị isi Iceland wusiri mmekọrịta ya na ndị ọchịchị Spain na Lithuania ike na ikpe ịzụ ahịa n'oge akụkọ ahụ. Gọọmentị kwadoro ọzụzụ mgbochi ịzụ ahịa (gụnyere ụfọdụ ọzụzụ na mba ofesi) maka ndị ọrụ niile nke Ministry for Foreign Affairs na ụfọdụ ndị uwe ojii na ndị ọrụ ọdụ ụgbọ elu.",glot500
Igbo,30 dị mma ụdị data teak oche si North. Uche ahụ pụtara ozugbo. Nke a set nke oche gara Netherlands na 'The hotbed na Rotterdam mara ụzọ na-eme ka arụpụtaghị ọrụ ha ochie' ume ohere '.,glot500
Igbo,"The ụgbọ okporo ígwè bụ otu n'ime ndị kasị ala nhọrọ ma ọ bụrụ na ị na-ejegharị ejegharị si Madrid ka Sarria. E nwere a kpọmkwem njikọ na doo Madrid si Chamartin ụgbọ okporo ígwè ugboro abụọ n'ụbọchị, na a njem oge nke dị awa isii. Ọzọkwa, e nwere dị iche iche ụgbọ oloko na jikọọ Madrid na Santiago de Compostela na Lugo, Galician obodo site na nke ọ bụ nnọọ mfe iji Sarria, na ọtụtụ kpọmkwem njikọ ụbọchị ọ bụla. I nwere ike ịkpọ ihe niile ugboro na frequencies site na ịkpọtụrụ Renfe, Spain si mba ụgbọ okporo ígwè ụlọ ọrụ.",glot500
Igbo,"Ẹsisịn enyịn̄ mme asiakusụn̄ ofụri ini oro ẹdotde ke Ufọkn̄wed Utom Usiakusụn̄ oro ẹsinịmde ke urua iba. Nditọete iren oro mîdọhọ ndọ, emi ẹdide mme asiakusụn̄ ofụri ini oro ẹdotde, ẹkpenyụn̄ ẹmade ẹnọ mmimọ ika ebiet emi ẹyomde un̄wam ẹkeme ndisịn n̄wed eben̄e ndika Ufọkn̄wed Ukpep Bible Eke Nditọete Iren Emi Mîdọhọ Ndọ oro ẹsinịmde ke ọfiọn̄ iba. Mme ọdọ ndọ oro ẹdotde ẹkeme ndisịn n̄wed ẹben̄e ndika Ufọkn̄wed Ukpep Bible Eke Mme Christian Oro Ẹdọde Ndọ. Mme ufọkn̄wed emi ẹyen̄wam mme asiakusụn̄ ‘ẹnam utom mmọ ọyọhọ ọyọhọ ẹma.’—2 Timothy 4:5.",glot500
Igbo,"TopTenReviews.com: Tenorshare bụ n'ihe banyere ngwaike ọ na-akwado. Ọ na-akwado ma GSM na CDMA ekwentị ụdị, ka gosiri ha na website. Malite na iPhone 3, nkwado na-aga n'ihu n'ụzọ nile elu site iPhone 6 Plus. Ị nwere ike ịnweta free ọnwụnwa niile iterations nke software otú ị pụrụ ijide n'aka na ọ ga-juputara ijere gị mgbake mkpa. Maka ndị na-obi abụọ ọ bụla, na emeputa awade oru nkwado awa 24 n'ụbọchị, 7 ụbọchị n'izu.",glot500
Igbo,"Sri Lanka Ebe foto si, Getty Images Mmadụ iri na ise ọzọ anwụọla ebe ndị uweojii bịara ibuso ndị omekome a sị na aka ha dị na ogbunigwe ahụ gburu mmadụ narị abụọ na iri ise na Sri Lanka ụbọchị ụka Easter gara aga.",glot500
Igbo,"The omenala ihuenyo-ebi akwụkwọ ụlọ ọrụ AS carbon eriri scraping nkọwa 7 * 50, ogologo dị ka ndị ahịa chọrọ. Nwere ike ahaziri dị ka ahịa chọrọ.",glot500
Igbo,Holmsjön nke an'Iwu na ama esịn ọtụtụ mmiri na oyi. Kart track e mere site n'obere ụgbọala tinyere ọdọ si shorelines oyi. na oge (Mars 2008) ọdọ e zie banyere 4 m tụnyere ndị mmiri n'oge okpomọkụ. The obodo nwere ezi oke ma ọ bụrụ na-agabiga na track zere n'ihi na. Ụfọdụ n'ime ihe ndị magburu onwe ntọala nwere ike n'ezie na-abụ na zuru miri ezu ma ruo mgbe ọdọ jupụtara ìhè.,glot500
Igbo,"2 Dika ọmuma-ihe-unu si di, otú a ka m'maworo, ọbuná mu onwem: Mu onwem abughi onye dara ada kari unu.",glot500
Igbo,Ọ gwara nna ya banyere ya Olee banyere anyị taa na Tavatimsa ụwa na-gbara ya ume ịgakwuru na òkù ndị Buddha ka a nri.,glot500
Igbo,"A mụrụ ya na Memphis, Tennessee, ma zụlite ya na Cordova, Tennessee, ọ hụrụ egwu mgbè ọ dị obérè. Nne ya, Billie Baker Gholson, bụ onye na-ahụ màkà ego nke na-arụ ọrụ dị ka onye na-agụ egwu opera ógè ụfọdụ ma bụrụ onye Afrịka-Amerịka mbụ gụsịrị akwụkwọ na Rudi E. Scheidt School of Music na Mahadum Memphis . Nna ya, G. James Gholson, bụ onye clarinetist lara ezumike nká na prọfesọ egwu na Rudi E. Scheidt School of Music, bụ nwoke mbụ si Afrịka na Amerịka nwere oche mbụ na Memphis Symphony Orchestra. Nna ya bụ onye emeritus nke Memphis Woodwind Quintet na onye na-egwu egwu na United States Navy Band. Nna nna ya bụ onye isi ụlọ akwụkwọ sekọndrị ma nwee ụlọ akwụkwọ sekọndrị aha ya na Washington, D.C. Ndị ezinụlọ ya ndị ọzọ gụnyere nne nne na nwanne nne ya bụkwa ndị egwu ma na-akụzi egwu n'ụlọ akwụkwọ. Drumma Boy na-ekwu na o nwèrè ihe ndekọ n'aka ya mgbe ọ dị afọ atọ na clarinet mgbe ọ dị afọ ise. Nna ya nyere aka n'ịkụziri ya banyere egwu ọdịnala mana ọ bụ nne ya mere ka ọ mata Curtis Mayfield na 1970s rhythm and blues. Gholson bụ onye egwu a zụrụ azụ n'egwú oge ochie, ọ malitere ịme clarinet E-flat mgbè ọ dị afọ isii wee gaa clarinet B-flat. Mgbè ọ dị afọ isii, Gholson malitere ịmụ piano.",glot500
Igbo,"Ọ na-abịa na-enweghị ikwu na ọ bụla backlink na ebe nrụọrụ weebụ nke homepage bụ mgbe niile dị irè karịa ọ bụla njikọ. Otú ọ dị, buru n'uche na àgwà nke backlinks gị esiteghi na site n'ịdị na-ama ewu ewu na ebe nrụọrụ weebụ ha. M na-ekwu na ọ bụ otu ihe dị mkpa na-enwekarị mmasị na ibe ọ bụla ma ọ bụ na a ga-agụkwa ya mgbe niile. N'ụzọ dị otú a, ya bụ, ebe obibi bụ ihe fọrọ nke nta ka ọ bụrụ ihe kachasị ewu ewu na ihe ọ bụla e nyere na ebe nrụọrụ weebụ ọ bụla, naanị n'ihi na ọ ga-abụkarị onye nleta ọ bụla ga-akwụ ya nleta.",glot500
Igbo,"gwa m ụdị nke ọchịchị na mpaghara mpaghara nke Sweden na Poland biko !!! E kewara Sweden na mpaghara 21 Len (lan), a na-ekewa Lan nke ọ bụla n'ime obodo (obodo) na obodo (kommun), ngụkọta ...",glot500
Igbo,"A? ca��a Sa�Y Thu Nguya��t cA�ng khA?ng ta��, nh?�ng Sa�Y L?�u S?�??ng ca??m tha??y cA? ha?? nhA?n a�Y bA?n ca??nh thA� khA?ng A�?�a�?c thoa??i ma??i, ca�� ca??m tha??y kA� la?? tha?? nA�o a??y. Sa�Y Thu Nguya��t nghA� tha?�m khA?ng ca?�n thia??t pha??i nhia�?u chuya��n nh?� va?�y cha��, mA�nh A�i bA?n ca??nh thA� khA?ng pha??i cA�ng ka�? la?? h??n sao? Nh?�ng cua��i cA?ng va?�n khA?ng lay chuya�?n A�?�a�?c tha��nh ca?�u ca��a Sa�Y L?�u S?�??ng vA� Giang ThA�nh VA?n, khA?ng tha�? lA�m gA� khA?c h??n lA� A�A�nh pha??i A�a��ng A? A�i theo ba�?n ha�?.",glot500
Igbo,"Tags: nsogbu corona, coronavirus, agba, ego, mgbazinye nkwụsị, mbelata ụlọ, nsogbu, Government, mgbanwe, nkwado, nchịkọta nkwado, tozo, zzp, zzpers",glot500
Igbo,"Enyimba, Joseph Osadiaye, kwenyere na ụlọ ọrụ ahụ ka nwere ike ịgba aka na nchịkwa egwuregwu Nigeria Football League na oge a mgbe ha mechiri ọdịiche n'etiti ha ma tinye ndị isi Lobi Stars ka ha bụrụ isi asaa na-esote 2-0 nke Wednesday na Go Round.",glot500
Igbo,"8 Ọ̀ bụ anyị kwuo na anyị hụrụ Jehova n’anya, okwu ebie? Mba. Ọ bụrụ na anyị ji obi anyị dum, mkpụrụ obi anyị dum, na uche anyị dum hụ Jehova n’anya, anyị ga na-eme ihe ndị gosiri na anyị hụrụ ya n’anya. (Matiu 7:16-20) Baịbụl kwuru hoo haa na ọ bụrụ na anyị hụrụ Chineke n’anya, anyị ga-edebe iwu ya. Idebe iwu Chineke ò siri ike? Mba. Ihe Jehova “nyere n’iwu adịghị arọ.”—Gụọ 1 Jọn 5:3.",glot500
Igbo,"Ihe ngosi nke PuTTY na ihe omuma ya mere ka nnukwu ngwa ngwa nke ngwa ngwa nke PuTTY ma ọ bụ mmemme ya, ma ọ bụ mmemme na-eji koodu ntinye nke ngwa a iji mezuo otu ọrụ.",glot500
Igbo,"Ihe osise Washington na-ejikarị ihe ndị dị ka ""tape, canvas, acrylic paint, charcoal dust, Black chalkboard paint, akwụkwọ, Black copier toner, acrylik medium, Black ink, Kraft paper, wax coated cotton string, latex house paint, rubber, waya, hot plastic glue na ear cushions"". Ọ kọwara ọrụ ya dị ka ""nke na-anọchite anya"".",glot500
Igbo,"<a href=""http://xn--2-7sby9a9a.xn--p1ai/ass/esli-kurit-chay-chto-budet.html"">テ青オテ堕�ﾃ青サテ青ク テ青コテ堕ε堕�テ青クテ堕づ堕� テ堕�ﾃ青ーテ青ケ テ堕�ﾃ堕づ青セ テ青アテ堕ε青エテ青オテ堕�</a>",glot500
Igbo,"11 ‘Koro kpa nte ubọpisịn ọbọbọde owo ke isịn, kpa ntre ke ami nnam ofụri ufọk Israel ye ofụri ufọk Judah ẹbọbọ mi ke idem,’+ uyo Jehovah edi emi, ‘man mmọ ẹkabade ẹdi ikọt+ mi ẹnyụn̄ ẹdi enyịn̄+ ye itoro ye ediye n̄kpọ ẹnọ mi; edi mmọ ikopke uyo mi.’+",glot500
Igbo,"1xBet Brazil nwere otu nke kasị mma online ịkụ nzọ-enye site na gburugburu ụwa, i nwere ike nzọ na-agbachitere Njikọ, Copa America 2019, Brazil usoro, dị nnọọ edebanye maka nkwado koodu Brazil 2019 1xBet.",glot500
Igbo,"Amụta otú e si golf pụrụ ịbụ na-akpali akpali, ma ịma aka omume ntụrụndụ isonye na. Mgbe ị pụrụ ịnụ ụtọ ịbụ n'èzí, ruo mgbe ị golf na gị mbụ goofu N'ezie, ị ga-amarakwa na ọṅụ nke inwe ike iduzi gị golf bọl kwesịrị ekwesị ebe, -eche ifufe, na-ekere òkè na egwu egwuregwu ndị ọzọ ndị mmadụ. E nwere ọtụtụ ụzọ na-amụta otú e si akpọ golf, ma na ụzọ kasị mma bụ ịzụta ma ọ bụ gbazite a set nke osisi gọlfụ na-aga a anya ụgbọ ala. E ị pụrụ ịmụta otú siwing, see, ihe ...",glot500
Igbo,"Ụfọdụ ruturu si odide mbụ ahụ: ""Monon ho katéchon Arti HEOS oak Mesu genetai"". Ọ pụtara ""onye a esetịpụ ya, ruo mgbe ahụ n'ụzọ, ọ pụrụ ịbụ.""",glot500
Igbo,"Olee otú iji mbanye anataghị ikike WhatsApp enweghị ntụgharị Site Exactspy? Ọ bụ ihe na-akpali akpali maka onye ọ bụla iji mbanye anataghị ikike akaụntụ WhatsApp onye. Whatsapp bụ ihe kasị mma netwọk ngwa nke na-arụ ọrụ ọtụtụ ndị mmadụ. ozugbo WhatsApp malitere, mgbe ahụ ọ tara ahụhụ …",glot500
Igbo,"Enweghị ntụpọ kpụ ọkụ n'ọnụ na mmalite. Ọ bụrụgodị na onye òtù ọlụlụ kwesịrị ịrịọ maka ya. Mgbe ụfọdụ ọ na - eme na ndị ọhụrụ na - enweghịzi oghere ọzọ ... mgbe ejiri ha mee ihe n'ụzọ ziri ezi, ha nwere ike ịdọrọ eriri ahụ n'onwe ha n'oge ahụ. Ọ bụ ya mere na ọ dịghị ihe ọjọọ na ya.",glot500
Igbo,"09:16 clrh           does the koha-comunity have the ""replace text"" extension ? just wanted to rename a category (without editing all pages ;))",glot500
Igbo,"Ozugbo ngwa ahụ mezigharịrị ọrụ na ịtinye usoro ngwanrọ nke smartphone ahụ, windo ngosi ga-apụta ""Download OK""nke na-akwado ihe ịga nke ọma nke manipulations.",glot500
Igbo,"Ngwaọrụ gị akwadoghi ọkpụkpọ mgbasa ozi Aha onyonyo, Nri ogbenye ọgalanya na-erizi Hapụ ya na mmiri abali atọ.",glot500
Igbo,"Ihe ndị ọzọ n'akụkọ a Timothy nwa George Weah ebidola ịsompi na PSG5 Maachị 2018 Vidio, Charly Boy ekwuola na ọ chọrọ ndị ntoroọbịa pụrụiche maka ịchị Naịjiria5 Maachị 2018 Ndị ome ihe nkiri 'Black Panther' gosiri Afrịka n'emume mbido ha31 Jenụwarị 2018 Oscars 2018: Kobe Bryant so na ndị nwere nrite5 Maachị 2018 Isi akụkọ Vidio, Africa Eye: Ndị na-ezu nwaelekere 4 gara aga Gee ntị, BBC Nkejinkeji 33 gara aga NA EME UGBU A Nke na-eme ugbua: Ndị agha Naijiría gbaala ogige ndị tọọrọ ụmụakwụkwọ na Katsina steeti okirikiri Kọwaara m isi akụkọ 4:06 Vidio, Etu m si soro na ndị ọkaibe n'egwuregwu 'Basketball' - Zeke Nnaji, Duration 4,0626 Nọvemba 2020 Image gallery, Foto Diego Maradona: Nlereanya maka ndụ dike a bụ ọkaibe na bọọlụ25 Nọvemba 2020 Image gallery, NBA Draft 2020: Lee Ụmụafo Naịjirịa ahọpụtara isonye tụọ bọọlụ nkata NBA n'afọ a19 Nọvemba 2020 Aston Villa akọọla Liverpool ka ncha nkọta4 Ọktọba 2020 Liverpool akwọọla Arsenal ka awarawa tomanto28 Septemba 2020 Penariti azọọla Man United ọzọ dịka oshimiri Brighton chọrọ iri ha26 Septemba 2020 Herman Hembe : APGA ọ na-ala ala ka ọ na-agbanye mgbọrọgwu?",glot500
Igbo,"Afrikhepri Foundation sur Mmalite nke okwu Afrika: ""Anyị abụghị ndị Africa kama anyị bụ ndị Kamites."" Jul 30, 09:49",glot500
Igbo,"N N o N: A former East German ""secretary for agitation and propaganda"" welcoming the US President N N o N",glot500
Igbo,Steven Gerrard na Sergio Ramos nọ n'ọkwá dị elu na ndepụta nke ọtụtụ ndị na-egwupụ egwuregwu. Ebe E Si Nweta Foto: LB.,glot500
Igbo,"5 E mesịa, ndị mmadụ gara kọọrọ Devid banyere ndị ikom ahụ; o wee zipụ ndị mmadụ ozugbo ka ha gaa zute ha, n’ihi na e menyewo ha ihere nke ukwuu; eze wee sị ha: “Nọrọnụ na Jeriko+ ruo mgbe ajị agba unu rujuru. Mgbe ahụ, unu ga-alọta.”",glot500
Igbo,"Rhunmwuda ọni, e Jerimaia na suẹn gha yobọ sekhae ne emwa nii wẹẹ, a gha rrie iran oya deghẹ iran ma na fiwerriẹ. Wẹ roro ẹre wẹẹ, emwa nii ru emwi ne Jerimaia tae ra?— Ẹn o. Iran na yae gha gbogiẹ, ra ohu ẹre na gha mu iran. Eso vbuwe iran na kue gha hoo ne iran gbẹ rua! Vbe uwẹ a roro ghẹ ekhọe Jerimaia ghaa ye hẹ?— Ohan na gha muẹn, ọ na kha wẹẹ, ‘Ii khian ghi werriegbe guan vbekpae Jehova.’ Sokpan egbe gele wọọ irẹn ra?— Ẹn o, egbe ma wọọ re. Ọ hoẹmwẹ e Jehova sẹrriọ wẹẹ, ọ ma sẹtin dunuyi nẹ ghẹ guan vbekpa re. Kevbe wẹẹ, rhunmwuda ne egbe ma na wọọ e Jerimaia, e Jehova ma kue na gbẹ rua.",glot500
Igbo,"Okwu a kwesịrị ntụkwasị obi : N’ ezie , ọ bụrụ na anyị na ya nwụkọrọ ọnwụ , anyị na ya ga- adịkọkwa ndụ ;",glot500
Igbo,A Nazarite nwere tinyere mmanya mmanya. Ma Jizọs abụghị a Nazarite n'ihi na ọ ṅụrụ mmanya ma si otú anyị na-aghọta na ọ bụghị ndị nwere ogologo ntutu isi.,glot500
Igbo,"Leenụ, site n’ụbọchị nna nna anyị hà dara n’ụra ọnwụ, ihe niile ka dị kpọmkwem otú ha dị site ná mmalite okike.",glot500
