language,text,source
Igbo,"Mike bụ onye Uzoakoli na Abia State, Nigeria. A mụrụ ya na Septemba 21, 1981 na Lagos . Ọ gara Federal Government College, Wukari, Taraba na Archbishop Aggey Memorial school, Lagos tupu ọ mụọ Accounting na Nnamdi Azikiwe University .   Ọ rụrụ ọrụ dị ka onye ọrụ ụlọ akụ tupu ọ bụrụ onye na-eme ihe nkiri.  O meela n'ọtụtụ ihe nkiri Nollywood. A họpụtara ya maka onye na- eme ihe nkiri kachasị mma na ọrụ ndu maka arụmọrụ ya na ihe nkiri ""The Assassin"" na Africa Movie Academy Awards na 2009.    na nhọpụta maka Onye na-eme ihe nkiri kachasị mma na Africa Magic Viewers Choice Awards. .",glot500
Igbo,"Gbasaa mbupu bụ otu ụzọ dị ịtụnanya sirila hụgoro ndị mmadụ n'otu n'otu si na ndị azụmaahịa nkịtị na ụdị ndị a ma ama bụ ndị a na-akwanyere gburugburu ụwa. Inweta ihe omuma banyere oge nnyefe & onu ahia, nloghachi & mgbanwe ahia bu ihe di nkpa maka ndi nwe ulo ahia. Lee ihe atụ ise nke ụlọ ahịa mbuba na-aga nke ọma:",glot500
Igbo,"Anadu mepụtara fim ya na ulo oru onwe ya no Blondes Production. [1] O were ihe dika ubochi iri na-asaa ka e wee meputa ya bu ihe nkiri ebe Anadu ruru ọrụ dị ka onye nduzi, onye edemede, onye na-emepụta ihe, onye na-eduzi onye nlekọta, onye na-ede akwụkwọ, onye na-ede ego, na onye ọka iwu. O bu ego ezinulo ka eji wee meputa fim ahu. Ezinulo Anadu wetara pasenti 70 , ebe onye ya na ya na-arụ ọrụ Arie Esiri wetara pasenti 30 fọdụrụnụ. [2] B maka Nwa Nwoke (2013) BFI London Film Festival na 2013. E gosiputara ya na AFI Fest ebe o guru ugo mmeri AFI Fest 2013 tinyekwara onyinye ego nke $ 5,000. Emere ihe nkiri nke South Africa na Durban na July 19, 2014. [3]",glot500
Igbo,"Nsogbu na a mara mma campus n'ókè site na-egbuke Rideau River na Canal, Carleton bụ nnọọ nkeji si n'obi nke na anyị na mba ọchịchị na-arụ mfe ohere ka ọtụtụ òtù, mkpakọrịta na ulo oru nke na-amụba na Ottawa. Ọtụtụ n'ime Ontario si eduga elu eji ụlọ ọrụ gburugburu anyị campus ebe ọnwụ ihu nnyocha enyekwara na ukwuu otutu ozizi na-edozi mere eme nsogbu. Òtù nke a ike, research-kpụ ọkụ n'ọnụ mahadum, Carleton si ngalaba na mkpara na-enye a elu mmụta ahụmahụ anyị ezi ụmụ akwụkwọ ndị ji ọṅụ n'eto si ọ bula anāchi achi na n'aka n'elu 100 mba gburugburu ụwa.",glot500
Igbo,The software kee Nkuzi na n’ihu. The software nwere ọtụtụ ihe bara uru atụmatụ na-enyere aka na-eji ihe oyiyi faịlụ nke dị iche iche formats.,glot500
Igbo,"Kwụrụ n’ihe i kwuru. Nwa gị nwere ike bewe ákwá ma ọ bụ rịọwa gị arịrịọ ka ọ mara ma ị ga-agbanwe obi gị. Ọ bụrụ na o mee ihe a mgbe unu nọ n’ụlọ, gịnị ka ị ga-eme? Ihe otu akwụkwọ kwuru banyere ịzụ ụmụaka kwuru bụ: ‘Gwa ya ka ọ gaa n’ime ụlọ nọrọ, obi ya dajụọ, ya pụta. Gwakwa ya na ị chọghị ịnụ ihe ọ bụla ọ chọrọ ikwu maka na ị gaghị agbanwe obi gị.’ O nwere ike isitụrụ gị ike na mbụ ịgwa nwa gị ụdị ihe a, nwa gị nwekwara ike iche na ị na-egwu egwu. Ma, ọ ga-ege gị ntị ma ọ chọpụta na ị na-akwụ n’ihe i kwuru.—Amaokwu Baịbụl ga-enyere gị aka: Jems 5:12.",glot500
Igbo,"Anyị nwere ebook efu ka anyị nye gị n’aka Kaelin Tuell Poulin, onye guzobere LadyBoss Movement. Ọ na-enye akwụkwọ milkshakes ya na akwụkwọ nri sọọsọ adịghị mma maka obere oge naanị! Ejikwa akwụkwọ 61 Healthy Healthy Milkshakes & Smoothie Recipes! Pịa ebe a maka…",glot500
Igbo,"Ọ bụrụ na enweghi nhụcha anya na mpaghara nchịkọta rosette, ma enweghi uto na osisi ahụ n'oge dị elu na-egosi nsogbu na ọnọdụ na-eto eto, ị kwesịrị ịnwa igbanwe ọnọdụ nke osisi ahụ:",glot500
Igbo,"47Ndoꞌ ticwii xuee tyoꞌmo̱o̱ⁿ nda̱a̱ nnꞌaⁿ naquiiꞌ watsꞌom tꞌmaⁿ. Sa̱a̱ nnꞌaⁿ na cwiluiitquiendye nda̱a̱ ntyee ñequio nnꞌaⁿ na cwitꞌmo̱o̱ⁿ ljeii na tqueⁿ Moisés, ñequio nnꞌaⁿ na cwiluiitquiendye naquiiꞌ tsjoom, tyolꞌueeꞌndyena chiuu ya nlꞌana na nlaꞌcueeꞌna jom. 48Sa̱a̱ meiⁿchjoo tileicaliuna chiuu ya nlꞌana ee chaꞌtsondye nnꞌaⁿ tyocantyjaaꞌ nꞌom ñꞌoom na tyotseineiiⁿ nda̱a̱na.",glot500
Igbo,"Oron Museum bụ ụlọ ngosi ihe mgbe ochie dị na Oron, Nigeria . E guzobere ya bụ ụlọ ngosi ihe mgbe ochie ahụ n'afọ 1958 iji nabata narị mmadụ asatọ (108) a maara (Ekpu Oro) nke ndị Oron nke a kwenyere na ọ bụ otu n'ime ihe osise osisi kachasị ochie na nke kachasị mma na Africa. N'oge agha obodo, e bukọrọ ọtụtụ n'ime ihe osise osisi ahụ ma mebie ihe ngosi nka ahụ nke ukwuu. N'afọ 1975, e megharịrị ihe ngosi nka ahụ ma taa, ọ nwere ihe ndị fọdụrụ n'ime ihe ọkpụkpụ osisi na ihe ndị ọzọ sitere na Naịjirịa. Ụlọ ihe ngosi nka ahụ nwekwara ihe ngosi nke bunkers eji eme ihe n'oge agha obodo yana obodo ọrụ aka.",glot500
Igbo,Ihe di na nwunye ga-eme ka ha nwee ike ịna-adịkwu ná mma bụ ịna-ekwurịta okwu nke ọma (A ga-akọwa ya na paragraf nke 15),glot500
Igbo,"Na mgbakwunye, NBL webatara mineral dị iche iche na-abụghị mmanya na ihe ọṅụṅụ na-atọ ụtọ n'okpuru akara Rainbow nke gụnyere, Krola, Tip Top Tonic Water na mmiri soda Sundowner. O webatara Gulder n'ahịa ma nweta ikike ịzụ ahịa lemon dị ilu na Schweppes na mba ahụ. N'afọ 1972, ọ rere ihe ọṅụṅụ na-abụghị mmanya na-aba n'anya.",glot500
Igbo,"N'ikwu banyere otu esi emeso oke mmiri, ndị dọkịta na-ekesa ọgwụgwọ laser. Usoro a na-enwe mmetụta dị nro na ọnya ọnya site na ọkụ ọkụ laser. Tupu oge eruo, a na-eji ngwọta iodine emepụta olu, nke na-enyere aka depụta ókè mmiri ahụ. N'okpuru ọrụ nke ọkụ, evaporation nke mmiri si na mkpụrụ ndụ ndị mebiri emebi, na-esi na nke ha na-ebibi. Igwe mmiri a na-eme ihe na-adịghị mma na nke dị irè. Mgbe ọgwụgwọ gasịrị, a dịghị emecha scars.",glot500
Igbo,"N'afọ 2010, ụlọ ọrụ nche na-arụ ụlọ na ebe ndị na-elekọta mmadụ. Ọ bụ ụlọ ndekọ osisi nwere atụmatụ ala nke ihe dịka 8 × 12 mita - ọ bụkwa ọrụ ọkwa ọkwa Pacholík. N’agbata afọ 2015 na 2016, akụkụ blọk gbakwunyere ụlọ a. N'oge ahụ, etinyere ụlọ ọrụ ọkụ fotovoltaic nke nwere ihe dị ka 6 kWp. Igwe ọkụ a na-arụ ọrụ na ọnọdụ agwaetiti ma na-enye naanị ụlọ elu a.",glot500
Igbo,"Na nke afọ a , onye mịnịsta na- ahụ maka ọlụ , Dọkịta Chris Ngige , toro ndị ọrụ maka ihe ndị ha n’ etinye na mmepe obodo anyị .",glot500
Igbo,"Airportgbọ elu ọdụ ụgbọ elu Istanbul bịanyere aka na ọdụ ụgbọ elu International nke China na South Korea; Na mgbakwunye na usoro ya pụrụ iche, akụrụngwa siri ike, teknụzụ dị elu na ahụmịhe njem dị elu, [More ...]",glot500
Igbo,"Ka a na ahazi nkiri Man United na Sevilla na asọmpi taa nke ga-eme n'ama egwuregwu Ramón Sánchez Pizjuán dị na Spain, onye ọnu na erụ na okwu banyere egwuregwu bọọlụ bu Emeka Offor gwara BBC Igbo ka ihe nwere ike si kwụrụ.",glot500
Igbo,"Otú ọ dị, ị kwesịrị ị na-maara nke nkebi ahịrịokwu metụtara na online ịgba chaa chaa na mgbapụta nke na-enye.",glot500
Igbo,"Ngwa lee ka BBC Igbo si agba ha n'anwụ: Sharon Ikeazor Ebe foto si, Twitter/Sharon Ikeazor Nkọwa foto, Ikeazor rụrụ dịka onyeisi ndị Pension Transitional Arrangement Directorate (PTAD) tupu e mee ya minista Ikeazor bụ Minista steeti na-ahụ maka Gburugburu nke Bekee kpọrọ Ministry of Environment.",glot500
Igbo,"Otu nwa agbọghọ bi n’Ọstrelia aha ya bụ Anna chọrọ ịmụta asụsụ ndị Latvia, bụ́ asụsụ ndị obodo mama ya. Ọ sịrị: “Ndị ezinụlọ anyị na-akwado ịga Latvia, m chọrọ ka mụ na ụmụnne m nwee ike ịna-akparịta ma anyị ruo.”",glot500
Igbo,"Mbon Sanhedrin ẹfiak ẹdọhọ Jesus ẹte: “Edieke afo edide Christ, sian nnyịn.” Jesus ọdọhọ mmọ ete: “N̄kpetetịn̄ nnọ mbufo, mbufo idinịmke ke akpanikọ. Akan oro, edieke mbụpde mbufo mbụme, mbufo idibọrọke.” Edi Jesus anam mmọ ẹdiọn̄ọ ke imọ ke ẹketịn̄ ẹban̄a ke Daniel 7:13. Enye ọdọhọ mmọ ete: “Ọtọn̄ọde ke emi, Eyen owo editie ke okopodudu ubọk nnasia Abasi.”—Luke 22:67-69; Matthew 26:63.",glot500
Igbo,"Na nkebi nke ọzọ, anyị ga-eleba anya n'ihe anyị nwere ike ime ma ọbụrụ na mmiri na-agba agba dị ọcha kọrọ ụkọ.",glot500
Igbo,"N'ọnọdụ ọ bụla, ọ bụrụ na ọ na-aga n'ihu dị ka nke a, ọtụtụ ụmụ nwanyị agaghị enwe ohere ịlụ di ọzọ! Ha tiri mkpu, sị ibe ha. ""Ọ bụ nke a na-anụbeghị,"" ka insinu nke…	GỤKWUO",glot500
Igbo,"Chi bụ isi nke ndị Uruan bụ Atakpor, nke sitere na Southern Cameroons, ma kwenye na ọ bụ nnukwu Nne na-ejikọta ya na mmiri. A na-ewere Atakpor ahụ dị ka chi nwanyị na dịka onye na-arụ ọrụ nke ndị Uruan nwere ike isi na Chineke (Chineke) kparịta ụka. Taa, ndị Uruan kwenyere na chi Nne ukwu a bi n'ime mmiri ahụ nke a na-akpọ ugbu a dị ka Akwa Akpa Uruan (Oké Osimiri Uruan).",glot500
Igbo,"Ugbu a, ị maara na ọ bụghị naanị ndị Himalaya ka a ma ama maka Nepal. A pụkwara ịkpọ Kathmandu isi obodo nke ihe ncheta na ịzụ ahịa ndị dị ọnụ ala, euphoric ịzụ ahịa na ihe ndị a na-apụghị ichefu echefu. Echefukwala naanị isi iwu nke ndị njem nleta - ịzụ ahịa na ọzọ ahịa.",glot500
Igbo,"Allalou onye nna ya nwụrụ n'oge ọ dị obere malitere ịrụ ọrụ iji kwado ezinụlọ ya mgbe ọ dị afọ iri na atọ. Ọ rụrụ ọrụ dị ka onye na-ere ọgwụ, onye na-ere akwụkwọ na onye ọrụ ụgbọ okporo ígwè. Mmasị ya na ihe ngosi nka gosipụtara onwe ya n'oge. Mgbe ọ dị afọ iri na ise, ọ malitere ịgagharị na Foyer du soldat ebe ọ na-akpọ egwu ma na-abụ abụ (ọ bụ onye na-agụ egwu na-atọ ọchị), na-aghọ onye na-eme ihe nkiri. Ọ matara ihe nkiri n'oge ọ dị obere. Ọ gara galas Karsenty na ihe ngosi nke Georges Abiad na ụlọ ọrụ ihe nkiri Egypt nke Azzedine na mmalite afọ iri abụọ. Nzukọ a na ihe nkiri nyere ya echiche ịmepụta ihe nkiri. N'ihi ya, ọ malitere imepụta ihe osise nke na-ekwu maka isiokwu ndị sitere na ndụ kwa ụbọchị: alụmdi na nwunye, ịgba alụkwaghịm, ịṅụbiga mmanya ókè. A gụnyekwara isiokwu ndị a n'egwuregwu ndị e mere mgbe 1926 gasịrị. Mmekọrịta ya na ndị Europe na ọkachasị Edmond Yafil, nnukwu onye maara egwu oge ochie nke Algeria nke tinyere ndụ ya na mmepe nke nka a, mere ka ọ ghọta ma nwee ekele maka egwu.",glot500
Igbo,"N'Ofesi Ebe foto si, Getty Images Nkọwa foto, Ndị otu na-ere ọgwụike na ama ndi nchekwa aka na mba Mexico Onyeisiala Mexico bụ Andres Obrador ekwuola si ee na ha tọhapụrụ Ovidio Guzman bụ ọpara onyeisi ndị ọgwọike Sinolao Cartel eji El chapo mara.",glot500
Igbo,"“Ọ malitere nanị izu abụọ anyị gbasịrị akwụkwọ,” ka Lourdes na-ekwu n’olu dị ala. “N’otu oge, ọ kụpụrụ m ezé abụọ n’ọnụ. N’oge ọzọ, ezere m ya, aka ya wee gaa kụrie n’ebe nkowe ákwà anyị. Ma ọ bụ ọnụ ọ na-akọ m na-afụ ụfụ karị. Ọ na-akpọ m ‘ewu iberibe,’ na-emesokwa m dị ka a ga-asị na enweghị m ọgụgụ isi. Achọrọ m ịla, ma olee otú m ga-esi kpọrọ ụmụ atọ laa?”",glot500
Igbo,"15 Chaˈtsondyo̱ jaa na laxmaaⁿya na canda̱a̱ˈ cwilaˈyuˈya nˈo̱o̱ⁿya matsonaˈ na laaˈtiˈ cˈoomˈ nˈo̱o̱ⁿya. Ndoˈ xeⁿ waa cwiicheⁿ nnom na mˈaaⁿˈ nˈomˈyoˈ cantyja ˈnaaⁿˈ ñˈoomwaaˈ, nntseijndo̱ˈ Tyˈo̱o̱tsˈom nˈomˈyoˈ cantyja ˈnaaⁿˈnaˈ. 16 Sa̱a̱ ñˈoom na mayuuˈcheⁿ, macaⁿnaˈ na tjoomˈ cˈo̱o̱ⁿya cantyja ˈnaaⁿ ñˈoom na jnda̱ toˈño̱o̱ⁿya.",glot500
Igbo,"E mesịa , mmadụ niile bịara inye Devid nri iji gụgụọ ya obi n’ otu ụbọchị ahụ , ma Devid ṅụrụ iyi , sị : “ Ka Chineke mee m otú a , ka ọ tụkwasịkwa ihe na ya , ma ọ bụrụ na m detụ nri ma ọ bụ ihe ọ bụla ọnụ tupu anyanwụ adaa !",glot500
Igbo,"Nke a bụ ụlọ ahịa egwu kachasị elu na Prague, na-enye ezigbo egwuregwu dị iche iche na mgbakwunye na ọnụ ọgụgụ dịgasị iche.",glot500
Igbo,"12:4 Ha ga-emechi ibo ya n'okporo ámá a na, mgbe olu onye na-atakwa ikikere ọka ga-adị umeala, ha ga-amakwa jijiji mgbe ọ nụrụ a na-efe efe ihe, na nta niile nke song gāghọ ntị chiri.",glot500
Igbo,"Onye bụbu Gọvanọ Abia steeti ma bụrụkwa sinetọ na-anọchite anya Abịa Sentralụ bụ Theodore Ahamefula Orji, ekwuola uche ya banyere Indigenous People of Biafra (Ipob) na Movement for the Actualisation of Sovereign State of Biafra (Massob) na nweta Biafra.",glot500
Igbo,"Na Metalist, Papu dara ogbenye gbalịsiri ike na ihe niile gụnyere ọzụzụ. Ebe E Si Nweta Foto: Instagram.",glot500
Igbo,"Eze nwụrụ na 31 Jenụwarị afọ 2012 na Anambra Steeti ka ọ rịachara obere ọrịa, ọ dị afọ iri atọ na asaa.",glot500
Igbo,"10 Akpa, nnyịn isinọ enọ ke imaesịt ke ntak emi imade Jehovah inyụn̄ iyomde ndinam “se inemde enye esịt.” (1 John 3:22) Ke akpanikọ, esịt esinem Jehovah aban̄a andituak ibuot nnọ enye emi ọnọde enọ ke imaesịt. Ẹyak ineme ikọ oro apostle Paul eketịn̄de aban̄a nte mme Christian ẹkpenọde enọ. (Kot 2 Corinth 9:7.) Owo isinyịkke-nyịk ata Christian ọnọ enọ; enye isinyụn̄ inọhọ mmen̄e mmen̄e. Enye esinọ sia enye “ebierede ke esịt esie” ndinọ. * Oro edi, enye esinọ ke enye ama ekekere aban̄a se oyomde ẹnam ye nte imọ ikemede ndinam se ẹyomde oro. Jehovah “amama owo eke ọnọde ke idatesịt” ntre. Bible en̄wen akabade itie oro ntem: “Abasi amama mbon oro ẹmade ndinọ enọ.”",glot500
Igbo,"ekwe Machine , lathe , Mpempe akwụkwọ Metal Machines, Universal lathe Machine , Metal lathe , lathe Machine ,",glot500
Igbo,“Ntre nnyịn imekeme ndinen̄ede nnyene uko ndọhọ nte: ‘Jehovah edi andin̄wam mi; ndifeheke ndịk. Nso ke owo ekeme ndinam mi?’ ”—Mme Hebrew 13:6,glot500
Igbo,"Ị ga-enwe ike-eji ruo eru maka a ego ịzụta n'ụlọ gị gị na, ma ọ bụrụ na gị na ngwa na-adịghị anabata.",glot500
Igbo,Knuckling - Nke a na okwu na-eji na-akọwa ụdị nke selvage nwetara site n'ijikọta n'akụkụ abụọ nke waya nsọtụ na mgbe ekwe waya agwụ azụ n'ime a mechiri emechi akaghị. Abụkarị eti bụ ọkọlọtọ gwụla ma ma kwuru.,glot500
Igbo,"Pọl ka si njem nke atọ ọ gara ná mba ọzọ ikwusa ozi ọma lọta ma nọrọ na Jeruselem. Ọ ga-abụ n’afọ 56 Oge Anyị. E ji Pọl eji, na-achọ ikpe ya ikpe. Ma, ndị iro Pọl achọghị ka e kpee ya ikpe. Ha chọrọ igbu ya! N’ihi ya, ha kpara nkata ka ihe dị ka ụmụ nwoke iri anọ chechie Pọl n’ụzọ gbuo ya.",glot500
Igbo,Bbahut waar aisa hota hai. Ki aapko aapke whatsapp freinds ke lge huye status ko download krne ka man krta hai. Fir ham use youtube wagaira pe find krte hain. Fir bhi nhi milta. To aaap use kaise download kre.,glot500
Igbo,"8 Ọ bụ ya mere ihe otiti ya+ ga-eji bịa n’otu ụbọchị, ya bụ, ọnwụ na iru uju na ụnwụ, a ga-akpọkwa ya ọkụ kpamkpam,+ n’ihi na Jehova Chineke, bụ́ onye kpere ya ikpe, dị ike.+",glot500
Igbo,"Balogun Ajeniya, Oshodi Tapa, Balogun Agbaje, Disu Kujeniya, Braimoh Iyanda Oloko na Posu bụ ụfọdụ n'ime ndị agha nwere obi ike na Kosoko nọ na Epe. Ụfọdụ n'ime ndị isi a ghọrọ ndị Alakụba. Dịka ọmụmaatụ, Balogun Ajeniya, onye mechara bụrụ nnukwu onye na-akwalite Islam na Epe bụ otu n'ime ha. Ndị a tọghatara mechara guzobe obodo n'okpuru nduzi nke Mallam Idris Saliu Gana, onye bụ Imam na Lagos. Nke a bụ ihe kpatara mgbasa nke Islam na obodo Epe ruo taa. Okwu ahụ bụ ""Epe Onikorani"" bụ n'ihi mgbasa nke Islam na Epe. N'ịghọta mmeso e nyere ya na Epe, Kosoko nyere otu n'ime ụmụ ya nwanyị aha ya bụ Kusade na Ijebu Chief, Adebawon nke Idogun n'alụmdi na nwunye; Adenusi bụ ngwaahịa nke alụmdi na nwunye ahụ.",glot500
Igbo,Firstzọ nke mbụ bụ mkpebi siri ike site n'ọdịdị n'ozuzu ya na imetụ aka. Ugwu orchid gbasiri nma (aka ekpe) na oruru (nri) nri,glot500
Igbo,"Anyị ga-eziga gị nkọwa ụlọ akụ anyị maka ịkwụ ụgwọ, nkwenye nkeadreesị adreesị, mgbe ahụ, anyị ga-akpọtụrụ gị site na ekwentị maka ịga n'ihunkọwa.",glot500
Igbo,"O wee si n’ ụzọ mbata dị n’ akụkụ ọnụ ụzọ ámá kpọbata m n’ ụlọ dị nsọ ebe ndị nchụàjà na- anọ eri ihe , bụ́ ndị chere ihu n’ ebe ugwu , ma , lee !",glot500
Igbo,"Site na nyochacha nke MCSE na Data Platform, ị nwere ike ịgwa azụmahịa ndị nwere ike ị nwere ike iji nlezianya na-emeso nlekọta nchịkwa SQL ma na-elebanye anya na nhazi usoro nhazi nke bụ nke na-echere ndị ọzọ. Asambodo ahụ na-agwakwa òtù dị iche iche nke onye nkwuputa nkwupụta ahụ nwere ike ime nchịkwa data ma igwe ojii na ụlọ dị irè. Achịkọ nke ule ise dị iche iche kwesiri ka agwụchaa ma ị nwere ike tinye oge dị mkpa n'ogologo izugbe gị na SQL Server.",glot500
Igbo,"Anyị bụ ndị ọkachamara Ugbo Akuku Ike manufacturers & suppliers / factory from China. Ebube Ugbo Akuku Ike na akwa dị elu dịka obere ọnụahịa / ọnụ ala, otu n'ime Ugbo Akuku Ike na-eduzi ụdị aha si China, ZHEJIANG FIZZ NEW ENERGY CO.,LTD .",glot500
Igbo,Ahụgbeghi Nnamdị Kanu kemgbe ndị otu ya si na ndi agha Naịjirịa wakporo be nna ya. Ndị agha Naịjirịa na-agọ na Kanu anọghi ha na-aka.,glot500
Igbo,"tnig .... ekele maka Ama, ma otu ajụjụ - ọ dịtụwo mgbe i n'ezie mere ihe a? Ọ dịghị iwe, ma m na-agbalị ya na mgbe rigoro gara aga 1200 ft. Si na-ekpo ọkụ na-elu-na runway. Ọ bụ eleghị anya naanị m, kama ọ bụ naanị na onye m nwere nsogbu (35 - 45 ụgbọ elu si ebe a). Ahụ na-agụnye ụfọdụ n'ime ndị kasị ibu Boeing, lockheed, ma ọ bụ ndị Russia nwere na-enye. M na-eche m zutere na egwuregwu na ya gburu mmụọ m. M na-eche ""ika x"" nwere otu na-enye. M ga-enye ya a laa, ma ọ bụrụ na m na-ada (Rip), agwa nwunye m na ọ bụ nri.",glot500
Igbo,"Ọ bụ ezie na mmalite nke Moobile egwuregwu a cha cha na awade ụgwọ site na Ekwentị Bill Blackjack bụ Bingo game, na Moobile egwuregwu a cha cha na awade ịkwụ ụgwọ site Phone Bill Blackjack saịtị ahụ bụ tọrọ ụtọ mix nke ụfọdụ ịtụnanya ohere mpere egwuregwu na enwe cha cha egwuregwu dị ka Blackjack, Ruleti wdg ... na a nkwa nke mgbe niile emelite ha egwuregwu ụlọ akụ",glot500
Igbo,"Zoë Wicomb (amụrụ 23 Nọvemba 1948) bu onye odee na ọka mmụta akwukwo nke South Africa na Scott nke biri na UK kemgbe 1970.  N'afọ 2013, e nyere ya ihe nrite Windham–Campbell Literature Prize maka akụkọ ifo ya.",glot500
Igbo,"NDỊ MMADỤ na-ekwu ihe dị iche iche banyere ndụ na ọnwụ. Ụfọdụ na-ekwu na ọ bụrụ na ha anwụọ na ha ga-aghọ ihe ọzọ ma ọ bụ gaa ebe ọzọ biri. Ndị ọzọ na-eche na ha ga-alọ ụwa ma ha nwụọ. E nwekwara ndị na-ekwu na mmadụ nwụọ, nke ya agaala.",glot500
Igbo,"Kemgbe ahụ ọ rụrụ na nkwado nke Mobb Deep, Wu-Tang Clan, Kool G Rap, and Notorious B.I.G., gbakwunyere ndị mmepụta egwu dị ka Erick Sermon, Trackmasters, DJ Quik, The Alchemist, J-Zone, and Ayatollah. Ọ pụtara na albọm atọ niile kpụ ọkụ n'ọnụ nke Rawkus gbakwunyere nrepu otu ma ọ bụ abụọ nke albọm WWF Aggression .Ka otuCapitol Records weturu obere ezumike( nke ọ nwere ohere ya dekọ albọm n'ewepụtaghị bụ, American Lowlife), Thorburn bịanyere aka nkwekọrị́ta na labeelụ nọọrọ onwe ya bụ Nature Sounds ma wepụta ọrụ mbụ ya bụ, Die, Rugged Man, Die.[1] Na 2013, Thorburn wepụtara albọm nke abụọ bụ, Legends Never Die, site n'aka ọrụ Nature Sounds.[2]",glot500
Igbo,"Number nke zuru-ọnụ ọgụgụ ndị nkụzi bụ 1560 mmadụ. si ha 17% nwere Dr. Sci. degrees na zuru prọfesọ utu aha, na 56% nwere Ph.D. degrees.",glot500
Igbo,"Emelitere na 14 / 05 / 2015 : Version 2.0 - Batrị ọhụrụ VC, Avionic, Nav-GPS, Autobrake, Lights, Deice, Fuel Pump and Generator switches, Master warn, TCAS alert, Fire gear, FMC, page fuel, EICAS, Callouts, new right / mid seat VC anya na usoro eletrik reworked. Tinyere na ọ bụ Bob Chicilo nke kachasị na-agbapụ ọkụ.",glot500
Igbo,"₪*BEGUM*RAZIA*ALI*₪ bring my ex girlfriend back by wazifa Northern 213958 | Kupatana - Mobile Phones, Cars, and Homes in Uganda",glot500
Igbo,"Ọ dị mkpa ime ka a mata na Igbo kwere na naanị otu na ndị a niile ezuola imetọ ala; ya bụ obodo. Niihi ya, ọ gaghị atụ gị n’anya ịchọpụta na o nwere ka aka gị si dị n’ihe so emerụ obodo anyị oge ugbua.",glot500
Igbo,"10 Ná Ndị Hibru isi iri na otu, e dere aha ndị ohu Jehova iri na isii, bụ́ ndị họọrọ iji ikike Jehova nyere ha kpebie ihe dabara n'uche ya.",glot500
Igbo,"Ebe nwere ọtụtụ ihe omume dị maka ndị agadi, ụmụaka na hart na ụmụntakịrị, na-eje ije, E nwere ọtụtụ hikes nwere ike ịhọrọ site na ebe ị na - arụ ọrụ, ị ga - enwe obi ụtọ na ebe obibi dị egwu, na ọgaranya na akụkọ ihe mere eme na nleta, gaa na ebe ntụrụndụ nke ntụrụndụ, Highland Castles, Gardens, reserves, wildlife, forestland, wetlands, mountains, rivers, lochs, mudflats, ọnụ ugwu na oké osimiri dị iche iche gburugburu,",glot500
Igbo,"to all my frenz, i dun care anymore....i dun care what u said...i dun care what u think... i juz dun care!!! if u hate me go 2 hell...if u like me...i'll treat u nicely...n etc! i hv learn something ""luv myself more than anyone else""...so",glot500
Igbo,1996 Mụ na Susan Kelliher na Linda McCrae. African Ethnonyms. Index to Art-Producing Peoples of Africa. New York: G.K. Hall and Co. An Imprint of Simon and Schuster Macmillan. London: Prentice Hall International. 378pp.,glot500
Igbo,Mberede ike mbanye odida bụkwa otu n'ime ndị ikpe na-eme ihe dị ka ihe ịrịba ama ma ọ bụ mgbaàmà na nke a.,glot500
Igbo,You are here: Home / Altamont Regional Rail Working Group / WHEELS Accessible Advisory Committee / WAAC_Agenda_100114,glot500
Igbo,"Unu emeela n'ịgbajọ 'RevolutionNow' - Onyeisiala Buhari Ebe foto si, @Mbuhari Ụlọọrụ onyeisiala ekeleela ndị Naịjirịa maka apụtaghị ịbịa soro mee ngagharịiwe 'Revolution Now' ụbọchị Ọgọst 5,2019 dịka ọtụtụ ndị gawara mkpa dịịrị ya.",glot500
Igbo,Na-eme ya n'agbanyeghị na-adọrọ mmasị na ị nwere ike ịnye gị akụkọ na ndị ọzọ ahịa na-eji ndị ọrụ na-eme atụmatụ peeji nke dashboard.,glot500
Igbo,"16 Ekem Maacah, kpa n̄wan Machir, aman eyeneren onyụn̄ osio enye enyịn̄ Peresh; eyeneka esie onyụn̄ ekere Sheresh; ndien nditọ esie ẹkedi Ulam ye Rekem.",glot500
Igbo,'Igwe Aguleri ọhụrụ abụghị Igwe anyị' Eze kwukwara na obi dị ndị Aguleri mma n'ebe eze ọhụrụ ha nọ ma kwuo na esemokwu gbasara ocheze bụ n'ime ezinaụlọ Idigo ka o jedebere.,glot500
Igbo,"Land maka ire ere Chaloklum Koh Phangan, oké osimiri echiche, rere kwa rai, 16 spokes dị chanote aha. Land for ...",glot500
Igbo,"Ebe foto si, Getty Images Ụbọchị taa abụghị ụbochị ọma nye ndị Wolves dịka ndị Chelsea jiri goolu saa ha ahụ.",glot500
Igbo,"Ọmwa nọ rhie egie ebe ẹre ukọ Pọl ghaa khin, urhuẹvbo eva ẹre ọ vbe gha zẹ. (Iwinna 5:34; 21:37, 39; 22:2, 3) Ọrheyerriọ, adia ni rre Baibol ẹre Pọl ya gha ru azẹ ne egbe ẹre, ọ ma hẹnhẹn egbe yan irẹnmwi ọghe owebe nọ yo. (Iwinna 17:2; 1 Kọr 2:6, 7) Ọna ẹre ọ si ẹre ne Pọl na gha mwẹ adogbannọ vbe iwinna ikporhu iyẹn nọ maan, ẹre ọ vbe zẹe ighẹ ọ ghaa mwẹ ayayẹro ọghe arrọọ etẹbitẹ vbe ẹrinmwi. (2 Tim 4:8) Vbene ẹmwata, aro ne Osanobua ya ghee emwi ẹre ọ maan sẹ ọghe emwa nagbọn. Ma ghaa ya aro ne Jehova ya ghee emwi ghee ẹre, ọyẹnmwẹ ẹre ọ khian gha sẹ ima, erriọ emwi hia ne ima ru khian vbe ya gha dinna odẹ. E Jehova i gbagbae ye ima egbe ne ima gha mwẹ egbe iziro ekhọe ọghe irẹn. “Ọguọmwadia esi kevbe nọ wan” kẹ kevbe ediọn vbe iko i sẹtin dia iziro ọghe ima. (Mat 24:45; 2 Kọr 1:24) Dọmwadẹ ima ẹre ọ khian hia vbe odẹ ke odẹ, ne ima mieke na sẹtin gha ghee emwi vbene e Jehova ghee ẹre. w18.11 20-21 ¶12-13",glot500
Igbo,24 DADU1 Duchesne Duchesne NA NA NA NA NA NA NA NA NA 1200 1800 420 2020-06-07 4410 1490 05-17 06-20 2506 Peak Flow Forecasts Are Regulated Forecasts Based On Upstream Diversions And Regulation,glot500
