language,text,source
Igbo,"Ndi nne na nna ya abua na Ms. Hernan Otamendi bi na isi obodo Argentina, bu Buenos Aires. A kọrọ na Nicolas Otamendi nọ na nne ya.",glot500
Igbo,"Aro ahụ dị Fero mma. O wee họpụta Josef ịchịkọta ihe oriri na ichekwa ya. Josef ghọrọ nwoke kachasị mkpa n’Ijipt, ma a gụpụ Fero.",glot500
Igbo,"Forside >> Nike >> Nike air max mænds >> Air max 90 mænds sko >> Nike air max 90 mænd sko hyp kpu tpu 2014 blå jade,nike huarache tilbud,nike huarache run,København",glot500
Igbo,"Lorcaserin hydrochloride hemihydrate ntụ ntụ agaghị agwọ ọrịa ọ bụla (dịka ọrịa obi, ọrịa shuga, ọbara mgbali elu).",glot500
Igbo,Usoro a na-ekpuchikwa otu esi eji njirimara akuko na -eme ihe kwesịrị ekwesị site na iji usoro PacketShaper iji bulie netwọk na ngwa ngwa.,glot500
Igbo,"Mike Godson malitere ime ihe nkiri na 2009 ma kemgbe ahụ ka a maara ya maka ịkọwa ọrụ ịhụnanya na Nollywood. Godson apụtala na ihe karịrị 100 ihe nkiri. O gosipụtara na ndị na-eme ihe nkiri dị ka Pete Edochie, Clem Ohameze, Kenneth Okonkwo, Van Vicker na John Dumelo. Ọ bịara n'ihu ọha na 2015 mgbe o mere ihe nkiri akpọrọ 7 Books of Moses . N'afọ 2018, Godson bịanyere aka na nkwekọrịta ya na ndị otu mmepụta Bollywood jikọtara ya na Zee World. Godson na-ejikwa ụlọ ọrụ na-ahụ maka nhazi ọrụ ugbo na azụmaahịa. Ọ bụ ezie na ọrụ ime ihe nkiri ya na-enye ya mkpa ya, Godson atụwo aro na ọ nwere ike ọ gaghị enwe ike inye ya nchekwa ego. A họpụtara ya ka ọ bụrụ onye nnọchi anya ndị ntorobịa site na Independent National Electoral Commission n'afọ 2015.",glot500
Igbo,"Gafee USA (Eprel 27, 2020) –A na-eduga ndị na-emepụta otu gụnyere Lectrosonics, Devices, Audio Ltd., Ambient, dB Audio, DPA Microphones, K-Tek, Sonosax, ụlọ ọrụ Bubblebee, Schoeps, Ursa Straps, Viviana Straps na ndị ọzọ. obi dị m ụtọ igosipụta Mgbakọ ụda nke afọ 2020 nke ọma, ihe omume ụbọchị abụọ nke ga-egosipụta ọtụtụ ọkwa ọhụụ na-akpali akpali nke ga-emeworị na NAB 2020 show. Nzuko Ugwu a gosiputara ihe ohuru na ihe omuma ohuru nke mmasi banyere ndi okacha amara ya na ndi mmeputa ihe, ndi injinia ndi isi ihe, ndi oru ihe omuma, ndi oru ndi igwe okwu, ndi ndi ozo n’igwe.",glot500
Igbo,"Dị ka google webmaster blog, aha nke ọdịnaya weebụ gị ma ọ bụ biputere postenwere ike ime ka ọ bụrụ ihe a na-enweta site n'ọtụtụ URLs.",glot500
Igbo,"Mme mfịna en̄wen ẹma ẹdu ke ufọkabasi oro ẹkefịnade enye. Mmọ ẹma ẹsinyịme iren oro mîkedịghe mbon ufọkabasi ẹse ẹban̄a mme mbubehe ufọkabasi ẹnyụn̄ ẹda usụn̄ ke edikwọ ikwọ ke mme edinam. Iren emi ẹma ẹkeme n̄ko ndinyene uyo ke mme akpan n̄kpọ ke esop ndien ke ntre ẹnyenede ndusụk odudu ke mme mbubehe esop. Ọkọn̄ọde ke edumbet aban̄ade edida san̄asan̄a n̄kpọn̄ ererimbot, Grew ama enen̄ede enịm ete ke iren mbuọtidem kpọt ẹkpenyene ndinam mme utom emi. (2 Corinth 6:14-18; James 1:27) Ke ekikere esie, ndinyịme mbon oro mînịmke ke akpanikọ ẹkwọ ikwọ itoro ẹnọ Abasi ekedi isụn̄i. Ke ntak idaha emi, ke 1811, ufọkabasi ama esịn Henry Grew. Mme andibuana eken oro ẹkenyenede ukem ekikere oro ẹma ẹdian̄ade ẹkpọn̄ ufọkabasi oro ke ukem ini oro.",glot500
Igbo,"Agụmakwụkwọ, nke ịnyịnya ibu na abụba na-agbanwe agbanwe, nke siri ike ịnwe: n'oge na-adịghị anya, ihe nkiri ahụ na-agba agba na-amalite ịchị ọchị n'ọgba ọkụ.",glot500
Igbo,"Egwuregwu mbụ Agbabe dere a kpọrọ Gone Too Far! ka e mepụtara na Royal Court Theatre dị na Lọndọn, ebe o meriri 2008 Laurence Olivier Award for Outstanding Achievement in an Affiliate Theatre.   E mechara kpọlite ya maka obere oge na Albany Theater na Hackney Empire .",glot500
Igbo,"N'abali asatọ nke ọnwa Machị afọ 2020, a họpụtara Valerie ka ọ bụrụ onye nduzi nka nke Maybelline New York ma bụrụ onye mbụ na-ese osise ịchọ mma  nke Ghana na-arụ ọrụ onye nduzi nka na Ghana, nyere Maybelline New York.",glot500
Igbo,"inally, director nke Department of Qinghai Province Science na technology ngwọta iyi bụ forum mere zuru ezu ihe ịga nke ọma na-egosipụta ịnụ ọkụ n'obi congratulation, ngwọta director eche Guoxin ụlọ ọrụ ndị unveiling ememe, technical forum ngwa na iji ga-ekechikwa na ẹkenịmde ọnụ n'ụzọ dị otú a bụ nnọọ akwụkwọ bụ dịkwa nnọọ nke ọma.",glot500
Igbo,"A machibidoro izu ohi: ""Ka onye na-ezu ohi kwụsị izu ohi, kama ka ọ rụsie ọrụ ike, jiri aka ya na-arụ ọrụ ọma, ka o wee nwee ihe ọ ga-ekenye onye nọ ná mkpa"" (Ndị Efesọs 4:28).",glot500
Igbo,""" Mana e tere ogiri, e tere ụgba, na-agbanyeghị n' ụfọdụ ndị a na-arụ aka n'agbụrụ ndị ọzọ dịka ebe ha siri lọ ụwa, asụsụ ha, omenala ha na ejije ha na-egosi na ọbara ha bụ nke Igbo na enweghị mgbagha ọbụla.",glot500
Igbo,"[name_m]Ingram[/name_m], [name_f]Fiona[/name_f] [name_f]Clara[/name_f] [siblings: [name_f]Siobhan[/name_f] [name_f]Amelia[/name_f] (9), [name_f]Aileen[/name_f] [name_f]Keira[/name_f] (7) [name_f]Tara[/name_f] [name_f]Olivia[/name_f] (5), & [name_m]Brendan[/name_m] [name_u]Michael[/name_u] (4)]",glot500
Igbo,"16 Ndien enye abahade owo ikie ita oro esịn ke udịm ita onyụn̄ esịn kpukpru mmọ nnụk+ ye ikpọ aban̄ ke ubọk, esịn nsadan̄ ikan̄ ke esịt ikpọ aban̄ oro.",glot500
Igbo,"com Agen Judi Poker Online Terpercaya Indonesia Gburugburu ebe obibi metụtara nke kwesiri ibu isi nwere mmasị na- emetụta akụkụ nri n'obi iru ala, oru na ego , ndi oru ugbo na agbanwe ime obodo bi , mgbanwe na mmiri mgbasa obodo , na ọzọ.",glot500
Igbo,Nke a modul na-akọwa otu esi ejikwa Exchange Server 2016 jiri Nchịkwa Akaụntụ na Nhazi Ọchịchị chọrọ (DSC) .,glot500
Igbo,"Ugbu a, Google ranking algorithm na-eje ozi dị nnọọ mfe - nke ka elu ọnụ ọgụgụ ndị dị mma backlinks na-atụ aka na saịtị gị, ihe dị mkpa ka ibe weebụ gị bụ.",glot500
Igbo,"Ọzọ Singapore bụ akụkụ nke Malaysia. Na 1965, mba ahụ kwupụtara nnwere onwe ya, na afọ ndị na-adịbeghị anya kpamkpam nke steeti (ọ bụ ọbụna mmiri ọṅụṅụ ka a ga-azụ na mba ndị agbata obi) na mba nke ""ụwa nke atọ"" aghọwo ọnọdụ nke mepere emepe.",glot500
Igbo,Abata na ọchụchọ:asphalt ogtutorial comogtutorial com hackashphalt 8 ogtutorial comwww asphalt ogtutorial comasphalt 8 ogtutorial comashpalt ogtutorial comasphalt 8 hack cheat androidogturial comhack aspalt 8 oktober 2016gamecheat com asphalt 8cheat oktober 2016 asphalt 8 airborne hack tool for androidcheat generator untuk asphalt 8 ioscara hack asphalt 8 android oktober 2016cara cheat asphalt 8asphalte 8 anataghị ikike android 2016 online gratuitasphalt ogtutoril comashplat ogtutorial comasphalt ogtutorialasphalt 8 劈asphalt 8 হ্যাকasphalt 8 airborne hack android downloadasphalt 8 ogtutorialAsphalt 8 Hack Tool passwordashpalt 8 ogtutorial comAsphalt 8 Airborne Hack/ Cheat/ Generator/ Adder 2016 | Asphalt 8 Airborne Hack Gratuit -Free Cheat -Pirater,glot500
Igbo,Evasi0n 7 ga-chọpụta gị iPhone 5c na ga-ekwu banyere ndị iOS femụwe version na-agba ọsọ. Pịa na jailbreak bọtịnụ iji malite usoro.,glot500
Igbo,Kọmishona ogbe ahụ bụ Apollo Okello sị na ọtụtụ ka tọrọ na ya bụ ebe ebe ajọ ọnọdụ ebe ahụ ekweghị ka azọpụta ụfọdụ.,glot500
Igbo,"O siri ike ịme isi awọ karịa isi awọ. O yiri ka ọ dakọtara na agba ọ bụla. N'ihi nnọpụiche ya, a na-ejikarị ya dị ka agba agba. Ọ nwere ike ime ka agba ndị ọzọ pụọ iche. Ya mere isi awọ kwesịrị ekwesị dị ka akwụkwọ ahụaja. Ọrụ nhicha ga - arụpụta ihe onye nwe ya nwere imepụta mgbidi ahụ site na ịmị. Ọ bụghị naanị na, anyị Grey Chalkboard s na-egbo mkpa ndị a, mana na-anabatakwa magnets n'ihi ihe ya, weta ohere ọzọ.",glot500
Igbo,"E wepụtara abọm mbụ ya, Every Opposite, n'afọ 2012.  A họpụtara Albọm a maka 2013 Polaris Music Prize n'abali iri na atọ nke ọnwa June afọ 2013, ma mesịa kpọọ aha ya na ndepụta dị mkpirikpi N'abalị iri na isii n'ọnwa July afọ 2013.",glot500
Igbo,"“Ị pụrụ imebi otu ihe, ọ bụ ezie na i zubeghị ime otú ahụ. Ọ bụrụ na a jụọ gị onye mebiri ya, ì kwesịrị ịsị na ọ bụ nwanne gị? Ka ì kwesịrị ime dị ka a ga-asị na ị maghị otú o si mee? . . . Ihe ọ sọkwara anyị mee, mgbe niile, ịgha ụgha ga-eme ka ọ ka njọ, anyị ekwesịghịkwa ọbụna ikwu ihe na-abụchaghị eziokwu. Baịbụl na-ekwu, sị: ‘Na-ekwunụ eziokwu.’ Ọ na-ekwukwa, sị: ‘Unu adịla na-aghara ibe unu ụgha.’ Jehova na-ekwu eziokwu mgbe niile, ọ na-atụkwa anya ka anyị na-eme otú ahụ.—Ndị Efesọs 4:25; Ndị Kọlọsi 3:9.”",glot500
Igbo,"Ndị nwere ekwentị smartphones (ọtụtụ mgbe Samsung, ma echere m na nke a bụ n'ihi na ha dị elu) nwere ike ịchọta njehie ""Nsokọ njikọ ma ọ bụ koodu MMI ezighi ezi"" (Nsokọ njikọ ma ọ bụ koodu MMI na-adịghị mma na nsụgharị Bekee na ""MMI koodu mberede"" na ochie gam akporo) mgbe ị na-eme ihe ọ bụla: ịlele nkwụsịtụ, Internet fọdụrụ, tarifụ nke onye ọrụ ekwentị, wdg.",glot500
Igbo,13. Didie ke 1 Timothy 4:8 ye Mme N̄ke 13:20 ẹkeme ndin̄wam nnyịn imek se ikpanamde ke ini iduọkde odudu?,glot500
Igbo,"Ted Talk ya na ihe nkiri PBS, Adventure Divas, na-akọwa otú na ihe mere o ji rute nwa agbọghọ ""nke ikpeazụ"" nke dara ogbenye, nwanyị, onye nọ n'afọ iri na ụma na onye nwere agbụrụ dị ala, agbụrụ a na-eleghara anya nke na-enweghị ike ime mkpebi ọ bụla maka onwe ya - ịlụ di ma ọ bụ ịga ụlọ akwụkwọ, igwu egwu ma ọ bụ inye aka n'ọrụ ụlọ, ịgba akwụna ma ọ bụ ịbụ onye ọrụ ụlọ, ịmụ nwa ma ọ bụ na ọ bụghị ...",glot500
Igbo,"Mgbe m na-asụgharị m posts na Transposh, nsonaazụ ndị dị iche iche si na-asụgharị na Google Translate (M na-eji google ịsụgharị engine). Nke mgbe ụfọdụ na-akpata ihe ọjọọ nsụgharị. Ntak emi ẹwọrọde? Biko ị nwere ike inyere?",glot500
Igbo,"Gịnị ka ọ dị mkpa ka i mee ma ọ bụrụ na ị chọghị ka ihe a ga-adakwasị okpukpe ụgha dakwasị gị? Onye ozi Chineke na-agba ume, sị: “Ndị nke m, sinụ n’ime ya pụta.” (Mkpughe 18:4) N’ezie, ugbu a bụ oge isi n’okpukpe ụgha pụta! Ma, ọ̀ pụtara na ị ga-akwụsị ikwere na Chineke? Ee e, olileanya adịghịrị ndị na-ekweghị na Chineke. (2 Ndị Tesalonaịka 1:6-9) Nanị ebe ị pụrụ ịgbaba bụ n’ezi okpukpe. Olee otú ị pụrụ isi mata ezi okpukpe?",glot500
Igbo,"Kedu ụdị ákwà mgbochi nke m kwesịrị iwere? Ọ dị mfe ịkwanye ezigbo ụkpụrụ nke ákwà mgbochi iji nye iwu: onye na-atụ ahụ ga-abịakwute gị, were ihe nha, wee họrọ usoro ahụ ịchọrọ, kwụọ ụgwọ maka akwa na-arụ ọrụ - ma chere ...",glot500
Igbo,"Otu nwa agbọghọ aha ya bụ Olivia kwuru, sị: “O nweghị onye ga-achọ ka ya na onye na-achụ nwoke ma ọ bụ nwaanyị na-akpa ma ya fọdụzie ịlụ ya. Ọ nweghị otú mmadụ ga-esi tụkwasị onye ọ ma na ọ na-akpa ụdị agwa a obi.”",glot500
Igbo,"M hụziri onwe m n’ụlọ mkpọrọ jụrụ oké oyi, n’enweghị nri, mmiri, ma ọ bụ blanket. Ma, obi ruru m ala. “Udo nke Chineke” nọ ‘na-eche obi m na ike iche echiche m nche’ otú ahụ Baịbụl kwere anyị ná nkwa.” (Fil. 4:7) N’echi ya, otu onye agha dị obiọma nyere m achịcha na mmiri na kootu. Onye agha ọzọ enyekwa m nri e kenyere ya. Jehova si otú a nakwa n’ọtụtụ ụzọ ndị ọzọ na-elekọta m.",glot500
Igbo,"Na oge na-adịbeghị anya, egbu egbu anụ aghọwo ihe a ma ama. Enwere ụdị egbu egbu dị iche iche anyị na-ahụ n'ahụ mmadụ.",glot500
Igbo,Ọhịa ndị a abụghịkwa sọọsọ apịtị mangrov dị na ha – ha gụnyekwara ihe ndị ka fọrọ site n'oke ọhịa ndị juburu Ala nọ na mpaghara Ganjiz.,glot500
Igbo,"- Ọ bụrụ na onye ọrịa adịghị enweta usoro mmiri ọgwụ uric acid nke na-erughị 6 mg / dL mgbe 2 gaa na 4 n'izu, a ga-enwe mmelite ọgwụ.",glot500
Igbo,"Retina Institute of Virginia adighi ewpu mmadu ma o bu na -emeso ha di iche iche nihi agburu, na agba, obodo, afo, nkwaru, ma o bu mmkoahu.",glot500
Igbo,"The software na-enyere dezie akụkụ Akwụkwọ Nsọ, kee ihe gbasara na n’ihu, na-arụ ọrụ na ndịna-emeputa na vector oyiyi, usoro ahụ ọdụ data, wdg OpenOffice bụ dakọtara na kasị nke isi formats, tinyere ya onwe ODF format na Microsoft Office formats.",glot500
Igbo,Mgbanwe nke mmiri kwesịrị ịdabere na ọnọdụ mmiri. N'ihi na mpaghara ọ bụla nwere ọkwa dị iche iche nke mmiri.,glot500
Igbo,"Ọ bụ eziokwu dị n'okwu a mere ka ndị Umudim, Nnewi n'agbanyeghị na ngalaba dị n'ime ya ruru iri na anọ, na-abịakọta ọnụ na Legọs ka ha wee hụkọrịta onwe ma matakwa omenaala ọfụma.",glot500
Igbo,"BLI na-enye ndokwa maka ụmụ akwụkwọ elementrị na nke ụlọ akwụkwọ sekọndrị na-achọ ịmụ mba ọzọ maka obere oge. A na-enye ihe omume anyị n'asụsụ Bekee ma ọ bụ French. Ị nwere ike ịga maka ahụmahụ ka njọ ma were usoro ịme asụsụ abụọ. Ị ga-abanye n'ime ụlọ akwụkwọ elementrị ma ọ bụ ụlọ akwụkwọ sekọndrị, na-ebi na ezinụlọ Canada ma nwee ohere ịbanye na ọrụ ndị na-akpali akpali nke BLI.",glot500
Igbo,"NdiIgbo sokwa ma gbakwa ọtụtụ mbọ nke gosipụtara ịdị mma Naijiria n’ihu mba ụwa nile n’ime iji ego achụ ego, egwuregwu, agbamụ ọsọ nakwa egwuregwu bọlụ. Ndịa gụnyere ndị dịka Sir. Louis Odumegwu Ojukwu, aka ji akụ nke mbụ na Naijiria ; ndị turu ugo dịka Dick Tiger, Power Mike n’ime egwuregwu, nakwa oke osisi na-edemede bụ Chinua Achebe nakwa Cyprian Ekwensi. Ma ugbua, ọtụtụ ndị ntorobia Igbo bụ ndị ama ama na mba ụwa nile. Ọpụrụ iche ndịa gụnyere Dọkịta Philip Emeagwali, otu nnukwu uche nke zikọrịte ozi nke ọgbara ọhụrụ nakwa, dịka ụlọ ọrụ bụ odogwu na gbasa ozi n’igwe onyonyo, CNN, “Nna nke igwe oje na mmụọ”, Chimamanda nwa ntorobia ụwa mara nke ọma nakwa onye turu ugo na mbipụta akwụkwọ akụkọ mkpịrịsị ya nke mbụ mgbe ọdị afọ iri na-abụọ bụ ozurumba ; Kalu Nwankwo nakwa Jay Jay Okocha n’ime egwuregwu bọlụ ụkwụ ; nakwa imilikiti ndị ọzọ.",glot500
Igbo,"Ọ gbara akaebe na gọọmenti etiti na-agbasi mbọ ike n'ịkwàlite ọba akwụkwọ na ọrụ dịịrị ya n'ala Nigeria, sịkwa na Gọvanọ Obianọ na-emekwa otu ihe ahụ, bụ nke o kwùrù na o meela ka ọba akwụkwọ kwụdosie ike n'ịrụ ọrụ ya otu o kwesiri, ma kelekwazie ha maka ezi nkwàdo ha na ịdị uchu n'ihe metụtara ịkwàlite ọba akwụkwọ.",glot500
Igbo,"N’ ihi na iwu ga- esi n’ ebe m nọ pụta , m ga- emekwa ka mkpebi ikpe m dịrị ka ìhè nye ndị dị iche iche .",glot500
Igbo,"N’Africa, a na-eduzi klas ịmụ ịgụ na ide karịsịa n’asụsụ ógbè, ọ naghị abụkarị n’asụsụ mba ji eme ihe. Otú ọ dị, a na-ejikarị asụsụ mba ji eme ihe amụ ihe n’ụlọ akwụkwọ. Nke a na-abakwuru ụmụaka uru n’ihi na a na-ebipụtakwu akwụkwọ na ihe ọgụgụ ndị ọzọ dịgasị iche iche n’asụsụ mba ji eme ihe. Ọ bụ ezie na klas ịmụ ịgụ na ide nke ọgbakọ pụrụ ịbụ ihe ntụkwasị nye akwụkwọ nwata na-agụ n’ụlọ akwụkwọ, ha apụghị iweghara ọnọdụ ịga akwụkwọ. Ya mere, ọ bụrụ na ọ dị otú o si kwe mee, ọ̀ bụ na ụmụaka ekwesịghị ịga akwụkwọ?",glot500
Igbo,UPDATED 2018 - Waikiki Beach is the perfect summer getaway! - Holiday Rental in Honolulu - TripAdvisor,glot500
Igbo,"Anyị ma na Ista adịghị Chineke mma n’ihi na ihe ndị a na-eme na ya si n’ememme ndị oge ochie na-emere chi ọmụmụ ma ọ bụ chi na-eme ka ihe a kụrụ n’ubi too. Chineke chọrọ “ofufe a na-ekewaghị ekewa,” ọ ga-ewekwa ya iwe ma onye sịrị na ya na-efe ya na-eme ememme ndị ọ na-anabataghị.—Ọpụpụ 20:5; 1 Ndị Eze 18:21.",glot500
Igbo,Great High Quality Discount Nike-Nike Flyknit Lunar 2014 Best Selling Clearance | Outlet USA Nike-Nike Flyknit Lunar 2014 Buy 100% Authentic Quality,glot500
Igbo,egbu egbu maka ụmụ nwokeazụ azụegbugbu maka ụmụ agbọghọegbugbu egbugbuarịlịka arịlịkaỤdị ekpomkpaakara ntụpọenyi kacha mma enyindị na-egbuke egbukeAnkle Tattoosegwu egwuegbu egbu hennamehndi imeweegbu egbu mmiriọnwa tattoosụkwụ akaaka akakoi ika tattooenyí egbu egbuegbu egbu okpuna-egbu egbuechiche egbugbuaka akandị mmụọ ozina-adọ aka mmaegbu egbu egbunnụnụegbu egbu osisi lotusima ima mmaụmụnne mgburip tattoosdi na nwunyengwusi pusiegbu egbuegbu egbu ebighi ebiEgwu ugoọdụm ọdụmokpueze okpuezeakwara obiakpị akpịNtuba ntughariGeometric Tattoosmma tattoosUche obiegbu egbu diamondn'olu oluudara okooko osisiaka mma akaagbụrụ ebozodiac akara akara,glot500
Igbo,"The European Afrika na-ebe ma ama n'ihi na ya dị ịtụnanya na-atọ ụtọ chocolate. N'ezie, ọtụtụ chocoholics na-enwe njem sịnụ na ha nwere ohere nụrụ ụtọ na ụfọdụ ịtụnanya flavors n'oge ha njem. Ọ bụrụ na ị na-eme gị site Europe na-akpọ isiala nye chocolate, anyị nwere oké ozi ọma n'ihi na ị na! Save A Train ele anya na European chocolate idaha ma na-etinye ọnụ a ndepụta nke 10 kacha mma chocolate na-echekwa na Europe. Kwesịrị ị na-ahụ onwe gị na otu n'ime mba ndị a, na ị na-a agụụ maka ụfọdụ ịtụnanya chocolate, na-oge gara otu n'ime ndị a ebe. Ị gaghị-emechu ihu.",glot500
Igbo,"Ị nwere ike adịghị ere, redistribute, ma ọ bụ mụta nwa na Documents na-enweghị kwuru ikike nke KBC Networks.",glot500
Igbo,Ufo Elu Elu ìhè Ufo elu elu ìhè Elu Bay ìhè Ufo mere ìhè Ufo mere ìhè 200w Mee Ufo Ìhè Mee Ufo 150W Ìhè Ulo Ugwu di n'Ìhè,glot500
Igbo,N’ụzọ ime mmụọ: Dika sayensị ime mmụọ nke a abụchaghị ezie. Biko jee na edemede isi okwu iwu ime mmụọ nke inye-ma-inara nke na-egosi iwu na-eso “mkpụrụ ị kụrụ ka ị ga-aghọrọ”,glot500
Igbo,"Ndị a bụ afd ndị na-eme nchọpụta maka ụmụ gị na ihe ọ bụla dị ọhụrụ ị na-ebabata ha ka ha ha weewee here ịmalite ịnụ ọkụ n’obi. N’iburu nke ahụ n’uche, ka anyị lelee ihe ọhụrụ dị iche iche iji gosi ha ka ha ha bụrụ: Nhazi usoro!",glot500
Igbo,"Obere onye mmekọ, osote onye isi ala Sigmar Gabriel kwuru na Germany nwere ike inabata ndị gbara ọsọ ndụ puku narị ise kwa afọ maka ọtụtụ afọ na-abịa.  Mmegide German megide nnabata gọọmentị nnabata nke ndị mbata ọhụrụ siri ike yana ịrị elu nke ngagharị iwe maka mbata na ọpụpụ.  Merkel siri ọnwụ na Germany nwere ike akụ na ụba iji nagide nbata nke ndị na-akwaga mba ọzọ ma kwuwakwa ọzọ na enweghị oke iwu gbasara ọnụ ọgụgụ ndị njem nke Germany nwere ike inabata.  Na Septemba 2015, igwe mmadụ nwere ịnụ ọkụ n'obi n'ofe mba ahụ nabatara ndị gbara ọsọ ndụ na ndị mba ọzọ.",glot500
Igbo,"The Encyclopedia Americana (nsiondi eke 1991) ọdọhọ ete: “Egypt, Greece, Rome, ye Persia eset ẹma ẹsidia usọrọ usen emana mme abasi, ndidem, ye mbọn̄.” Mme ewetn̄wed oro Ralph ye Adelin Linton ẹyarade akpan ntak kaban̄a emi. Ke n̄wed mmọ oro The Lore of Birthdays (Edinịm ke Akpanikọ Aban̄ade Mme Usen Emana), mmọ ẹwet ẹte: “Mesopotamia ye Egypt, kpa mme ntọn̄ọ ntatenyịn, ẹkedi n̄ko mme akpa idụt ẹmi mme owo ẹketide ẹnyụn̄ ẹkponode mme usen emana mmọ. Ediwet mme usen emana nnịm ekedi akpan n̄kpọ ke eset akpan akpan koro usen emana ekedide akpan n̄kpọ kaban̄a edisiak ntantaọfiọn̄ owo.” Nnennen ebuana oro emi enyenede ye edisiak ntantaọfiọn̄ edi n̄kpọ emi owo ekededi emi efepde edisiak ntantaọfiọn̄ ke ntak se Bible etịn̄de aban̄a enye ekpenen̄ede ekere aban̄a.—Isaiah 47:13-15.",glot500
Igbo,"Tụlee otú e si eji cactus transplant mgbe ịzụrụ. Ọ ka mma ịzụta osisi na mmiri, dị ka oge kachasị mma maka ịkụ na transplanting bụ April-May. Jiri nlezianya wepụ mkpụrụ nke osisi a zụrụ site na ite ahụ, kpochapụ ya n'ala. Osisi mgbọrọgwụ kwesịrị ijide nkeji iri abụọ na ngwọta nke potassium permanganate. Mgbe ahụ kpoo nke ọma. Site na ala ochie ka mma iji kpochapụ. Debe ala ala n'elu drainage oyi akwa, gbanwee mgbọrọgwụ, fesaa ya na ala ma gwuo egwu. Mmiri osisi ahụ ma chere ruo mgbe ala dịtụla nwayọọ, tinyekwuo ala na n'elu oyi akwa. Ndị na-eto eto na Novice na-eche ma ọ dị mkpa ịghapụta cactus mgbe ị zụrụ? N'ụlọ ahịa, a na-ahụkarị cacti na peat. Enweghị mgbakwunye nke ala turf, peat ga-ejigide mmiri dị ukwuu, nke a na-emebi usoro mgbọrọgwụ nke osisi ahụ. A na-emepụta ọtụtụ ụdị cacti kwa afọ abụọ, a na-edozi akụkụ ndị ọzọ nke usoro ahụ n'afọ atọ ọ bụla. Mgbe a na-akwanyere ùgwù, a na-ebugharị cacti na ala. Mgbe a na-atụgharị ya, a gbanwere ite ahụ gaa buru ibu ma ọ bụ n'obosara.",glot500
Igbo,"Dị ka di iche iche nke film na-akpụ ihe onwunwe, mkpuchi nwere ike kere n'ime alkyd resin mkpuchi, polyurethane mkpuchi, emulsion mkpuchi, nitrolacquer, acrylic mkpuchi, epoxy resin mkpuchi, wdg",glot500
Igbo,"Longwood Art Gallery, ""Urban Masculinity,"" Nke Bettie-Sue Hertz na Calvin Reid haziri, Bronx, NY, 1993",glot500
Igbo,a £ 20 nzọ nke na-enweghị ahịa ahịa na-ekesa site na-etinye nnọọ Wager na bụ nke mbụ na ha niile ka gị uru nke £ 5 na ihe ọ bụla nwere ike nke 2.0 ma ọ bụ nwere ike karịa.,glot500
Igbo,"Etu ụfọdụ ụmụnwaanyị si egbochi ịtụrụ ime n'oge 'lockdown' a Isi akụkọ Ihe mere n'etiti Aguleri na Umuleri ụnyaahụelekere 5 gara aga Gee ntị, BBC Nkejinkeji 37 gara aga Lee nri ọzọ i nwerike iri n'ụbọchị ụka16 Febụwarị 2020 Kọwaara m isi akụkọ Man City agwọọla Chelsea ka nkwọbi e ji tụọrọ afọ ọhụrụ aja3 Jenụwarị 2021 Arsenal apịala Chelsea ụtalị ndị nche pịara onye ohi27 Disemba 2020 Anthony Joshua na Kubrat Pulev ga-ezute onwe ha taa ịmata mbe abụọ nke bụ oke12 Disemba 2020 4:06 Vidio, Etu m si soro na ndị ọkaibe n'egwuregwu 'Basketball' - Zeke Nnaji, Duration 4,0626 Nọvemba 2020 Image gallery, Foto Diego Maradona: Nlereanya maka ndụ dike a bụ ọkaibe na bọọlụ25 Nọvemba 2020 Mma na njọ Ohaneze mere Igbo n' oge ọchịchị Nnia Nwodo11 Jenụwarị 2021 Coronavirus Second Wave: Lee atụmatụ ndị gọvanọ Ọwụwa Anyanwụ tinyere iji gbochie mfesa ọrịa nke abụọ11 Jenụwarị 2021 Ihe i kwesịrị ịma maka George Obiozor onyeisi ọhụrụ nke Ohanaeze Ndigbo8 Jenụwarị 2021 Glaucoma: Ọrịa ọjọọ nwere ike ime ka anya pịa mmadụ n'otu ntabi anya8 Jenụwarị 2021 Akachasị Gụọ 1 Ihe mere n'etiti Aguleri na Umuleri ụnyaahụ 2 Gịnị ka akpa, abụzụ na nri ndị ọzọ na-eyi ndị mmadụ izizi ndị Igbo na-eri oge gboo na-enye n'ahụ?",glot500
Igbo,"Cannabis bụ azụmahịa siri ike, nke siri ike ma na-achịkwa nke ukwuu. N'inye ego maka oke ego na oke iwu nke iwu metụtara, yana nnukwu ụgwọ maka odida, azụmahịa ahịa cannabis kwesịrị ichesi ike na iwere onye dị ka ndụmọdụ izugbe.",glot500
Igbo,"Hiç gaala na weebụsaịtị çiş nwee ike ịnweta ya? Getụtụ oge, ị ga-emechi taabụ ihe nchọgharị ahụ wee gaa na nke ọzọ. Ekele maka ọnụ ọgụgụ weebụsaịtị dị ukwuu na ntanetị, enwere wtụtụ ọnụọgụ ọzọ maka ihe niile.",glot500
Igbo,"13 “Aa mẹ ọni ọọ ga ọgbọ ni ọ dobẹ ya ke ga ega aava utoghuo. Eri ọ ya nono ingme oyi ọghuo, ọa nono ingme oyi ọnọkpọle. Ọọ suọ esọ na ọghuo dọsẹ ọnọkpọle. Wa dobẹ ya ke ga Ẹshinẹgba u gbolo ẹ ga ukpaghọ.”* Li zẹ iMat 6.24",glot500
Igbo,"1Yom xuee cwii tjo̱o̱ na nlaꞌtyeⁿ nnꞌaⁿ judíos xuee pascua quia cwilaꞌcwjeena canmaⁿ, ndoꞌ squia̱a̱yâ tsjoom Betania ñꞌeⁿ Jesús. Squia̱a̱yâ na mꞌaaⁿ Lázaro, tsaⁿ na tquiaaⁿ na wandoꞌ xco jnda̱ na tueꞌ. 2Tyolaꞌtꞌmaaⁿꞌndyena Jesús joꞌ joꞌ. Jlaꞌjndaaꞌndyena cwii nantquie na tcwaaꞌâ. Marta tyondiꞌntjoom nda̱a̱yâ ndoꞌ juu Lázaroꞌñeeⁿ tacatyeeⁿ ñꞌeⁿndyô̱ na meindyuaandyô̱ nacañoomꞌ meiⁿsa ñꞌeⁿ Jesús. 3Ndoꞌ juu María maleiñꞌoom cwii tsuaꞌ xjo ncheⁿꞌ na ñequiiꞌcheⁿ nardo. Juunaꞌ jeeⁿ jndanaꞌ. Tuꞌnquioom ncheⁿꞌñeeⁿ ncꞌee Jesús, jnda̱ joꞌ tyoweeꞌñê ncꞌee ñequio sooxqueeⁿ. Na sꞌaaⁿ na ljoꞌ tjuꞌnaꞌ jndye cachi chaꞌwaa quiiꞌ wꞌaa. 4Mañꞌeⁿ Judas Iscariote, jnda Simón, juu mawaa xjeⁿ na nñequiaa cwenta Jesús. Tsaⁿꞌñeeⁿ cwii jâ na tꞌmaⁿ Jesús na calajomndyô̱ ñꞌeⁿñê. 5Matso:",glot500
Igbo,"In the age of pre-innocence, God allowed Prostitutes to be in order to checkmate Man. Buy Skank Ibotirama Bahia Use gaming places for mobiles. English is the one Prostitutes works!",glot500
