language,text,source
Oromo,"Walwaraansa Yamaniifi weerara koronaavaayirasii keessa darbanii biyya itti baqatan, Sa'uudi, yoo gahan hidhaatti darbamuun isaanii 'waan yakka dalagneef miti orma waan taaneefi' jechuun himatu. Dhaabbanni mirga namoomaaf falmu Humaan Raayitis qorannoo dhihoo taasiseen lammiileen hidhattoota Huutiin 'Covid-19' tamsaastu' jedhamuun kanneen du'anillee akka jiran qoratee argatuusaa himeera. Abdiin tokkichi baqattoonni irraa eegan mootummaa Itoophiyaa yoo ta'u himu. Ta'us, kana dura kan biyyatti akka deebi'an gargaaran alatti deebi'anii akka isaan hin gaafanne dubbatu. Dhimma lammiilee Itoophiyaa ala jiraniirratti ibsa Ministeerri Dhimma Alaa Itoophiyaa Kamisa ganama baaseen adeemsi biyyatti deebisuu sababa Covid-19 gufate jedheera. Haa ta'u malee, torban dhufu eegalee lammiilee 2,000 Sa'uudiiti baasuuf akka jedhu ibse. Kana dura garuu Qonsilaan Itoophiyaa Jiddaa jiru hamma weerarri koronaavaayirasii darbutti lammiileen Itoophiyaa hidhaa jiran 'bakkuma jiran akka obsan' gaafatanii turan. Dhihoommoo Dubbii Himaan Ministeera Dhimma Alaa Ambaasaaddar Diinaa Muftii mootummaan dhimma lammiilee Sa'uudiii jiranii akka hojjetu himan. Ta'us, baqattoonni birmannaa ariifataa akka taasifamu gaafatu. Waggoota lamaaf Itoophiyaa keessa konkolaachisaa ta'e kan dalage Abduun* galii wayyoo qau argatee maatii isaa deeggaruuf yaade hiriyyoota isaa waliin karaa Jibuutii gara Yaman kan qaxxaamure. Galaana diimaa qaxxaamuruuf birrii kuma 25 kanfaleera. Erga ce'ee Yaman gahe boodammoo gara Sa'uudiitti cehuuf Riyaalii 3,500 (gara birrii kuma 35 gahu) kanfaleera. Yaaddoo cimaa keessa ta'un galaana diimaa akka ce'an kan himu Abduun sababa weerara Civid-19 fi wal-waraansa biyyattii jiruun guyyoota 15'f Yaman taa'anii. Wal-waraansai Yaman erga eegale bubuleera. Weerarri vaayirasichaa garuu tasa kan dhufeefi Sa'uudii gahanii waan abdatan san dalaganii argachuuf danqaa akka itti tahe dubbata. Hidhattoonni Huutii Kaaba biyyattii to'atanimmoo inumaa 'vaayirasicha tamsaasaa' jirtu jechuun gara Sa'uudiitti achi dabarsuuf akka isaan yaalan kana dura qorannoon Humaan Raayitis Waach himeera. Jiraattonni manneen hidhaa Sa'uudi keessa jiraniifi dubbisnees rakkoon sababa kanaan lammiileen lubbuu dhaban akka jiranillee himaniiru. Yeroo muraasaaf bakka dahatan erga turanii booda bakkichaa gadhiisaa Kanneen manneen hidhaa keessa jiran garri caalu sababa koronaavaayirasii maqaa dhahuun hidhattoonni Yaman lafa inni to'aterraa kanneen ari'edha. Jarri Huutii lammiileen Itoophiyaa Yamani akka gadhiisanii Sa'uudi seenan godhu, jarri Sa'uudiimmoo daangaarratti lammiileen Itoophiyaa akka isaanitti seenan dhorkuun gidduutti rakkatani. Gareen Mirga namaaf falmu Humaan Raayitis Waach qorannoo jalqaba baatii Hagayyaarra baaseen lammiileen Itoophiyaa kumaan lakkaa'aman Kaaba Yamanii baafamuu ibsa. Kanneen du'an akka jiranillee kanneen hidhaa jiranirraa akka odeeffate ibseera. Dabalataan, Yamanii ''gara Sa'uudii baqattoonni ari'aman eegdota daangaan rakkoon biraa isaan qunnameera. Kanaanis, muraasni yoo du'an kan dhibbaan lakkaa'aman bakkeewwan Kaaba biyyattiitti baqataniiru,'' jedheera. Baqattoonni Itoophiyaa Yamanii bahanii gara Sa'uudi Arabiyaa akkuma seenanii weerara koronaavaayirasii hordofee erga hidhaa amma keessa jiranii seenan ji'a jaha ta'uufi. Baqattoonni Itoophiyaa hedduu lammiilee Itoophiyaa ta'an bakki jiran mana hidhaa osoo hin taane ''si'oolii lafarraatii'' jechun BBC'tti dubbataniiru. Kanneen hidhaa jiran rakkoo nyaataa, qulqullinaa, walitti baay'achuufi kaan biroo himatu. Baqataan Itoophiyaa tokko dubbisne manni hidhaa keessa jiran galma 20 ol akka qabu ibsa. Tokko isaa keessa baqattoonni 400'tti tilmaamaman qulqullina gahaa malee hidhamaa jiraachuu himu. Baqattoota mana hidhaa keessa jiranirraa baqattoonnbi BBC'n dubbise ji'oota muraasaas bakka jiranitti balballi itti cufame ala argani akka hin beekne himu. Sababa haala rakkisaa keessa jiranirraa kan ka'e rakkoo xinsammuu isaan mudataa jira. Inumaa isaan keessaa ''lamaan of galaafataniiru'' jechuun baqattoonni himaniiru. Lammiileen Itoophiyaa manneen hidhaa Sa'uudi keessa jiran hedduu ta'us ji'oota muraasa dura Yamanii baafamanii kana chi seenan meeqa akka ta'an hin beekamu. Baqattoonni garu hanga kuma afur gahu jechuun tilmaamu. Dubartoonn qofaatti galma biraatti hidhamani. Haala rakkisaan manneen hidhaa keessatti turuu isaaniin uffanni isaaniirratti dhumee rakkachuu himu. Qulqullinni dhibuu hordofee rakkoo fayyaa gogaaf saaxilamu himu. Manneen hidhaa keessa daa'immaniifi kanneen ulfa ta'anillee akka jiran dubbatu. Wal'aansa akka argatan taasifamus qorichi kennamuufi garuu kan dhukkubsa isaanii fayyisu miti jechuun komatu. Dubartoonni akka himanitti itti - gaafatamtoota manneen hidhaaf gara biyya isaanitti akka galchan irra - deddeebiin gaafachuufi ''dhimma kana kan ilaallatu mootummaa biyya keessani'' jedhamuu isaanii baqattuun tokko BBC'tti himteetti. Sababa kanaafis, waan mootummaan Itoophiyaa isaaniif gochuu danda'u osoo eeganii jiini muraasa darbuu himan. Mana hidhaa Jiizaan keessatti Lammii Itoophiyaa dhaabbanni the Telegiraaf jedhamu dubbisee tokko gaabbii amma keessa jiru wayita ibsu, ''Balleessaan kiyya biyyaa bahu kooti. Akka biseensaatti nu ilaalu. Guyyaa guyyaan reebichatu nurratti raawwatama. Karaan asi bahuun hinjiru taanaan ofiin ajjeesa. Namoonni tokko tokkoos kana raawwataniiru'' jedheera. Godaansa: Yamanitti hidhattoonni Huutii godaantota Itoophiyaa ajjeesaafi ari'aa jiru Lammiilee Itoophiyaa Mana Hidhaa Jiizaan keessatti argaman BBCn dubbisees akka jechuun haala keessatti argaman dubbatu: ''Eddoon dhaloota kiyyaa Awaddaayii yoo ta'u, ergan gara kana dhufe waggaa tokko. Ergan mana hidhaa kanan galfamee ammo baatii shan gaheera. Kutaa tokko keessattis dubartoota hedduu taanee jirra.'' Kana malees ''Mana hidhaa kana keessatti rakoo addaatu nu mudataa jira. Bishaan hinargannu, uffata hinqabnu, dhiqachuuf saamunaan hinjiru, walumaa galatti haala keessatti argamnu ibsuuf sammuun kiyya sirriin yaadee sitti himu hindanda'u'' jechuun BBCtti himte. Baqataan gara biraa dubbisne haalli keessatti argaman baayyee lubbuusaniif yaadeessu ta'u dubbata. Huseen akka jedhuutti namoonni baatii jahaa hanga baatii torbaa mana hidhaa kana keessaa turan jiru. ''Kutaa tokko keessatti namoota 360 ta'uun jirra. Walumaa galatti namni mana hiidha kana keessatti argamu gara nama kuma shanii ni ta'u'' jedha. Shamarreen biraa dubbifnee ammo ''dubartoonni ulfaafi daa'imman illeen jiru. Bakki ciisaa hinjiru, bishaan qulqulluu miti. Dubartoonni ulfaa sababii reebichaatiin ulfi irraa bahee fi kannneen dahanii ijoolleen isaanii bakka gahan hinbeekamne jiru'' jetti. Itti dabaluunis ''dubartoonni ulfaa dhukkubee mana yaalaa deemuuf gadi bahan waan reebamaniifu, ulfi irraa baha. Hirriiyyaan kiyyaa tokkoos mana yaalaatti erga deesseen booda mucaanshee eessa akka jiru hinbeekamu. ''Yeroo ofi bartu mucaan kiyya eessa jira jettee gaafannaan 'du'eera' jedhaniin'' jechuun shamarreen maqaanshee akka eeramu hinbarbaannee tokko. Gaaffiin lammiileen kunneen hundi motummaaf dhaaman walfakkaataadha. Innis 'maaloo lubbuudhaan gara biyya keenyaatti nu haa deebiisuu' kan jedhuudha. Mootummaan maal yaade? Caamsaa 2017 hanga Bitootessa 2020'tti lammiilee 400,000 Sa'uudi Arabiyaarraa baafneerra kan jedhe Ministirri Dhimma Alaa Itoophiyaan lammiileeshee simachuu diddee hin beektu jechuun ibse. Haa ta'u malee, lammiilee alaa yeroo galchun qindoomina qaamolee biyya kessaafi alaa garaa garaa gaafata jechuun yeroo fudhatuu akka malu akeeke. Dabalataan garuu, weerarri koronaavaayirasii akka danqaa ta'e ibseera Dhimma lammiilee hidhaa jiranii dursa kenneefi hojjetaa akka jiru kan hime ministeerichi, baatii Ebla - Adoolessa bara 2020'tti lammiilee 3,500 Sa'uudiiti baasu beeksiseera. Haa ta'u malee, lakkoofsi godaantota Itoophiyaa akkaan dabaluun mootummaa Sa'uudillee yaaddessuu isaa ibse. Ta'us mootummaan Sa'uudi Arabiyaa isaan simachuu hin dhiiifne jechuun isaafiis galata akka qabu mootummaan Itoophiyaa ibsa baasen himeera. Haa ta'u malee, torban kana Fulbaana 8 eegalee lammiilee 2,000 Sa'uudiiti baasuuf akka jedhu ibseera. Hojjettonni addatti Imbaasii Itoophiyaa Sa'uudi jiru keessa dhimma baqattootaa akka hordofan akka ramadaman kan ibse ministeerichi, godaantonni rakkoo xiinsammuu garaa garaaf akka saaxilamu danda'an ibseera. Kunis, imala seeraan alaan adeemuu, harka kanneen isaan imalchiisaniin dararamuu, fi kaan akka jiraachuu malan ibse. Abdii mootummaa Guyyaa tokko qondaalli mootummaa tokko Imbaasii irraa deemee biyyatti isaan deebisuuf mootummaan hojjechaa jiraachuu erga itti himee ergasii namni deebi'ee isaan ilaale akka hin jirre dubbatu namoonni kunneen. Lammiileen Itoophiyaa jireenya fooyyee qabu barbaacha karaa dheeraa fi biyyoota hedduu miilaan qaxxaamuruun karaa sa'uudiitti imalan amma du'aa fi jireenya gidduutti argamu. Dubartoota Itoophiyaa mana hidhaa Sa'uudii keessa jiran keessaa tokko kan taate Masarat ijoolleeshee guddisuu fi maatiiwwan ishee jaaran gargaaruuf jettee maallaqa qabdu hunda baasu himti. Erga Sa'uudii seentee booda mana hidhaa keessatti wayita of argitu jiruu fi jireenya harkaa baduu dubbatti. Dubartoonni biroon kutaalee biyyattii garaagaraa keessaa babba'anii ishee waliin jiranis rakkoo walfakkaataa keessa jiraachuu dubbatti Masarat. Kan yaadanii ba'an hafee mana hidhaatti darbamanii maatiinis abdii kutachuusaanii wayita yaadatan hedduunsaanii sammuunsaanii miidhamee jeeqamaa jiraachuus dubbatti. Dirree waraanaan raafamaa jirtu, Yaman fi biyyoota Arabaa kaan qaxxamuranii akkasumas weerara koronaavaayirasii dandamatanii wayita bakka ka'aniif, Sa'uudii Arabiyaa, ga'an mana hidhaatti darbamuun guddoo isaan miidhuu himu. Manni hidhaa ji'oota hedduuf itti hidhaman balfa garaagaraan kan guutame, balfi mana fincaanii akka itti seenuu fi reeffa waliin ija keessa wal ilaalaa akka jiraataa jiran dubbatti Masarat. Rakkkoo hanqina qulqullinaa fi walirratti heddummaachuurraa kan madde hidhamtoonni hunduu dhukkuba gogaafi fuulli iita'uuf kan saaxilamaniidha jetti Masarat. Rakkoo hamma kana keessa taa'anii yaalii fayyaa argachuu akka hin dandeenye kan dubbatan hidhamtoonni kunneen, inumaa wayita gaaffii akkasii dhiyeessan eegdota mana hidhaatiin akka garmalee reebaman dubbatu. Lammiin Itoophiyaa mana hidhaa Sa'uudii jiru kan biraan Abduu jedhamu, ''mana hidhaatti kan darbamneef yakka dalagnee osoo hin taane biyya ormaa waan ta'eef. ''Hojjennee jijjiiramna jennee baanee sababa koronaavaayirasiif mana hidhatti nu darban. Rakkoo hamtuutu harkaa nu qaba'' jedhe. Fedhiin baqattoota kunneenii nagaadhaan gara biyyatti deebi'uudha, kan waadaa galameefis kanuma, garuu kun hin taane. Haala amma keessa jiraniin garuu baqattoonni kunneen lubbuudhaan maatiisaanii waliin walitti deebi'uuf abdii dhabu himu. ''Mootummaan Sa'uudiis ta'e Itoophiyaa nu dagateera. Kanaafidha rakkoo addunyaarraa isa hamaataa keessa teenyee yeroo keenya kan eeggataa jirruuf,'' Jechuun aariin dubbata Abduun. Masaratii fi Abduun ammallee abdii hin kutanne, abdiinsaanii inni dhumaa mootummaa Itoophiyaarra jiraachuu dubbatu. Dararaa kana keessaa ba'anii guyyaa tokko ija maatiisaanii arguuf, abdiisaanii mootummaa Itoophiyaarra kaa'ataniiru. BBC'n dhimma kanarratti Imbaasii Itoophiyaa Sa'uudii jiru akkasumas minsteera dhimma alaa Itoophiyaa dubbisuuf yaaliin godhe hin milkoofne. Dhimma dararaa lammiilee kunneen irra ga'aa jiru ilaalchisee gabaasa barruun biyya Ingiliiz 'Daily Telegraph' jedhamu gabaase hordofee dhaabbata mootummoota gamtoomanii dabalatee dhaabbileen idil addunyaa hedduun Sa'uudii Arabiyaarrati gaaffii kaasuun gocha kana balaaleffataniiru. Kanarratti mootummaan Sa'uudii karaa Imbaasii isaa Landan jiruu gabaasa barruu kanaaf deebii kenneen mana hidhaa jedhame keessa dhuguma rakkoon akkanaa yoo jiraate akka qoratee sirreessu himeera. *Nageenya isaaf maqaan kan geeddarame.",glot500
Oromo,Namoonni yeroo baay’ee yommuu fedhii ofii hordofan miidhaa badii hojjatan san irraa dhalatu irraa jaamaa ta’u.,glot500
Oromo,Mallasaa fi Tashoomaa gidduutti rakkoon kun kan dhalate wayta Tashoomaan hojiif ala dhaqee turetti Mallasaan maallaqa guddaa qisaaste jedhee waan itti dheekkameef jedhameera.,glot500
Oromo,Hogganaan Waajjira Bulchiinsaafi Nageenya Bulchiinsa Magaalaa Buraayyuu Komishinar Salamoon Taaddasaa guyyaa har'aa magaalaa Buraayyuu keessatti ajjeefaman.,glot500
Oromo,"Deeggarsa maallaqaa birrii 100,000 fi Dinnichaa Makiinaa 3 ummata buqqa’eef kan geesse tahuu odeeyfannoon argame ni ibsa.",glot500
Oromo,Qajeelfamni kun “Qajeelfama Kenniinsa Tajaajila Mana Kitaabaa fi Dookimenteeshinii Caffee Mootummaa Naannoo Oromiyaa Murteessuuf Bahe,glot500
Oromo,"Akkasumas Naa'ol Daani'el, hundeessaa Afirikaatti 'Teek Nekist', jijjiramaa dijitaalaa itti fufaa Afiriikaa keessatti sagantaa walitti fufaa qophii panaalii hojii-uumuu gama tekinooloojii Afiriikaa fi caarraa gaabaa waliin ni mari'ata jedhamee eegama.",glot500
Oromo,"Maayyii irratti, Itoophiyaa keessatti Qabsoon Hidhannoo akka filmaataatti akka hin fudhatamne taasisuu kan danda’u Impaayerattiin kan hanga har’aatti ittiin beekamtu sirni bulchiinsa Abbaa-Irrummaa kan Afaan qawwee qofatti amanuu fi abdatu hundee irraa gaafa jijjiirame qofa. Jijjiirama bu’uuraa kan Sirna dimokiraasii haqaa ol’aantummaa fi Walabummaan Ummataa fi Seeraa keessatti kabajamu argamsiisuu qofatu Qabsoo Hidhannoo akka tarsiimoo qabsootti filachuu yaada duubatti hafaa taasisa. Jijjiiramni bu’uuraa akkasii sun argamnaan Paartiilee fi qaamotni ilaalcha siyaasaa adda addaa qaban hundi sababaa ilaalcha siyaasaa hordofaniitiif jecha arihatamuun, doorsifamuun, hidhamuu fi ajjeefamuun hin jiraatu. Waan taheefis namuu mirga isaa seeraan falmachuu malee sababaan Qabsoo Hidhannootti nama dirqu hin jiraatu jechuu dha.",glot500
Oromo,"Fakkeenyaf, sigaaraa xuuxu, caati qama’uu, alkooli dhuguu fi kkf irraa lubbuu ofii fageessu qaba. Ammalle wanta hojjachuu hin dandeenye ofirratti fe’u hin qabu.",glot500
Oromo,"Abiy Ahmad mootummaan ammaan booda amantaa keessa harka hin galchuu, kaleessas gochi mootummaan warra majilisaa deggeree warra kaan qoollifatee garaagarummaan uumamuuf yaalamaa ture sirrii akka hin taane dubbachuusaanii ibsaniiru Uztaaz Ahmaddiin.",glot500
Oromo,Minsieteri ittisa waraanaa amma filamuu dandahaa jedhan kun ammoo jireenna biyya sunii wayyeessuuf waadaa gale.,glot500
Oromo,"Waggaa haaraa kana keessa karoora diinaa hunda burkuteessuu irratti ciminaan hojjatuun kan nu irraa eegamu dirqama lammummaa tahuu ABOn hiree kanaan yaadachiisa. Miseensotni dhaabaa fi WBOn karaa hundaan of jabeessuun, sochii qabsoo babal’isuu fi karoora dhaabaa hojii irra oolchuun dirqama qabsoo irra jiru tahuu beekuun bal’inaan irratti hojjatuun gaaffiin ummata keenyaa deebii akka argatu gochuu irratti akka bobba’an ABOn dhaamsa isaa dabarsaaf. Kana waliin QBOf fira horuu irratti akka bal’inaan bobba’amu ABOn dhaama.",glot500
Oromo,Sukaaraa fi qabeenya TPLF hataa jirtu harka qulaa qabnee seera itti dhiyeessinu hin jiru. Yoo dandeenye saamuu ykn gubanii biraa fagachuun aarsaa hin barbaachifne irraa nu olcha. Maqaa sukaaraan ijoollee keenya Amboo irratti dhumanii fi waan jiduu kana immoo Shambuu itti tahaa jiru fakkeenya nuuf taha.,glot500
Oromo,Ogeessi nama kamiiyyuu loogii tokko malee walqixa kan yaalaa kennu akka kanatti kan yeroo baay’ee waldhabdeen uumamu.,glot500
Oromo,com seenuudhaan viidiyoo sobaa ta'a jedhamee kan shakkame sana ykn teessoo interneetii inni itti argamu galchuudhaan gadi fageenyaan kan sobaa ta'uu isaa argachuu ni dandeenya.,glot500
Oromo,Odeessa kana irratti dabalata Maatiin lammiilee Keeniyaa Boeing fi Daandii Xiyyaara Itoophiyaa himachuufi4 Ebla 2019 Balaa Xayyaaraa ET302: Boeing xiyyaara 737 Max hunda hojii dhaabsise14 Bitooteessa 2019 Boeing: Awurooppaa fi Indiyaanis biyyoota xiyyaara Boeing 737 Max balaliisuu dhaabanitti dabalaman13 Bitooteessa 2019 Balaa Xiyyaara ET302: Dhuguma leenjiin paayilatootaa balaa sana waliin walqabataa?,glot500
Oromo,"Half-hour broadcasts in Afaan Oromoo of news, interviews with newsmakers, features about culture, health, youth, politics, agriculture, development and sports on Monday through Friday evenings at 8:30 in Ethiopia and Eritrea.",glot500
Oromo,"Barattootni Oromoo,Dargaggootni Oromoo guutummaa guutuun ilmaan oromoo bara baraan maaliif mana hidhaatti guuramu?",glot500
Oromo,Dhorkaawwan Abbaan Alangaa Waliigalaa Federaalaa ifa godhe kunneen ji'oota shan labsiin yeroo muddamaa labsame hojiirra oolu keessattidha.,glot500
Oromo,Namoonni siyaasaa akka jedhanitti Doonaald Tiraamp namoonni sagaleesaanii gama poostaatiin akka hin kennine kan barbaadaniif deeggartoonni isaaniiyyuu koronaavaayirasiirratti yaaddoo waan hin qabneef buufata filannoo dhaqanii sagaleesaanii kennuufillee sodaa hin qaban jedhu.,glot500
Oromo,Veentileeteroonni humna qilleensaa to’achuu danda’aniifi ‘PEEP’ guddaa qaban dhiyeessii ooksijiinii guddisuufi miidhaafi walitti galuu sombaa balaa veentileeterii waliin walqabate xiqqeessuuf barbaachisoodha.,glot500
Oromo,"Ijoollee waliin turre keessa tokko achitti awwaalle, lama magaalaa Sabaatti gargar baane lubbuun jiraachuu isaanii hin beeku.",glot500
Oromo,"Roomaa 12:2 akkas jechuun nuutti dubbata, “Fakkeenya jireenya bara isa darbu kana duukaa hin bu’inaa jaalalli Waaqayyo isa kam akka ta’e gargar baasuudhaaf yaada garaa keessanii hareffachuudhaan of diddiira. Jaalalli Waaqayyoo immoo waan gaarii ta’e, waan isa duratti fudhatamaa ta’e, waan akeeka isaa fiixaan baasu hubachuudha.”. Waaqayyo kan nuu hin hayyamne inni tokkichi akka cubbuu hin hojjennee fi fedhii isaa akka hin mormineedha. Waaqayyo fedhii isaa wajjin kan walii galu filannoowwan akka taasifnu barbaada. Kanaaf, jaalalli Waaqayyoo siif maal akka ta’e akkamiin beektaa? Yoo ati Gooftaa wajjin walitti dhiyeenyaan deddeebite jirreenya keetiif dhugaatti jaalala isaa yoo barbaadde, Waaqayyo fedhii isaa garaa kee keessa kaa’a. Furtuun isaa jaalala Waaqayyo barbaaduudha, kan kee miti. “Waaqayyotti gammachuu qabaadhu, inni immoo kadhata garaa kee siif ni kenna”(Psalm 37:4). Yoo Macaafni Qulqulluun isa mormuudhaaf hin dubbanne ta’e inni hafuuratti siif kan bu’aa qabuudha, egaa Macaafni Qulqulluun akka murteessituu fi akka garaa kee akka hordoftu “hayyama” siif kenna. Yoo ati dhugumaan jaalala Waaqayyoo hafuura cabaadhaa fi gad of deebiseen akkasuma sammuu banamaadhaan barbaadde, innni jaalala isaa siif ni ibsa.",glot500
Oromo,"Kanaafu of dinqisifannaan, boonu fi namoota tuffachuun yoo sitti dhagahame fedhii lubbuu hordofaa akka jirtu beeki.",glot500
Oromo,"Haala muraa keessatti ammoo, yoo isini kan dhorkitan ta'e malee gaaffiiwwan keessan maqaa, umuriifi bakka jireenyaa haaluma isin galchitan waliin mullachuu danda'a.",glot500
Oromo,"Haa tau malee, jechi ‘biyyin’ (decision) jedhu maal akka taee fi murtiidhaan ykn decree dhaan maaltu akka adda taasisu, akkasumas, jechi abbaa seerummaa yoom jecha ‘biyyin’ jedhuun baasii taasifamuu akka qabu seerichi wanta ibsu hin qabu.",glot500
Oromo,Afaan Oromoo afaan hojii mootummaa federaalaa taanaan waanti daa’imman Oromoo Afaan Amaaraa akka barataniif dhiphifaman hin jiru.,glot500
Oromo,Yoo akka qaama beekamtii qabu tokkootti nu ilaalu tahe qaama itoophiyaa humna qabu tokko jedhanii keessummeessuf banaa of gochuun gaariidha'' jedhan.,glot500
Oromo,Kaan immoo afaan yaa’ii mana maree bakka bu’oota uummataa Naansii Peloosii barbaadaa turuu isaanii mul’isa viidiyooon sun. abbootiin alangaa akka jedhanitti ennaa sanatti bakka amansiisaatti geessamuu isaanii fi waahiloonni isaanii kaan immoo balbala cufamaa ka biroo keessa turan.,glot500
Oromo,Eennummaa fi amaloota mataa fi hujiif ka jaalli kun addatti qabu keessaa haga tokkollee tayu akka itti aanu kanatti ragumaaf dhiheessina.,glot500
Oromo,"Namoonni dhiiga Oromoo taatanii lammii keessan ajjeestanii fi ajjeesaa turtan, waan hamaaf dabarsitanii kennitan sobaaf raga baatan, guyyaa har’aatii kaasee yaa’ii tokkummaa abbootii gadaa oromoo kun maqaa uummata oromoo kabajamaa fi guddaatiin badii darbeef dhiifama gaafattanii,dhugaa lammii keessaniitiif akka dhaabbatan isinii dhaamaa, kanarra kan darbe kana booda gocha kana irra deebitanii yoo raawwattan lafee fi dhiigni ilmaan oromoo, akka safuu fi safeeffannaa Sirna Gadaatiin kan isin gaafatu taha.",glot500
Oromo,"1 Odaan mallattoo Oromummaa, hawwii Dagaaina biyyaa, fi fedhii Ummata Nageenyaaf dhaabbate bakka bu’a.",glot500
Oromo,"Hedduun akka Sidaamaa, Tsamaay, Shekechoo, sabaawota Gambeela, kkf. kanaan dura roorroo fi bulcha garaa jabina TPLFiin mormanii hiriira bahanii turan; garuu ajjeechaa, hidhaa, biitteen dhibamuu fi biyyaa dheessuu sadarkaa fixaqacceetiin simataman. Sun qabsoo bilisummaa hin dhaabne garuu finnaa empayeraa TPLF jalaatt butuchuu itt fufama jira. Empayericha irraa bu’aa kan argatan, keessaayyuu korporeshinooti saba qari’oon, addoti fedha ummata ofiif waan dhaabbataniif argaa saanii hin fedhani. Hariiroon diinagdee haa tahu malbulchaa iddoosota ummatootaa malee abbaa hirrootaa yk koloneeffatoo waliin tahuu hin qabu. Sun akka yeroo keettolii fi koloneeffatoo isaan waliin akeeka wal fakkaataa qaban wojjin dhoofsisanii gaddhiisaa hin tahu. Haa tahu malee addoti bilisummaa isaan balleessine jedhan ummata saaniitt makaman malee eessayyuu hin dhaqnee. Isaan ummataa. for establishing independent democratic republic Oromiyaa become realized. That is the ireversable goal of Oromo liberation movement.",glot500
Oromo,Suurawwan filatamoo torbee kanaa kan guutuu Afriikaa fi Afriikanoota ardiilee biroo keessa jiraatanii.,glot500
Oromo,"Dhaabbilee siyaasaa Oromoo Biyya keessaa haqaan falmaa gaggeessaa jiran keessaa , Dhaaba Obbo Baqqalaa Garbaa fi Obbo Mararaan gaggeeffamaniidha.",glot500
Oromo,"Seenaa saanii dheeraa keessati miseensoti dhaabota Oromoo akka kanneen lola jaallatanii fi nagaa jaallataniti qubaa walitt qabanii hin beekan turani. Bakka lamatt baqassuun akkasii madda halagaa akka sanatt isaan arguu fedhan irraa dhagahame. Sun bakka laafaa eegaloota jalbiyyaa hin taanee tuquu hin oolee. Jarri akkasii maaliifuu, eenyuufuu dhimma hin baafnee, haran kosii gatan dhoqqeedha. Oromoon mirga saanii fi biyya saanii kan sarbe ofirraa faccisuuf ijaaraman malee lola jaallatanif miti. Karaan nagaa xaxaa itt taanaan sibila kaasani. Nagaa fi araaraa kan Oromoo caalaa faarsu hin jiru. Garuu yeroo du’ii fi jireenyi wal hin calle lachanu furaa hin qabani. Eenyuu jeeqa, jeeqan deebisuu akka dandahu garuu kan nagaa gachisiisu akka hin jirre diina barsiisuuf. Dandeettii saanii ijaaruun diina didhanii diriira nagaatt akka dhufu giddisiisuuf sana murteeffatan. Akkasitt kan isaan sibila kaasuu malbeekiin walcinaa oofuu kan murteeffatan. Hammam gadoodaa yoo oole dadhabaa kan dhaggeeffatu hin jiru. Kan biyya namaa qabatanii qabeenya saatiin jiratan dirqiin malee fedhan diriiraa dhoofsisaatt hin dhufani; aangoo irraa buunaan qananii bacarraqaa dhabanii fi yakka itt gaafatamuu dandahan heduu. Anga’oon addunyaa sinsinaawoo dha, yoo Oromoon michuu hundee hin qabne sobaa tahuu empayerichaa agarsiisuu dandahe qofa wan jedhaniif isaan fudhata. Yeroo hundi waliin yaaduutt kahu fagoo mitii; yeros ofirroo dirqiin diriiraa nagaatt fiduun Oromoof rakkisaa hin ta’uu.",glot500
Oromo,Qophiifi akkaataa taphni Qillee ittiin taphatamu Ayyaanni Qillee gahuudhaaf torban lama osoo hafuu jalqabama jedha.,glot500
Oromo,Hiriirrii kun dhiiga ilmaan Oromoo utuu wal irraa hin citiin dhangalaa’ee isa mootummaa EPRDF jilbeefachiisaa jiru bishaan godhee namni miseensa EPRDF tahe dhiiga uummataa wajjin dhangalaasaa ture tokko waan jijjirama kana fidaa jiru fakkeessuuf.,glot500
Oromo,Geggeesitootni Mormoon foon Yesus Kristoos uffachuun bu’aa wal qunamtii qaamaa Waaqayyoo fi Maariyaam jedhanii barsiisu.,glot500
Oromo,Namootii qulqulloomina garaan ka’anii ala kanatt “Walgahi Sabaa” tokko waamuun furmaata taha jedhan jiru.,glot500
Oromo,"Kanaaf, Dubbi himaan bulchiinsa deetaa biyya Aayerlandi jimaata darbe ibsa baaseen ‘Ibsi dhaabbanni Feesbuukii baase baay’ee guddaafi Deetaan Maamiltoota miliyoonotaan lakkaawamu hannaaf saaxilamuu ibseera.",glot500
Oromo,"Amaaran kan argamuu jidduugaleessa lafa olka'insa plate'au Itoophiya fi kan hundefamitte uummata ijoo bulichinsa anaa Gondar,Gojjam,nannole muta'ee showa fi wollo kan ta'an nannolee bulchinsa Amaraa jedhama. Oromonis nannolee gudda kan qabiduu biyyadha.Isaanis horsistoota fi uummata qonan bultoota kan qabidduu fi bayyinan jiddugaleessa fi kiba-lixa Itoophiyatidha. Namooni nannolee Nilo-saharan jiratan gosa nannole lixa biyya ka'ee hanga dangaa Eritira kasee hanga garba Turkana. Essattuu nannoo biyya lakkofisan xiqoo kan ta'e hawaasoota kan adaawwan ,luugaawwan fi dhaloota darbanirra kan dhufee barsifata walkan qabatuu qunamittii gara gara irra Itoophiyan seena dheera fi bekama kan qabidduu fi,akka namoota hunduumattuu kan biyyaa,akka amanita isannittii kan akka amanita Orthodox ,amantta Muslimoota,protestanitti …kan kana fakkatuu amanta gara gara warrii qaban kan irra jiratanidha.",glot500
Oromo,Buuhoodlen Itiyoophiyaa waliin akka wal daangeessitu kan ibsan Nur sochii uummanni daangaa ce’uun gaggeessuun dhukkubii kun dhufe jedhan.,glot500
Oromo,"Hundee fi madda wal dhabbii sababoota ta’an keessa kan akka sirna gita bittaa fi bitamaa gidduu , addaa addummaa kaayyoo , aangoo fi bu’aa, ilaalchaa xalilawaa fi itti gala akeekaa sirritti walhubachuu dhabuu irraa shakkii keessa galuun sababoota…",glot500
Oromo,(8 Mudde 2016) Fedhii aangoof jecha shirri qabsoo bilisummaa Oromoo irratti hojjatamu kamuu kan hin milkoofne ta’uu ABOn hubachiise.,glot500
Oromo,Oromiyaan galaana atileetotaa taatee akka ittifuftu gochuuf rakkoowwan sochii atileetiksii sadarkaa hundatti xaxanii qaban hiikuun dirqama. Sababiinsaa kufaatiin atileetiksiirraatti dhufu kufaatii eenyummaa keenyarratti dhufu waan ta'uuf.,glot500
Oromo,Yaadannoo hamaa kaleessa dabarsiterraa deebiyanii ar'a yeroo yaaddus wanti gaariidha jettu hin jiru; lapheen ishee baayyee gaddaan caba.,glot500
