language,text,source
Yoruba,"Ẹrọ iwadi kan bi Google le ni anfani lati ri gbogbo awọn ipele ti àwúrúju. Biotilẹjẹpe o koyeye si idiyele ti o ga julọ lori, awọn idiyele ti o wa ni isalẹ tọka awọn iṣeduro ti o le ṣee ṣe fun idi ti awọn ifiyaje ti o ga julọ:",glot500
Yoruba,"Grand Bazaar ti itan, eyiti o ni awọn ile itaja 4 laarin ipari ti awọn igbese coronavirus ni Bursa, ni pipade fun ọsẹ kan. Awọn eka 700 ti Bursa Inns, eyiti o ti wa ninu Akojọ Ajogunba Aye ti UNESCO, ti a mọ bi okan ti iṣowo fun awọn ọdun 450 [More ...]",glot500
Yoruba,"Nítorí náà, bí a bá ti ji yín dìde pẹlu Kristi, ẹ máa lépa àwọn ohun tí ó wà lọ́run níbi tí Kristi wà, tí ó jókòó ní ọwọ́ ọ̀tún Ọlọrun.",glot500
Yoruba,"O jẹ ki obirin kan pẹlu awọn iwa agbara ti o yẹ fun 10 iṣẹju Jeroen Pauw ni tabili ati gbogbo awọn Fiorino gbagbọ pe Peteru M. nitori aini atẹgun ni ibimọ ni o ti jẹ ohun ti o buru ju pe o fẹ ṣe ohun gbogbo si iya rẹ laisi oogun. Síbẹ, arabinrin mi n bẹ Peteru lọpọlọpọ ni ọsẹ kọọkan, nitori pe ko si ohun ti o tun bajẹ ninu ibasepọ rẹ pẹlu Peteru lẹhin gbogbo awọn irokeke wọnyi si Mama. Ṣe ko dun ọgbọn si ọ? Daradara, nigbati o ba de lati ṣafihan awọn ofin titun ti iwọ kii yoo gba laisi gbogbo nkan (iṣe iṣe). Peter M. jẹ Nitorina gẹgẹbi awọn media duro lẹẹkansi (o kere ju eyi ti o jẹ ki itan naa jẹ eyiti o gbagbọ julọ).",glot500
Yoruba,"Iduro 24th ti Awọn ipade Ọpọlọ ti o wọpọ ni Antakya Eto Agbegbe Ṣeto. Ile-iṣẹ Ajọ ti Antakya, eyiti o ṣe awọn ipa pataki si idagbasoke ti orilẹ-ede ati agbegbe nipa fifun agbara rẹ lati agbara isọdọtun pẹlu didara iṣelọpọ, okeere ati ifamọ ayika. [More ...]",glot500
Yoruba,"[21 Kọkànlá Oṣù 2017] Ile ile ile nhb ṣẹda awọn iṣelọpọ ti a sopọ mọ fun iṣaro latọna jakejado Germany, London ati USA Ile-iṣẹ ti o ti pari-iṣẹ nhb laipe ni laipe lai ṣe awọn ile-iṣẹ meji meji, ti o nfi ile-iṣẹ keji ṣe ni Hamburg, nhbNEXT, ati pe o wa ni ilu Munich . Awọn ile-iṣẹ kekere meji yii joko ni ẹgbẹ pẹlu Berlin ti o wa tẹlẹ, Hamburg ati awọn agbegbe Dusseldorf. Awọn ile-iṣẹ ti kọ ...",glot500
Yoruba,"Amóò, àwọn ètò wọ̀nyí kúròláṣà mọ́jú nígbàtí bíi ajagun 800,000 láti Egbe Ajagun Pupa tì Ìgbìmọ̀ Sofieti wọlé, wọ́n díbọ́n Belarusi àti Yukireni léhin tí wọ́n ṣẹ́gun apá ila òórùn Polandi, ní ìlòdì sí Àdéhùn Àláfíà Riga, Àdéhùn Má-Jàkadì Sofieti-Polandi, pẹ̀lú gbogbo àwọn Àdéhùn ìlúsílù, àti t’oníìlú méjì ati t’oníìlú púpọ̀ si.",glot500
Yoruba,"Gẹ́gẹ́ bí àgbà-ọ̀jẹ̀ nípa àwọn aṣíkiri George Borjas yóò ti ṣe sọ ọ́, ó dàbi ẹni pé ilẹ̀ America fẹ́ àwọn òṣìṣẹ́, ṣùgbọ́n síbẹ̀, ó dàrú mọ́wọn lójú nígbà tí wọ́n rí àwọn ènìyàn dípò bẹ́ẹ̀.",glot500
Yoruba,"March 30, 2017. Pregnancy rokne wali ayurvedic medicine gujarati ma... (http://scriptovore.com/pregnancy-rokne-wali-ayurved ic-medicine-gujarati-ma.html) Pregnancy rokavana upay gujarati ma - Gher gathu upai time ma thava mate - iq.monsoon-kitchens.com. Garcinia Cambogia Select Created for Shedding Extra Weight.",glot500
Yoruba,"Ọpọlọpọ awọn eniyan ti o wa ni lilo ayelujara. Bi awọn eniyan n tẹsiwaju ṣiṣẹda awọn aaye ayelujara ti o wulo ati ti owo, awọn miran nfọka si dida awọn ọgbọn igbọnwọ wọn lati ṣe idajọ ipinle ti aabo cyber. Nitori eyi, awọn ile-iṣẹ gbe ni iberu nigbagbogbo lati dojuko ipinnu ikolu ti kolu gẹgẹbi awọn adanu miiran ti o wa ni iṣẹlẹ ti gige sakasaka. Diẹ ninu awọn ipalara spam le bẹrẹ lati ọdọ oludije kan, ti o le ṣe awọn iṣawari Ẹrọ Iwadi Rẹ (SEO) paapaa nigbati aaye ayelujara rẹ ba ni igbiyanju gige lori awọn SERP. Diẹ ninu awọn àwúrúju ati awọn egboogi-àwúrúju ni ibi nikan afojusun ni ṣiṣe awọn eniyan mọ, ṣugbọn kii ṣe opin si iṣoro ti nwọle. O le lo itọnisọna yii lati lo olutọpa-ẹrọ ayọkẹlẹ lori aaye ayelujara e-commerce rẹ ati lati ṣe ọpọlọpọ awọn afojusun.",glot500
Yoruba,"Saaju akoko yi naa ni alaga tele, Ogbeni Kunle Olayeni fi iwe sowedowo ranse si idile okan lara won to doloogbe lodun to koja, Oloogbe Abiodun Onafuye to je asojukoroyin The News/PM News.",glot500
Yoruba,"Akowe agba fun Amerika, Rex Tillerson ni opolopo eniyan n koju isoro ati ri ohunjije je ni ekun yii lataari ogbele ati ikolu orisirisi to sele.",glot500
Yoruba,"1xBet jẹ jina lati jije kan ti o dara ibi lati mu iho ati kasino laimu awọn ẹrọ orin kan ti o tobi asayan ti tabili awọn ere, video poka, taara onisowo tabili.",glot500
Yoruba,"O ti wa ni wulo fun offest sita inki, iboju sita inki, ti di inki, olekenka-aro sita inki, Gravure sita inki, roba gravure sita inki, omi-igbe titẹ sita-inki, sọrọ, bbl",glot500
Yoruba,"Coronavirus: ''Ìjọba kò tíì pàṣẹ ìlànà ìtakété-síra-ẹni padà nínú BRT la ò ṣe máa tẹ̀le'' Ìjọba gbé ilé ijó oníhòhò tì pa lórí ẹ̀sùn títàpá sí ìlànà àti dẹ́kun coronavirus Ogun abẹ́lé tó ń ja Akeredolu l'Ondo, òní la ó mọ̀ bóyá yó borí rẹ̀ Ìyàwó mi fi mí sílẹ̀ kó lọ sílé ọkùnrin míì nínú báráàkì kan náà, àmọ́ mò sí tún fẹ́ràn rẹ̀- Sọ́jà Oríṣun àwòrán, others Lẹyin naa lo lọ fa ara rẹ le ọlọpaa lọwọ, eyii to mu ko jẹ ẹni keji ti aje iwa ibaje yoo ṣi mọ lori ninu ijọba Aarẹ Joko Widodo laarin ọsẹ diẹ sira wọn.",glot500
Yoruba,"Ifiranṣẹ aṣiṣe yii n tọka si iṣoro pẹlu kaadi iranti. Ni ọpọlọpọ igba, iwọ yoo ri ifiranṣẹ aṣiṣe yii nigbati o ba gbiyanju lati mu awọn aworan pada lati kaadi iranti ati kaadi iranti ti bajẹ, ṣofo, fifọ, tabi ti a ti pa pẹlu kamera miiran. Lati ṣatunṣe kaadi iranti, o gbọdọ ṣe kika rẹ, ṣugbọn kika akoonu kaadi iranti jẹ ki gbogbo awọn fọto ti o fipamọ sori rẹ lati sọnu. Gbiyanju lati fi kaadi iranti sii ni ẹrọ miiran tabi ni komputa rẹ ati gbiyanju lati gba awọn aworan ti o fipamọ sori rẹ ṣaaju ki o to pa akoonu rẹ pẹlu kamẹra Panasonic rẹ.",glot500
Yoruba,"Mejeji awọn kaabo ajeseku ati awọn seese, kopa ninu ọpọlọpọ awọn sise miiran, awọn ẹrọ orin ni 1xbet awọn foonu. Lẹhin ti ipari awọn ìforúkọsílẹ gbọdọ wa ni san a idogo. Awọn titun onibara ìforúkọsílẹ ti wa ni ṣe taara lori ile ati ki o nbeere awọn afikun input ti gbogbo awọn pataki ti ara ẹni data ki o si ìmúdájú ti idanimo nipa tẹlifoonu tabi imeeli.",glot500
Yoruba,"Ó dára, bí wọ́n ṣe ń lọ sọ́dọ̀ àwọn àlùfáà ni àìsàn wọn kàn kúrò lára wọn. Ẹran ara wọn tún dára padà. Wọ́n gba ìwòsàn! Wọ́n jèrè nítorí wọ́n gbà gbọ́ pé Jésù ní agbára tí ó lè wo àwọn sàn. Inú wọn dùn gan-an! Ṣùgbọ́n, kí ló yẹ kí wọ́n ṣe lẹ́yìn náà láti fi hàn pé wọ́n moore? Tó bá jẹ́ ìwọ kí lo máa ṣe?—",glot500
Yoruba,"Ni bayii iye awọn ti arun naa ti pa nipinlẹ Kwara ti wọ ọgbọn, awọn mi-in ṣi wa nibudo tijọba ya sọtọ fun itọju Covid-19.",glot500
Yoruba,"27 Mì doayi lehe vounvoun lẹ nọ whẹ́n do go ganji; yé ma nọ wazọ́n kavi gbẹ̀n sekan; ṣigba yẹn dọna mì dọ, Sọlomọni lọsu to gigo etọn lẹpo mẹ ma tlẹ yin aṣọ́dona di dopo to ehelẹ mẹ.",glot500
Yoruba,"Ewe, lara awon oloselu lorile-ede Naijiria naa so lori ero ayelujara won pe:Gege bi aare ile igbimo asofin, Dokita Bukola Saraki:” Ise takun-takun ni iko Super Eagles se.",glot500
Yoruba,mailto:?body=Hia Biblu to Intẹnẹt Ji%0a%0ahttps%3A%2F%2Fwww.jw.org%2Ffinder%3Fdocid%3D1011452%26Book%3D47%26Chapter%3D8%26wtlocale%3DEG%26srcid=share⊂ject=Hia Biblu to Intẹnẹt Ji,glot500
Yoruba,"Mo ro pe o le jẹ pe IM million 1 o wa nibi gbogbo ni Fiorino bayi, ni pataki ni awọn ibiti ibiti ọpọlọpọ eniyan tun ni lati wa, ni pataki nitori awọn iyemeji nipa arun ajakalẹ-arun tabi awọn eniyan ti ko rii iwulo ti awọn igbese ni laini. lati gba.",glot500
Yoruba,"Amọ̀, nigba to ya, Bukọla di igba ati agbọn rẹ pada si ilẹ Naijiria, nitori ile ni abọ isinmi oko, to si di oludari ile ifowopamọ Société Générale (to ti kogba wọle bayii) laarin ọdun 1990 si 2000.",glot500
Yoruba,Lupin III - OAV Collection (1987-2002-2008) 1xDVD9 2xDVD5 Copia 1:1 ITA JAP Sub ITA » Direct Download HD,glot500
Yoruba,"E nọ gọalọna mí nado hẹn nugopipe mẹpinplọn tọn mítọn pọnte dogọ. Mí sọ nọ pli dopọ to whèjai de to osẹ lọ gblamẹ na tito-to-whinnu adà atọ̀n tọn de he nọ yin yiylọdọ Gbẹzan po Lizọnyizọn Mítọn Po, ehe sinai do hosọ he nọ yin awuwlena to sunmẹsunmẹ delẹ ji to Nuplọnwe Opli Gbẹzan po Lizọnyizọn Mítọn po Tọn mẹ. Adà tintan opli ehe tọn, he nọ yin Nuhọakuẹ lẹ sọn Ohó Jiwheyẹwhe Tọn Mẹ, nọ gọalọna mí nado jẹakọ hẹ adà Biblu tọn de, ehe hagbẹ agun lọ tọn lẹ ko nọ hia na yede jẹnukọn. Adà lọ, Awuwiwlena Lizọnyizọn Kunnudegbe Tọn wẹ nọ bọdego bo nọ bẹ wadohia lẹ hẹn gando lehe mí na dọhodo Biblu ji hẹ mẹdevo lẹ do go. Ayinamẹtọ de nọ na ayinamẹ nado gọalọna mí, na mí nido hẹn nugopipe wehihia po hodidọ tọn mítọn po pọnte dogọ. (1 Timoti 4:13) Adà godo tọn lọ, enẹ wẹ Gbẹzan Klistiani Tọn, nọ dọhodo aliho dagbe hugan he mẹ mí sọgan yí nunọwhinnusẹ́n Biblu tọn lẹ do yizan mẹ to nuwiwa egbesọegbesọ tọn mítọn lẹ mẹ te ji. Ehe nọ bẹ hodọdopọ kanbiọ po gblọndo po tọn de hẹn, he nọ hẹn nukunnumọjẹnumẹ mítọn gando Biblu go pọnte dogọ.",glot500
Yoruba,"Arákùnrin Russell tẹ ìwé ìròyìn Zion’s Watch Tower jáde, ìwé ìròyìn yìí ń jẹ́ káwọn èèyàn mọ̀ pé ìràpadà ni ọ̀nà tó ṣe pàtàkì jù tí Ọlọ́run gbà fi hàn pé òun nífẹ̀ẹ́ aráyé. Ìwé ìròyìn Watch Tower pe àkókò Ìrántí Ikú Kristi ní “àkókò tá a mọyì jù lọ,” ó sì rọ àwọn tó ń ka ìwé ìròyìn náà pé kí wọ́n ṣe ìrántí yìí ní ìlú Pittsburgh tàbí ní àwọn ibòmíì tí àwùjọ kéékèèké ti ń pàdé pọ̀. Ìwé ìròyìn náà sì fi kún un pé, “bó tiẹ̀ jẹ́ ẹni méjì tàbí mẹ́ta tó ní ìgbàgbọ́ ṣíṣeyebíye ló pàdé pọ̀,” kódà ì báà tiẹ̀ jẹ́ ẹnì kan ṣoṣo péré ló wà níbẹ̀ “Kristi yóò wà pẹ̀lú wọn.”",glot500
Yoruba,Tọkọtaya lu ọmọ ni gbanjo fun 400k Ta ni yóò borí láàrin Aisha Buhari àti ọkọ rẹ̀ lórí ọ̀rọ̀ ‘First Lady’?,glot500
Yoruba,"Òfin to sì lòdì sí ìbálòpọ̀ láàrin ọkùnrin sí ọkùnrin yi ti wa tipe lorílèèdè India Ìdájọ náà wọgi lè ìdájọ kan to ti kókó ní irú ìwà bẹẹ o lòdì s'ofin labẹ abala 377 òfin ìgbà àwọn amunisin eléyìí tó ká ìbálòpọ̀ láàrin ọkùnrin sí ọkùnrin gẹgẹ bí ẹsẹ. Òfin yi ti orílèèdè India kọ láti yí padà jẹ ọkan lára àwọn òfin tó ti wa tipe to sì lòdì sí ìbálòpọ̀ láàrin ọkùnrin sí ọkùnrin. Ṣugbọn lẹnu ọdún bi mélòó kan sẹyìn,àwọn ajafeto-omoniyan ti n ṣé ìpolongo nípa òfin yí tó rí ibasepọ láàrin ọkùnrin sí ọkùnrin gẹgẹ bí ẹsẹ. Adájọ àgbà Dipak Misra ní ''kò b'ofin mú kí èèyàn fojú ìwà òdaran wo ìbálòpọ̀.'' N'isẹ ní àwọn ajafeto n dunu níwájú ilé ẹjọ ti awọn kan sì bẹrẹ sí ní sunkún ìdùnnú lẹyìn ìkéde ìdájọ náà",glot500
Yoruba,"irorun Live: iṣoro to rọpọ eyiti o ṣe atupọ awọn ila asopọ ati iriri TV ori ayelujara pẹlu ami ati oniruuru ami, fifi awọn aworan ti o ni oju iboju ti o wa si aye ni ọwọ awọn alagbọ nipasẹ ṣiṣe wọn ""wiwo clickable"" kọja gbogbo awọn ẹrọ. Ọja yii le ṣee lo nipasẹ eyikeyi eto igbohunsafefe tabi aaye ayelujara fidio lori ayelujara ati ki o ṣafọpọ si sisẹ sinu awọn iṣan-ṣiṣe lọwọlọwọ.",glot500
Yoruba,"Àyọ FM jẹ ibudo redio ti aladani ni Akrá,olu-ilu Ghaná. [1] [2] Ile-iṣẹ ibudo naa jẹ ohun-ini ati ṣiṣe nipasẹ ile-iṣẹ ẹgbẹ ẹgbẹ media Multimedia Group Limited .",glot500
Yoruba,"Ni verse 3, Jona jije bayi ninu awọn lãrin ti rẹ iwulo, ki o si nitorina ipele lati gbe. O Je Ọkan tani iranse Ọlọrun wonderfully ini si ṣe rere. The iyipada ti Ninefe le fun u ireti ti jije repo lati se iyipada The Gbogbo ijọba ti Assiria; O je absurd fun u Nitorina gan lati fẹ o ṣile awọn nigba ti o ní a afojusọna ti ngbe si ki o dara a idi ati Ṣe o wa ni bẹ aisan dá si. Jona jije bayi bẹ Elo jade ti temper ati Nitorina unfit lati kú. Bawo ni o daṣa ro ti ku, ki o si lọ si han ṣaaju ki Olorun idajọ-ijoko, nigbati o Kosi ohun ti ìja pẹlu rẹ? Je yi a fireemu ti ẹmí to dara fun ọkunrin kan lati lọ jade ninu aye ni? Sugbon awon ti o fẹ passionately iku Commonly ni o kere idi lati se o, bi jije gan Elo unprepared fun o. Wa owo ni lati gba setan lati kú nipa ṣe awọn iṣẹ ti aye, ati ki o tọkasi lati ara wa si Olorun lati ya kuro wa aye ati bi o ti wù Nigbati.",glot500
Yoruba,√ . Gun tẹ awọn swith nipa 1.5second ati awọn 7 LED colort ina si oke ati awọn oniwe-awọ yoo yi laifọwọyi.,glot500
Yoruba,"Awọn ti wọn ti ọrọ bọọ lẹnu lo mu ko jẹwọ nipa bi Douglas ṣe n ko ibasun fun un latigba to ti wa lọmọ ọdun mẹrinla, idi ree ti wọn ṣe lọ fi ọrọ naa to awọn ọlọpaa leti, ti wọn si fóju rẹ ba ile-ẹjọ.",glot500
Yoruba,Ilẹ Gẹẹsi ni orileede akọkọ lagbaye to ti bẹrẹ si ni lo abẹrẹ ajẹsara ti Pifizer pọn lẹyin ti ijọba fontẹ lu lilo rẹ lọsẹ to kọja.,glot500
Yoruba,"Ti o ba tẹ lori ọkan discipline, ṣi a submenu, ibi ti o ni lati yi lọ, titi ti o gba awọn ti o fẹ ipade. igbalode ile ojúewé, Ṣugbọn awọn visual oniru le jẹ a bit dara.",glot500
Yoruba,"Kò si idanwò kan ti o ti ibá nyin , bikoṣe irú eyiti o mọ niwọn fun enia : ṣugbọn olododo li Ọlọrun , ẹniti kì yio jẹ ki a dan nyin wò jù bi ẹnyin ti le gbà ; ṣugbọn ti yio si ṣe ọna atiyọ pẹlu ninu idanwò na , ki ẹnyin ki o ba le gbà a .",glot500
Yoruba,"2. Ibùgbé koseemani ati ki o bimo ti ibi idana ounjẹ: Ibùgbé koseemani., también cuentan con piso de acogida para mujeres inmigrantes solas, pẹlu tabi laisi kekere omode ati aboyun.",glot500
Yoruba,"Oṣinbajo ni bi ijọba ṣe n tiraka lati rii pe iwa ọdaran dẹkun lawujọ, o tun yẹ ka ba awọn oṣiṣẹ SARS naa sọrọ lati mọ ẹtọ awọn araalu ninu iṣẹ yoowu ti wọn ba n ṣe.",glot500
Yoruba,"Thailand jẹ ọkan ninu awọn okuta iyebiye ti Iwọ-oorun Iwọ oorun Iwọ Asia, awọ-awọ aṣa ti o dara julọ, olokiki fun ore-ọfẹ rẹ, ibajẹ ati ounjẹ. Thailand sọrọ fun ara rẹ. Nigbati o ba gbọ orukọ rẹ, o ti ronu nipa etikun, ẹwa, igbo, ati ounjẹ. Ati awọn ero rẹ jẹ awọn iranran lori. Thailand ni o ni ọpọlọpọ lati pese awọn arinrin - laibikita [...]",glot500
Yoruba,"Oríṣun àwòrán, Other Bi a ko ba gbagbe, laipẹ yi ni MMM, ti apeja rẹ n jẹ Mavrodi Mundial Moneybox tun wọlu pada ni Naijiria.",glot500
Yoruba,"Bukọla Bamiduro: Itan fi han wa pe gbogbo igba lawọn obinrin maa n fi ara wọn ji, fun awọn iran to n bọ lẹyin, ninu wọn naa ni iya to bi mi lọmọ, awọn to duro ti mi niyẹn. Oun o niru anfaani temi ni, ko sẹni to gba wọn niyanju gẹgẹ bawọn kan ti ṣe fun mi. Ṣe ni iya mi lọ sileewe lati kẹkọọ, lasiko tawọn ẹlẹgbẹ rẹ n lọ sile ọkọ, o fẹ koun niṣẹ gidi lọwọ koun ba a le lowo to maa fi tọ gbogbo awọn ọmọ rẹ lo ṣe gbe igbesẹ yii. Ṣugbọn ko sinmi rara, ṣe lo fi asiko rẹ silẹ lati ran emi naa lọ sileewe, gbogbo agbara rẹ lo lo lati ri i daju pe mo kawe, eyi jọ mi loju pupọ, o si ya mi lẹnu, bẹẹ ni mo mọ riri oore ti wọn ṣe fun mi. Loootọ, wọn ti fẹyinti lẹnu iṣẹ ṣugbọn wọn ṣi n ṣiṣẹ pẹlu ileewe giga Covenant. Nigba ti mo n kẹkọọ ipele keji, ti wọn n pe ni Masters ni mo tun gba a lero pe ki n ṣiṣẹ lori ajọ yii, tori asiko naa ni wọn ni ki n lọọ ṣiṣẹ ni igberiko kan. Iriri mi ni igberiko yii ni pe awọn obinrin wọn lo n ṣiṣẹ, ṣe lawọn ọkunrin n sun, ọrọ buruku pẹlu ẹrin ni, ohun to mu mi gba a lero lati bẹrẹ ohun ti a le ṣe lati fi ro awọn obinrin lagbara niyẹn.",glot500
Yoruba,"Ṣugbọn ki ẹ máṣe yọ̀ si eyi , pe , awọn ẹmi nforibalẹ fun nyin ; ṣugbọn ẹ kuku yọ̀ , pe , a kọwe orukọ nyin li ọrun .",glot500
Yoruba,Ilé Ìgbìmọ̀ Aṣòfin Ìpínlẹ̀ Èkó fọwọ́ sí Àbádofin Tó fòfin de Ìwà Ìmúninígbèkùn ní Ìpínlẹ̀ náà.,glot500
Yoruba,"Diẹ ninu awọn Musulumi n tẹnumọ pe Islam jẹ ọlọdun, iṣala-alafia. Ọpọlọpọ awọn ẹsẹ ti o wa ninu Kuran ṣe ipe fun ifarabalẹpọ ati idije ninu awọn iṣẹ rere (Sura al-Baqara 2:256, Al-Ma'ida 5:47, al-Ankabut 29:46 etc.). Nitootọ, awọn ẹsẹ wọnyi ni a le rii ninu Kuran, ṣugbọn wọn jẹ akọkọ ni igba ti Muhammad ati awọn ọmọ-ẹhin rẹ ṣi jẹ diẹ. Awọn ipe wọnyi fun ifarada ti a ti pa ofin nipasẹ ofin awọn Ọlọhun ti o wa ni Al-Kuran ti o pe awọn Musulumi si ogun ogun lati gba gbogbo awọn ọta (Sura al-Baqara 2:191; Al-Tawba 9:4,28 ati be be lo. .). Ni wiwo ti Shari'a awọn ẹsẹ atilẹba nipa ifarada jẹ igba atijọ ati pe ko wulo mọ. Ṣugbọn, awọn ẹsẹ ti o ti paarọ ni a nlo ati ti afihan nipasẹ awọn Musulumi ti o ngbe ni ipo ti o kere ju ni ita Ilu Musulumi. Muhammad sọ ni ọpọlọpọ igba: Ogun jẹ ẹtan! Išẹ Islam ti aiye ko ṣe lori otitọ ṣugbọn lori ọgbọn. Allah tikararẹ ni o ni imọran gbogbo (Sura Al Imran 3:54, Al-Anfal 8:30)!",glot500
Yoruba,"Aarẹ ajọ IOC lagbaye, Thomas Bach ṣalaye pe, ""Ọmọ eniyan n la afonifoji dudu kọja lọwọ bayii, idije olympics yii si lee jẹ imọlẹ ti yoo tan lẹyin okunkun biribiri naa"" Ìròyìn tó ṣe kókó Àbámọ̀ ni yóò gbẹ̀yin ẹgbẹ́ ''Association of Stingy Men'' tí kò fẹ́ náwó f'óbìnrin- Akeugbagold17 Sẹ́rẹ́ 2021 Gbọ́, Ìṣẹ́jú kan BBC 07:00 UTCwákàtí 2 sẹ́yìn Wo ohun tí a mọ̀ nípa gbèdéke ti Sunday Igboho fún àwọn Fulani ní Ibarapa àti èsì tí wọ́n fún unwákàtí 4 sẹ́yìn Ìwádìí kíkún lóríi kókó ìròyìn Amad Diallo darapọ̀ mọ́ Manchester United8 Sẹ́rẹ́ 2021 Èsíò!",glot500
Yoruba,mailto:?body=Hia Biblu to Intẹnẹt Ji%0a%0ahttps%3A%2F%2Fwww.jw.org%2Ffinder%3Fdocid%3D1001061103%26Book%3D47%26Chapter%3D7%26wtlocale%3DEG%26srcid=share⊂ject=Hia Biblu to Intẹnẹt Ji,glot500
Yoruba,"Lara awọn to fiṣẹlẹ naa to wa leti jẹ ko ye wa pe bi obinrin naa ṣe bọ sita lọgba ileewe naa pẹlu awọn ọmọ rẹ mẹta yi lo ri awakọ kan, to si daa duro wipe ko gbe awọn lọ sile.",glot500
Yoruba,"O dabi ẹnipe ohun kan gbọdọ ṣẹlẹ si akosile, si ile-iṣẹ naa ti eto naa ati si ipilẹ awọn ofin ipilẹ, eyiti awọn avatars ti ni ominira lati inu tubu wọn. Nitorina o yoo ro pe o yẹ ki a gige ere naa ki o ṣatunṣe koodu: lati ita; lati ipo ti oluwoye, ọkàn. Ṣugbọn kii ṣe pe o jẹ ki a mọ pe ohun gbogbo ti o ṣẹlẹ ninu ere ko ṣe pataki rara? ""O kan ere kan ..""Ti o ba padanu ere-idaraya Fifa rẹ lori PlayStation, ti o ti padanu, o le ba ṣiṣẹ bi plug ati pe o gba oludari lọ lati ni imu tuntun. Ti o ba ni kete ti ti dun awọn ere ati awọn ti o ri pe ti o ba wa ni kan ni papa ti o kún fun awọn eniyan pẹlu gbogbo awọn VR gilaasi lori wọn imu, ki o si nwọn ki o le lọ 1 to 1 kolu lori awọn shoulder ati ki o se alaye wipe o ti wa ni a game. Sibẹsibẹ, kikopa yi ko dabi pe a ti kọ ọ ti o rọrun. O wulẹ kan diẹ bi ẹyọ ọkan ẹwọn nibiti o ko le yọ pupọ ni rọọrun. Ṣugbọn boya o jẹ nitoripe a ti gbagbọ ninu imọran nipasẹ apata wa ni ere ti a ti wa lati da ara wa mọ. Boya o jẹ akoko lati gbe si 'nkan ti o wa ni ijinna""tabi boya a ko gbọdọ gba ere naa ju isẹ.",glot500
Yoruba,"""Tanrek"" n fun awọn ohun elo aabo fun awọn ọjọ 14-21 lati ọjọ ti ohun elo, eyi ti o le yatọ si da lori kokoro ati asa. Eyi le ṣe dinku nọmba ti awọn apọnirun ti kokoro.",glot500
Yoruba,"November 20, 2014. 10 effective Ayurvedic home remedies for acidity and gastritis (http://easyayurveda.com/2011/01/05/ayurvedichome-re medies-for-acidity-and-gastritis/) 3 Jan 2011 Ayurveda has given many home remedies for acidity and gastritis. Which are very simple, very easy to prepare and yet effective. Here are a few.",glot500
Yoruba,"""Awọn ACCME ṣe itọju iṣẹ rẹ fun ipade awọn ibeere itẹwọgba ACCME ati fun ṣe afihan pe tirẹ jẹ ajo ti o kọ ẹkọ ati oluranṣe iyipada fun awọn onisegun ti o n ṣiṣẹ. Iwọ ti fi idi adehun pẹlu ayika rẹ ṣe atilẹyin fun ẹkọ imọran ati iyipada ti o jẹ apakan kan ti eto fun ilọsiwaju didara. """,glot500
Yoruba,"Apapọ ti 50 T-9 ATAK Attack ati Helicopters Tactical Reconnaissance Helicopters nipasẹ TUSAŞ titi di akoko (41 EDI + 1 Alakoso-I / B6) si Aṣẹ ologun Land ati 1 (gbogbo B56) si Gendarmerie Command. Gbigbe. Ni afikun, ọkọ ofurufu akọkọ ti Oludari Gbogbogbo ti Aabo, eyiti o ni apapọ awọn aṣẹ 129 T-9 ATAK, ni a mu si laini ijọ ni Oṣu Kẹrin.",glot500
Yoruba,"4 Iniọvo re vwo mu sa mrẹ bẹnbẹn ayen vwọ vwẹ owian kẹ ihwo efa. Oshọ mu evo nẹ uphẹn rẹ ẹga rẹ ayen niri ghanghanre na cha va ayen abọ. Efa no nẹ ogangan rayen cha va ayen abọ, ighene na je cha sa riẹn erọnvwọn na ru-u. Efa ji roro nẹ ayen vwo ọke ayen vwo yono ohwo-o. O ji fo nẹ ighene na vwo odirin ọ da dianẹ uphẹn rẹ ẹga ji te ayen obọ-ọ.",glot500
Yoruba,"Ẹni ti ọrọ naa ṣoju rẹ sọ pe, Kazeem fi kaadi idanimọ rẹ han awọn agbofinro naa gẹgẹ bi agbabọọlu, ṣugbọn wọn kọti ikun sii.",glot500
Yoruba,"19:25 Sugbon ti o ko gbọ ohun tí mo ti ṣe lati ibẹrẹ? Lati ọjọ ti antiquity, Mo ti akoso ti o, ki o si bayi ti mo ti mu o lati wa ni. Ki o si ilu olodi wọnni ti ija ọkunrin yio di piles ti di ahoro.",glot500
Yoruba,O ni pataki fifi to ọlọpaa leti naa ni ohun to pada ṣẹlẹ nibi ipade ọhun nitori iru ipade bayii ṣeeṣe ki awọn kan fẹ daa ru.,glot500
Yoruba,"Egbe ni fun awọn ti o ni ile kún ile , ti nfi oko kún oko , titi ãyè kò fi si mọ , ki nwọn bà le nikan wà li ãrin ilẹ aiye !",glot500
Yoruba,"A ṣe agbejade rebar ṣiṣu ni Russia ati lo awọn ohun elo aise didara ga nikan lati awọn olupese ti agbaye. Nitori iṣapeye ti awọn kẹkẹ ẹrọ iṣelọpọ ati iṣelọpọ, idiyele awọn ọja wa ni isalẹ. Eyi jẹ ere fun ọ.",glot500
Yoruba,"Alága àjọ náà n;í ìpínlẹ̀ Adamawa, Kassim Gaidam sàlàyé pé àjọ náà ti ṣe gbogbo ètò tó yẹ láti mú èto náà lọ ni ìrọwọrọsẹ̀ lọ́jọ́ méjì si àsìkò yìí.",glot500
Yoruba,"Orilẹ-ede Haiti ni ẹsin yii ti bẹrẹ ati apa ilẹ Caribbean, nibi tawọn eeyan ti wọn ko lẹru lati iwọ oorun Afirika wa.",glot500
Yoruba,"July 16, 2015. GREEN COFFEE: User ratings for effectiveness, side effects (http://www.webmd.com/vitamins-supplements/ingredien treview-1264-GREEN+COFFEE.aspx?drugid=1264&amp;drug name=GREEN+COFFEE)PriceGrabber provides best prices on Babies & Kids. Shop and compare Babies & Kids prices, Toys, Baby Furniture and more online.",glot500
Yoruba,"O yẹ ki awa naa maa ronu, ka si maa gbe awọn igbesẹ lori ohun to lee mu alaafia, idagbasoke ati ominira ba awujọ wa, boya obinrin ni wa, abi ọkunrin, ọmọde ni wa, abi agba.",glot500
Yoruba,Aworan ibi to ti gbe ibọn dani to si duro niwaju ọkọ awọn ọlọpaa ni gbajugbaja oṣere Mercy Aigbe fi si oju opo Instagram tiẹ.,glot500
Yoruba,"Aa菊花体 (非商业使用)字体,AaJuhuati (Non-Commercial Use)字体,AaJuhuatiNon-CommercialUse字体,AaJuhuati(Non-CommercialUse)字体|Aa菊花体 (非商业使用) Version 1.000字体-TTF字体/未分类字体-字客网",glot500
Yoruba,Ṣayẹwo onimọran ete itanjẹ ati ni oye pipe nipa ile-iṣẹ naa. Awọn olubasọrọ pataki tabi awọn itọkasi mu ṣiṣẹ ipa pataki ninu gbigba awọn iṣẹ. Socialize lori ayelujara ati ni awọn iṣẹlẹ logan fun awọn anfani iṣẹ diẹ sii.,glot500
Yoruba,"O ha tọ́ si ọ ti iwọ iba ma tẹ̀mọlẹ̀ , ti iwọ iba fi ma gan iṣẹ ọwọ rẹ , ti iwọ o fi ma tan imọlẹ si ìmọ enia buburu ?",glot500
Yoruba,"Ọkunrin kan to n jẹ Abdullahi sọ fun Ajọ Akoroyinjọ ilẹ wa (NAN) pe: “Aago mẹta kọja iṣẹju mẹwaa la bẹrẹ si i gburoo ibọn, iro naa si rinlẹ gidi, o da bii pe niṣe ni wọn mọ-ọn-mọ fẹẹ fi ariwo ibọn naa bo igbe awọn akẹkọọ-binrin ti wọn fẹẹ ji ko naa mọlẹ, tori ko pẹ sigba ti wọn dawọ ibọn yinyin naa duro ni gbgbo agbegbe naa dakẹ wẹlo, ko si sẹni to gburoo bi wọn ṣe ko awọn ọmọleewe naa lọ.”",glot500
Yoruba,"Ni ọjọ kọkandinlogun oṣu keji ọdun 2018 lawọn Boko haram ji aadọfa akẹkọ gbe n'ile iwe kan ni ilu Dapchi, ipinlẹ Yobe",glot500
