language,text,source
Yoruba,"Sabira ṣalaye pe oun fi ile ọkọ oun silẹ lẹyin ti ọkunrin naa bẹrẹ si ni lu oun lalubami nitori oun lodi si ibalopọ lati iho idi lẹyin. ''Lati ọmọ ọdun mẹẹdogun ni awọn obi mi ti sin mi lọ si ile ọkọ, o si ti pe ọdun mẹwaa ti mo ti wa nile ọkọ bayii nibi ti mo ti bimọ mẹrin,'' Sabira lo sọ bẹẹ. Sabira sọ pe wahala bẹrẹ ni ile ọkọ oun ni bi ọdun meji sẹyin nigba ti ọkọ oun to jẹ awakọ beere fun ibalopọ iho idi lati ẹyin eyi ti oun kọ jalẹ. Sabira ni ''lati igba naa ni o ti bẹrẹ si ni lu mi bi bara, nigba kuu gba to ba ti sọ pe ibalopọ lati iho idi ya, mo maa kọ jalẹ.'' O ni oun gbẹjọ ọkọ oun lọ si agọ ọlọpaa, awọn ọlọpaa si ranṣẹ pe ọkọ oun. Adebola Ademilua: Àìrísẹ́ ṣè lẹ́yìn ìwé kíkà ló sọ mi dí ìyá onírú, mo dúpẹ́ tèmi Sabira ni: ''Ṣugbọn ohun ti ọkọ mi sọ fawọn ọlọpaa ni pe oun n beere fun ibalopọ lati ẹyin nitori oun ko fẹ ki n bimọ mọ ni,'' Sabira lo sọ bẹẹ. O ni awọn ọlọpaa bii leere pe kilode ti ko fi ṣe ifito sọmọ bibi ti ko ko ba fẹ ki oun bimọ mọ, lẹyin naa ni wọn kilọ fun un lati maa dan iru rẹ wo mọ. Amọ kaka ki ewe agbọn dẹ, niṣe lo n le koko sii, ọkọ Sabira ko dẹkun bibeere fun ibalopọ lati iho idi, bẹẹ ni ko si dẹkun lilu iyawo rẹ. Mo tun lọ fi ẹjọ rẹ sun awọn ọlọpaa lẹẹkeji lẹyin ti mo ri pe ọkọ mi ko ṣetan lati yipada. ''Ṣugbọn ohun tawọn ọlọpaa sọ fun mi ni pe ki n fi ọrọ naa silẹ fun Ọlọrun, lẹyin igba naa ni mo palẹ ẹru mi mọ ti mo si kuro nile ọkọ mi pẹlu awọn ọmọ mẹrin. Obinrin yii to n tọrọ owo loju popo ni Kaduna ṣalaye pe ọkọ oun ti ko kuro nibi tawọn jọ n gbe, nọmba foonu ko tiẹ lọ mọ bi oun ba pe e. Sabira ni oun ti oun sọ fun ọkọ oun ki awọn to pinya ni pe oun yoo fẹ ọkọ mii, o si sọ pe o tẹ oun lọrun. Akọ́mọlédè àti Àṣà lórí BBC Yorùbá: Kọ̀ síi nípa iṣẹ́ tí oúnjẹ ń ṣe lára níbí",glot500
Yoruba,USA-Casino-Online.com > Ojoojumọ imudojuiwọn Casino Awọn ẹbun okowo ✅✅✅ Ko si bonus idogo 水 Awọn eré oyinbo ọfẹ RES Ere-ọfẹ ins Aago owo-ori ☛ Cashback fun awọn ti o dara julọ Casino Online.,glot500
Yoruba,"Minisita Alakoso Binali Yildirim, Igbakeji Alakoso Minista Bulent Arinc, Minisita Iṣẹ Labour Faruk Celik, TCDD Gbogbogbo Alakoso, Awọn oludari ati awọn aṣeiṣẹ-iṣẹ pẹlu awọn olukopa ti o pọju, akọkọ ipele ti Ilẹ-iṣẹ Ikọja-giga Iyara 75 ti Bursa-Yenisehir laini.",glot500
Yoruba,Looto won pin si ipele meji: boya wa sise nigba ti o ba n rin irin ajo tabi ko gbiyanju lati din owo nina re ku. Aroko eyi tokasi ti igbeyin.,glot500
Yoruba,"Gomina Makinde ni igbesẹ to lamilaaka ni iṣejọba oun n gbe bayii, lati dẹkun iwa jẹgudujẹra lẹnu iṣejọba.",glot500
Yoruba,"Yan awọn irugbin ti o ṣe pataki julọ ko dagba ju ọdun meji lọ, ti o wa lati igi akọkọ ni aaye ti o ju 1 m lọ.",glot500
Yoruba,"Latigba naa ni Agbẹjọro wọn, Pẹlumi Ọlajẹngbesi, atawọn mi-in ti wa lori ọrọ naa, ko too di pe wọn gba itusilẹ lọjọ Ẹti, Furaidee, opin ọsẹ yii.",glot500
Yoruba,"“Alà depope he to go e bo ma to sinsẹ́n detọ́n wẹ [Otọ́ ṣie] nọ desẹ podọ dehe to sinsẹ́n detọ́n lẹpo wẹ ewọ nọ hẹn zun wiwe, na e nido de sinsẹ́n tọ́n dogọ. . . . Kẹdẹdile alà ma sọgan de sinsẹ́n tọ́n na ede adavo e gbọṣi vẹntin lọ go do, to aliho dopolọ mẹ, mọjanwẹ mìlọsu ma sọgan do, adavo mì gbọṣi kọndopọ mẹ hẹ mi. Yẹn wẹ vẹntin lọ, mìwlẹ wẹ alà lẹ.”—Johanu 15:2-5.",glot500
Yoruba,Ṣaaju eyi naa ni ọpọlọpọ eekan oloṣelu ti kọwe si ile iṣẹ ọlọpaa ti awọn naa ko si jafinra lori iwadii ọrọ naa.,glot500
Yoruba,"Tween 80 ati Soya Lecithin Ipilẹ Ounje Ipilẹ Nanoemulsions fun Ifijiṣẹ Ipa ti Vitamin D. Mehmood T, Ahmed A. Langmuir. 2020 Mar 2. doi: 10.1021 / acs.langmuir.9b03944. [Epub niwaju titẹjade]",glot500
Yoruba,"Lonii, Ọjọru, Wẹsidee ni ijọba ipinlẹ Kwara labẹ Gomina AbdulRahman AbdulRazaq tun dẹrin pẹẹkẹ awọn ọdọ, paapaa awọn olokoowo kekeeke pẹlu pẹlu bo ṣe yọnda owo ti ko din ni miliọnu mẹta naira fun ẹnikọọkan lati ya fi bẹrẹ okoowo wọn.",glot500
Yoruba,"O si mu u sọkalẹ , si wõ , nwọn si tànka ilẹ , nwọn njẹ , nwọn nmu , nwọn si njo , nitori ikogun pupọ ti nwọn ko lati ilẹ awọn Filistini wá , ati lati ilẹ Juda .",glot500
Yoruba,"Alameda, CA - Kínní 20, 2020 - Ile-iṣẹ North North titun, ti o wa ni ile laini San Francisco, gba igbesoke ti a nilo pupọ ti o jẹ awọn abajade ti o lagbara pupọ. Dojuko pẹlu ipọnju ti iyin igbalode ati iṣẹ ijosin ni ibi isunmọ kan, Zak Stamps, Oludari Imọ-ẹrọ, ti fẹrẹ fi ireti dide pe oun yoo wa ojutu intercom kan ti o gba laaye ẹgbẹ iṣelọpọ rẹ lati ṣe irọrun ibasọrọ laibikita ibaramu SPL. A dupẹ pe ipe kan si Clear-Com ṣafihan ojutu ti Stamps ati ẹgbẹ rẹ nilo ni akoko fun awọn iṣẹ Keresimesi, pẹlu ẹbun ti a ṣafikun (ati airotẹlẹ) igbelaruge ninu ikopa ti yọọda. Ile ijọsin naa ni ...",glot500
Yoruba,"16 Na ngu 36 ni ti komandema ti Asa, Baasha+ gbia ti Israël aga na bira na terê ti azo ti Juda. Lo komanse ti leke peko* ti gbata ti Ramah+ ti kanga lege si zo asigi na yâ ti gbata ni pëpe nga si zo ague na ndo* ti Asa gbia ti Juda pëpe.+ 2 Tongana Asa abâ ye so, lo mû argent na lor so ayeke na yâ ti ando so a bata mosoro dä na da ti Jéhovah+ nga na da* ti gbia, lo tokua ni na Ben-Hadad, gbia ti Syrie+ so asara kodro na Damas. Asa atene na lo: 3 “Mbeti ti siriri* ayeke na popo ti mbi na mo, tongana ti so a yeke na popo ti babâ ti mbi na babâ ti mo. Mbi tokua na mo argent na lor. Tongaso mo ga, mo buba yâ ti siriri* so ayeke na popo ti mo na Baasha gbia ti Israël, si lo zia mbi.” 4 Ben-Hadad ayeda na tënë so Gbia Asa atene, na lo tokua amokonzi ti aturugu ti lo ti londo na bira na terê ti agbata ti Israël. Ala futi gbata ti Ijon,+ ti Dan,+ ti Abel-Maïm nga na ando kue so a yeke bata ye dä na yâ ti agbata so ayeke na sese ti azo ti mara ti Nephtali.+ 5 Tongana Baasha amä tënë ni, hio lo zia lege ti lekengo peko* ti gbata ti Ramah, na lo dö kua ni lo zia. 6 Gbia Asa amû azo ti Juda kue, na azo ni amû atênë nga na akota keke so Baasha azia na Ramah+ ti leke na peko ti gbata ni,+ ala gue na ni na Asa si lo leke peko* ti gbata ti Guébah+ nga na gbata ti Mizpah na ni.+ 7 Na ngoi ni so, Hanani+ zo ti bango ye ague na ndo ti Asa gbia ti Juda na lo tene na lo: “So mo zia bê ti mo kue* na gbia ti Syrie me mo zia bê ti mo kue* na Jéhovah Nzapa ti mo pëpe, aturugu ti gbia ti Syrie akpe na maboko ti mo awe.+ 8 Aturugu ti Éthiopie na ti Libye ayeke lani gbani gbani ape? Nga ala ga na gbâ ti apuse ti mbarata na azo ti kpengo na mbarata ape? Me so mo zia bê ti mo kue na Jéhovah, lo zia ala na maboko ti mo,+ 9 ndali ti so lê ti Jéhovah ayeke bâ ndo na ndö ti sese kue+ ti mû ngangu ti lo ti mû maboko na azo so azia bê ti ala kue* na lo.+ Me ti so ni so, mo sara ye tongana zo ti buba. Ti londo laso ti gue na ni, azo ayeke ga na bira na terê ti mo.”+ 10 Me bê ti Asa ason na terê ti zo ti bango ye, na lo bi lo na da ti kanga* ndali ti so ngonzo asara lo mingi ndali ti tënë so. Asa akomanse nga ti sara pasi na ambeni zo na oko ngoi ni so. 11 Âdu ti mbaï ti Asa, ti londo na tongo nda ni juska na kongo nda ni, a sû ni na yâ ti Mbeti so afa tënë ti gigi ti agbia ti Juda na ti Israël.+ 12 Na ngu 39 ni ti komandema ti Asa, lo wara mbeni kobela na gere ti lo juska kobela ni ahon ndö ti lo. Atâa na yâ ti kobela ti Asa so, lo gi mungo maboko na mbage ti Jéhovah pëpe me na mbage ti azo ti kaïngo kobela. 13 Na pekoni Asa akui, na lo wu terê ti lo tongana ti akotara ti lo.+ Lo kui na yâ ti ngu 41 ni ti komandema ti lo. 14 A lu lo na yâ ti dû ti kuâ so lo hunda ti tene a zi ni ndali ti lo na kota cimetière so ayeke na Gbata ti David.+ Ala zia kuâ ti lo na ndö ti gbogbo ti kuâ so asi singo na mafuta ti keke ti baume nga na mara ti ayombo nde nde so a mélangé ni ti ga mbeni pendere yombo.+ Na pekoni, ala tingo mbeni kota wâ ndali ti lo.*",glot500
Yoruba,"Lilo yi ọna ti ni ojo iwaju yoo gba awọn Singapore bank, Mitsubishi, ati ki o aigbekele ile ise miiran lati “siwaju mu awọn oniwe-oloomi isakoso ṣiṣe ati ki o din wọn iye owo” awọn ile ifowo pamo si wi.",glot500
Yoruba,• Market to wa ifiweranṣẹ akojọ tabi tẹsiwaju lati fi apamọ to wa oni ibara lẹhin ti awọn atilẹba idunadura ti lodo wa.,glot500
Yoruba,"Mìmì kan kò mì wá, Ẹlẹka yóò jíǹde bí i Lasaru inú Bíbélì -PDP Ekiti 'Fashọla, o ò dẹ̀ bẹ̀rù Ọlọ́run!",glot500
Yoruba,Awọn aṣọ iyipo Roba ni Awọn Irin-ajo Reluwe Ipele Yoo ṣee ṣe Opo oju opopona Yii ati Awọn iroyin Ọkọ ayọkẹlẹ CableRayHaber Bulletin 25.01.2019 Tender Bulletin 25 / 01 / 2019 Ko si awọn igbasilẹ tutu fun 25.01.2019 ninu eto wa.RayHaber Bulletin 04.02.2019 Tender Bulletin 04 / 02 / 2019 Ninu eto XXX wa eto [More ...],glot500
Yoruba,"A gbo pe bawon adigunjale naa ti se ri moto awon olopaa ni won ti koju ibon si won, toro si di boo lo o yago laarin awon olopaa atawpon odaran naa, ko too di pe awon meji fara gbota, ti won si ku lesekese.",glot500
Yoruba,"Awọn 27,000 square ẹsẹ ipinle-ti-ni-aworan gbóògì aaye ẹya kan 4K opo ati aaye fun 250 awọn ošere. Los ANGELES- FuseFX, eyi ti o ti se iranwo ja awọn resurgence ti wiwo igbelaruge gbóògì ni Los Angeles, ti gbe awọn oniwe-ise to a 27,000 square ẹsẹ apo on Califa Street ni Sherman Oaks agbegbe ti Los Angeles. Ninu meji contiguous free-duro ẹya, titun sii ...",glot500
Yoruba,"Oluṣakoso Gbogbogbo Gbigbe ti TCDD Kamuran Yazıcı lọ si awọn apejọ laarin awọn ipari ti CD TCDD Transportation AŞ 2019 Ọdun Isubu Term In-Service Training gerçekleştiril ti o waye ni Kuşadası. Ṣiṣe ọrọ si awọn olukopa nibi, Yazıcı salaye awọn eto imulo ọkọ-irin-ajo ti o tẹle lẹhin 2003. [More ...]",glot500
Yoruba,"Nike-UOMO-Nike Free 4.0 Flyknit Casuale Marca, Nike-UOMO-Nike Free 4.0 Flyknit Alta Qualità, Qui Potete Vedere CosÌ Tanti Prodotti Saldi In Italia",glot500
Yoruba,Figiini wig ti jẹ koko-ọrọ ti anfani laarin awọn ayelujara ti o wa ni ibiti o ti bẹrẹ si ibiti o ti wa. Awọn aworan bi ẹni ti isalẹ wa lori ayelujara.,glot500
Yoruba,"O ni Igbakeji gomina ipinlẹ Ondo ni lọkan lati di gomina ni o ṣe lọ darapọ ẹgbẹ oṣelu ZLP ti yoo fun ni anfaani lati dije dupo, eleyii ti o lẹtọ si labẹ ofin.",glot500
Yoruba,"Ni odún 2022,ni won yan Rabiu Kwankwaso gege bi oludije fun aare orílẹ̀ èdè Naijiria ti odun 2023 lábẹ́ àsíyá ẹgbẹ́ òṣèlú New Nigeria People's Party.",glot500
Yoruba,"""Alex Haley’s Other Roots: African-Americans with Irish Ancestors"". February 25, 2006. Archived from the original on 2006-04-14. Retrieved 2008-02-22.",glot500
Yoruba,Igbese idoko-owo European (EIB) ati Bank Development Bank (AfDB) ti gbawọ lati ṣe atilẹyin fun Idagbasoke Idagbasoke tuntun ti Nigeria (DBN) pẹlu $ 70 milionu.,glot500
Yoruba,"Pẹlu kan ẹdọ lori ọkan ẹgbẹ, awọn ibile iho ere won popularly mọ bi ọkan - ologun olè, o daju wipe awọn lefa aini lati wa ni lai- lati omo ere awọn kẹkẹ ati nibẹ wà Iseese fun awọn ẹrọ orin to wa ni osi pẹlu fere ohunkohun lọ si awọn iho ere awọn orukọ. Biotilejepe ti orukọ kò Stick, awọn gbale j'oba, si ohun iye ti fere gbogbo pataki kasino fi kan ti o dara ni ipin ti won itatẹtẹ si awọn iho ere. Pẹlu Kolopin fẹ ni iho ojula, o jẹ lẹwa airoju lati yan ọkan ojula lati mu, nibi yi akojọ ti oke mẹwa Iho ojula lati ṣe rẹ iho game irin ajo dan.",glot500
Yoruba,"First, jẹ ki ká koju si o – bọọlu afẹsẹgba ni gbogbo nipa igbelewọn afojusun. Mo tunmọ si ti o ko ni kọsẹ lori egbe Ifimaaki afojusun? ki, understandably, julọ ​​ninu awọn kalokalo ogbon ju awon gbeyewo ona ati awọn ọna lati ṣe asọtẹlẹ a ìlépa.",glot500
Yoruba,"Coronavirus Update: Èèyàn mẹ́sàn án míràn tún ni Coronavirus nípìnlẹ́ Eko, ó di èèyàn 111 tó níi ní Nàìjíríà Oríṣun àwòrán, Getty Images Eniyan mẹrinla miran tun ti ni aarun coronavirus ni orilẹ-ede Naijiria.",glot500
Yoruba,"Ortum ni Benue jẹ ipinlẹ to kun fun agbẹ alarojẹ ati alada nla, fun idi eyi awọn darandaran n ba ere oko wọn jẹ ni.",glot500
Yoruba,"Ṣe ẹlẹyamẹya ICC ni? African potentates ti wa ni níbi: Nwọn bẹru kú ni The Hague International odaran ẹjọ (ICC) ti wa ni ifọnọhan a ""too ti ẹda sode"" nipa ko tele pe ile Afirika, wipe awọn Alaga ti African Union ( UA), Alakoso Agba Ethiopia ti Hailemariam Desalegn. Awọn wọnyi ni kanna-ede ti o ni awọn julọ fase si awọn adehun ti Rome ro pe nibẹ ni ẹlẹyamẹya ati awọn ti o ni ko won buruku ni lowo. O ti wa ni otitọ wipe yi igbekalẹ ṣeto soke nipa Western awọn orilẹ-ede lati fa ibere, awọn aṣẹ ni lati fi iya awon ti ko ba wo dada sinu awọn m ninu awọn orukọ ti eto eda eniyan, ti eyi ti o gbọdọ ojo kan ti a yoo fun wa ni gbogbo definition ... a olurannileti ti ọrọ, awọn United States ti ṣi ko wole ni Rome adehun Igbekale awọn ICC nitori awọn uS orileede fàye America ti wa ni dajo nipa orilẹ-ede miiran",glot500
Yoruba,"Ni akoko kanna, profaili ti o dara kan fihan pe iwọ yoo kọ awọn atunṣe didara to gaju nikan nipa ti ara ati ti ara-ara. Fún àpẹrẹ, ẹtan, àwúrúju, ìsọrọ-gíga, iṣowo, owo tabi awọn paṣipaarọ pẹlu awọn ìjápọ jẹ Google ti o korira julọ.Ni pato, iru awọn iwa naa ko kuna lati tẹle Awọn Itọnisọna Olupari Ọga wẹẹbu, eyiti a gba fun igbasilẹ wẹẹbu ati gbogbo ero ti Iwadi Iwadi Imọye ni ipele. Nitorina, kini o ṣe ilana ti o ni imọran ọna asopọ ""ofin"" deede ti ko le ṣe akiyesi bi o ṣẹ? Gbogbo ohun ti o nilo ni lati ṣe awọn atokopo ti o ga julọ lai ṣe itọkasi fun awọn ti a ti sọ tẹlẹ ti ẹtan tabi awọn ilana iṣowo ti a ko fọwọsi nipasẹ awọn eroja pataki. O kan ṣe awọn ohun ṣẹlẹ nipa ti ara.",glot500
Yoruba,"Nigba ti awọn to wa ipele kẹwaa si mẹrinla yoo ṣe ni afikun ida mẹrindinlogun ninu ida ọgọrun un, ni awọn to wa ni ipele kẹẹdogun si ipele kẹtadinlogun yoo ṣe ni afikun ida mẹrinla owo oṣu.",glot500
Yoruba,Iroyin lati awọn orisun olokiki sibẹsibẹ fi han pe wọn n gbe ni ilu Spani ilu ti Santa Cruz de Tenerife gbajumo julọ bi ilu ti iseda.,glot500
Yoruba,A pataki Plus ti LadyLucks Casino ni wipe o ni o ni ohun html ti ikede fun Windows ati Blackberry foonu ju.,glot500
Yoruba,"14 Ni pripri God Israel mingg wo rar nuqond mas ye mir te kin me ye te nginy naghe no pre ei mir te me ye. Pugri bu muq nginy naghe no pre bu Jisas nikin aposel ane mas ei mir mand ningg. 15 Di ni nikin wute simbe nindim nari, “Nginy yumbui nen kin mir nge nungoqi ane pas mir bad yawo quan nganye kuregh. Te pre dobu muqdi nge yuqo kiraq. 16 Te pugri nge nungoqi simbe guduq, nge nginy yumbui nen kin mir aye mune ke segi segine ruso ruso otiwo God ni king ningg nas di wute yumbo yumbo buagi ane ninde si nambu ris kin ngeri te rindi. Di mir wen yumbo ur bei wund kin te nganyene puq ren pre di nge mir wen kaq.”",glot500
Yoruba,"Baba mímọ́, fi agbára orúkọ rẹ pa àwọn tí o ti fi fún mi mọ́, kí wọ́n lè jẹ́ ọ̀kan, gẹ́gẹ́ bí àwa náà ti jẹ́ ọ̀kan.",glot500
Yoruba,"Awọn ara ile Israeli si pè orukọ rẹ̀ ni Manna ; o si dabi irugbìn korianderi , funfun ; adùn rẹ̀ si dabi àkara fẹlẹfẹlẹ ti a fi oyin ṣe .",glot500
Yoruba,Sample! Nigbagbogbo jẹ leery ti locksmiths ti o fẹ lati gba agbara si siwaju sii ni kete ti nwọn dé nmu. Eleyi jẹ itanjẹ lati lo anfani ti a eniyan ni a desperate ipo.,glot500
Yoruba,"Nipasẹ eyi, ọkan le ṣe akoko ti o tọ ni imudarasi awọn iṣoro lati loyun. Ọkan ninu Tamoxifen Citrate lulú Awọn anfani ni pe o ti han lati ṣe ayẹwo awọ-ara-ara ni kiakia. Bakannaa, o nmu awọn ovaries dagba lati gbe awọn eyin pupọ sii ti ọkan ba ti ṣiṣẹ ọkan. Awọn anfani pẹlu rẹ ni pe lilo rẹ kii ṣe igbadun ati ipalara bii lilo ti gonadotropin (awọn oogun oogun inu itọju).",glot500
Yoruba,"The University ni o ni ọpọ campuses ni Albury-Wodonga, Bathurst, Dubbo, Goulburn, ọsan, Port Macquarie, Wagga Wagga andCanberra. The University tun sise PATAKI ile-iṣẹ ni North Parramatta, manly (Sydney), baje Hill, Wangaratta bi daradara biRegional University Ìkẹkọọ Centres ni Griffith ati Parkes. Courses ti wa ni tun fi ni apapo pẹlu Ìkẹkọọ Group Australia inSydney, Melbourne ati Brisbane (mọ bi CSU Ìkẹkọọ Centres).",glot500
Yoruba,"""Lawal kii se Jigolo, ibudo to ti n ta mọto mẹta lo ni laarin Lekki si Ajah, to si tun ni ileesẹ ti wọn ti n fọ ọkọ.",glot500
Yoruba,"Bawo ni eyi ṣee ṣe? Ni awọn osu 4, gbogbo awọn Fiorino ti yi iyipada patapata lati inu idibo si ọtun si PVDA ti osi! Awọn iṣẹ iyanu ko jade kuro ninu aiye! A le ṣe eyi daradara julọ ""Gbẹnagbẹna ipaDarukọ tabi rii nikan pe awọn idibo jẹ ẹtan eke. A n ṣe ẹlẹri idibo idibo nibi! O jẹ gbogbo nipa titari si Frans Timmermans (ti o ngbaradi fun ipo rẹ fun awọn ọdun), si ọna alakoso EU.",glot500
Yoruba,"5 Vwẹ ikpe re kpahen 1960, uruemu rẹ eya gbe eshare vwọ dia kuẹgbe jẹ ayen ji rhi rọvwọ-ọn de rhi bunphiyọ, ọtiọyen ji te uruemu rẹ eshare vẹ eshare vwọ mroma, kugbe orọnvwe ẹfan. Ka mrẹ ihwo ri gbe ọfanrhiẹn vwẹ erọnvwọn buebun ra vwọ diotọ. Die kọyen rhi nẹ obuko rọyen rhe? Ohwo ọvo ro yono ẹbe kodo tare nẹ, erua re hra, emọ rẹ ọsẹ yẹrẹ oni ọvo vwẹrote, uruemu re vwo ni ihoho rẹ ihwo re banphiyọ vẹ efa tiọyena buẹnphiyọ fikirẹ “ẹro rẹ ihwo buebun vwo ni ọfanrhiẹn.” Ega rẹ ọfanrhiẹn ghwa yan kerẹ AIDS rọ rhoma buẹnphiyọ na, ọyen odjephia ọvo nẹ aghwanre rẹ akpọ na ghene ughẹnghẹn.—2 Pita 2:19.",glot500
Yoruba,"O ni ti o ba di opin ọdun yii , eto iṣuna ọdun 2020 yoo di fifi ṣọwọ si ile Igbimọ Aṣofin ki o to di fifọwọ si fun Gomina Makinde.",glot500
Yoruba,"Bakan naa lo ke si awọn lọbalọba ni ilẹ Yoruba lati kesi Gani Adams lati ti ọwọ ọmọ rẹ bọ aṣọ, ko ye sọrọ kubakugbe si awọn asaaju rẹ ati awọn ti wọn kii ṣe irọ.",glot500
Yoruba,"Lara awọn ti wọn tun n reti nibi ayẹyẹ naa ni Ọba Adéyẹyè Ẹnitàn Ògúnwùsì, Ọ̀jájá II, Ọọ̀ni ti Ile Ifẹ̀, awọn gan an ni alejo pataki ọjọ naa, nitori eto naa jẹ eyi ti wọn fẹẹ fi sami ayẹyẹ ọdun kẹfa ti Mama, Oloye Hannah Idowu Dideolu Awolọwọ CON, jade laye.",glot500
Yoruba,"O si ṣe , bi Mose ti dé ibi agọ́ na , ọwọ̀n awọsanma sọkalẹ , o si duro li ẹnu-ọ̀na agọ́ na : OLUWA si bá Mose sọ̀rọ .",glot500
Yoruba,"Ibi ti a ti gbiyanju lati pe fóònù rẹ ni awọn ara sọọsi ti pe wa lati wa a wo, nitori awọn o mọ nkan ti wọn ṣe fun.",glot500
Yoruba,"O si lọ lori lati se apejuwe ọjọ na, Oluwa ọjọ le ko ohun iyanu wa bi olè nitori ti a jẹ imọlẹ. O si dopin gbogbo awọn ti o nipa ifẹsẹmulẹ wipe o jẹ idanwo ti o ti kọ, o si idaniloju wipe a ko ikarahun ibinu, ṣugbọn igbala nipasẹ Jesu.",glot500
Yoruba,"Although NBC in the United States presented the entire opening ceremony from start to finish, a topless Minoan priestess was shown only briefly, the breasts having been pixelated digitally in order to avoid controversy (as the ""Nipplegate"" incident was still fresh in viewer's minds at the time) and potential fines by the Federal Communications Commission. Also, lower frontal nudity of men dressed as ancient Greek statues was shown in such a way that the area below the waist was cut off by the bottom of the screen. In most other countries presenting the broadcast, there was no censorship of the ceremony.",glot500
Yoruba,"Gbogbo wọn lo sọ pe awọn ti padanu awọn mọlẹbi, ti ọjọ ori wọn wa laarin ọdun mẹẹdogun si mẹrinlelogun.",glot500
Yoruba,"Başkan Yüce, Sakarya'ya Raylı Sistem Getirerek Tarihe Geçmek İstiyor | RayHaber | Reluwe | Opopona | USB ọkọ ayọkẹlẹ",glot500
Yoruba,"Jíjẹ oúnjẹ tàbí mímu omi tí ìgbẹ́ alarùn kan ti ṣe àkóbá fún ni ó máa n tan àìsàn náà kálẹ̀  . Ẹja-oníkarawun tí a kò bá ṣè jinná dáadáa tún jẹ́ orísun okùnfà tó wọ́pọ̀ fún àìsàn yìí. Ó sì tún lè jẹ nípasẹ̀ fífi ara kan ẹni kan tí ó ní àìsàn náà lára. Bí ó tilẹ jẹ́ pé ni ọ̀pọ̀ ìgbà ni kì í hán lára àwọn ọmọdé bí wọn bá ní àìsàn náà lára, síbẹ̀ wọn lè ko ran ẹlòmíràn . Lẹ́yìn tí àìsàn náà bá sì ti ṣe ẹnìkan lẹ́ẹ̀kan, kò tún ní í lè nípá lórí ẹni náà mọ́. Ṣíṣe àyẹ̀wò àìsàn náà nílò pé kí a ṣe àyẹ̀wò ẹ̀jẹ̀ nítorí tí àìsàn náà farapẹ́ irúfẹ́ àwọn àìsàn bẹ́ẹ̀.  Èyí jẹ́ ọ̀kan lára àwọn kòkòrò-àrùn hepataitisi márùn ún tí a mọ̀: A, B, C, D, àti E.",glot500
Yoruba,"Melaye who was recently accused by online news medium Sahara Reporters of not graduating from the institution shared a photo of him holding his certificate, surrounding by his supporters.",glot500
Yoruba,"Ọmọbinrin Farao si wi fun u pe , Gbé ọmọ yi lọ ki o si tọ́ ọ fun mi , emi o si san owo iṣẹ rẹ fun ọ . Obinrin na si gbé ọmọ na lọ , o si tọ́ ọ .",glot500
Yoruba,"Bitenieks, J .; Meri, RM; Zicans, J.; Maksimovs, R .; Vasile, C.; Musteata, VE (2012): Styrene – acrylate / carbon nanotube nanocomposites: ẹrọ, igbona, ati awọn ohun-ini itanna. Ninu: Awọn ilana ti Ile-ẹkọ giga Estonia ti Imọ-jinlẹ 61/3, 2012. 172-177.",glot500
Yoruba,Erongba ijọba pẹlu nọmba idanimọ ni pe ki awọn eeyan ma lo fun gbogbo ohun to ba ni ṣe pẹlu iforukọsilẹ.,glot500
Yoruba,"O ni oun ko ni igbagbọ ninu ohun ti ijọba sọ pe awọn ṣọja to lọọ koju awọn to n ṣewọde lọ sibẹ lati pa ofin konilegbele ti ijọba Eko paṣe ẹ mọ ni.  O ni, “Ohun ti mo mọ daju ni pe ki i ṣe ijiya iku lo wa fun ẹni to ba jẹbi ẹsun aitẹle ofin konilegbele, ati pe lasiko igba ti wọn bẹrẹ si i yinbọn paapaa, ofin konilegbele tijọba Eko paṣẹ ẹ, ko ti i bẹrẹ rara.",glot500
Yoruba,"Igberi de Ogun Asaba Ogun yakun ela esan Olimo Ogun iya kere Oniro Asesu Ogun onyon de Ayifo Opeki de Ofiki Ibu gba nyanri Alaro de Ibu Olosun Ogaga Yeye Oríkì para Yemonjá Ogun Asaba (rio) Rio de Ogun em nove partes Dono da folha de palma Rio de Ogun, mãe pequena de Oniro, Asesu (Um caminho de Yemoja) Ogun Ayifo Rio que tem peitos Fluxo ...",glot500
Yoruba,"A yan kale nipasẹ oludasiṣẹ Ahmed Medhat Sadeq, ti oje oludari Tamer Mohsen, lati ṣe ipa ti “Toka” ati lẹhin ti o ja gere ni awọn idanwo, eyiti o yori si ipa ti o gba. [1]",glot500
Yoruba,"Nibẹrẹ oṣu yii, obinrin kan to jẹ ọmọ orilẹede Britain jẹ ọ̀kan lara eniyan meji ti awọn agbebọn pa lasiko ti wọn kọlu ibudo igbafẹ kan niluu Kaduna.",glot500
Yoruba,"Ile-iṣẹ Dash jẹ miiran cryptocurrency oni-nọmba miiran. Ni pato, o le lo awọn owó crypto wọnyi lati ṣe awọn isanwo ikọkọ lori ayelujara. Ile-iṣẹ Dash ti n lọ sinu awọn iru paṣipaarọ cryptocurrency. Ile-iṣẹ naa tọ lati gba iṣẹ ati ni pato wọn jẹ ọkan ninu awọn ti o dara ati daadaa dagba ni lori ọja cryptocurrency. Ile-iṣẹ naa nlọ daradara pupọ si nẹtiwọọki P2P atẹle.",glot500
Yoruba,"Nigba to n bakọroyin wa sọrọ, Bale Alabata, Oloye Julius Ọladokun Itanọla, sọ pe afurasi ọdaran naa ki i ṣọmọ ilu oun, bo tilẹ jẹ pe Alabata nibẹ naa lo n gbe, to si ti n ṣiṣẹ.",glot500
Yoruba,Nyen la ayeke passé ka na alakui ti matanga ti akpangba? Kamba wa la ayeke na popo ti fango ye ti Jésus na ye ni so?,glot500
Yoruba,"Ọsan ọjọ Abamẹta, Satide, oni yii ni Aarẹ Trump sọrọ yii ninu atẹjade kan to fi sọrọ lori abajade ibo to fẹyin rẹ janlẹ naa, Trump ni ibo ko ti i pari rara ni.",glot500
Yoruba,"Lisa Mitchell, ti Olukọni Aṣeyọri Olumulo Aṣeyọri Iyọlẹgbẹ , alaye ti o wa ni yiyọ SEO ati ki o wa ni aaye ayelujara rẹ.",glot500
Yoruba,"Ni afikun si awọn ami wọnyi loke, o tun han gbangba pe ṣiṣẹda awọn gige, tabi awọn aworan iboju, ti koko akọkọ jẹ ayanfẹ yiyan apẹrẹ fun awọn ti o ni akoko, owo, oṣiṣẹ, tabi oye ti o yẹ lati fa kuro.",glot500
Yoruba,Etravirine jẹ oogun ti aporo ti o n daabobo awọn iṣan ti aibikita aisan eniyan (HIV) lati isodipupo ninu ara rẹ. A n lò Etravirine pẹlu awọn oogun miiran lati tọju HIV ni awọn agbalagba ati awọn ọmọde ti o kere ju 6 ọdun. Kokoro HIV nfa ailera àìdánimọ ti a n wọle (AIDS). Etravirine kii ṣe itọju fun HIV tabi AIDS.,glot500
Yoruba,"Iṣẹlẹ naa dun Williams pupọ pe laarin ọjọ meji ti iṣẹlẹ iṣẹlẹ, o ti gba awọn ibuwọlu 6,000 lori ẹbẹ fun alaafia ati pe o ni akiyesi media jakejado. Pẹlu Corrigan, o ṣe ipilẹ Awọn Obirin fun Alaafia; eyiti, pẹlu Ciaran McKeown, nigbamii di  'Community of Peace People' .",glot500
