language,text,source
Yoruba,"6:8 ati awọn ti o mú nyin wá si ilẹ, lori eyi ti mo ti gbé ọwọ mi soke ni ibere lati fun o to Abraham, Isaac, ati Jakobu. Emi o si fi ọ fun nyin bi a ìní. Emi li OLUWA. """,glot500
Yoruba,"""/> Buy Slash Neck Ruffles Sashes Striped Long Loose Jumpsuit ⭐⭐⭐⭐ - Free Shipping & No Tax | WoopShop ®",glot500
Yoruba,"Emi si wipe , Bawo li emi o ṣe gbe ọ kalẹ pẹlu awọn ọmọ , ati lati fun ọ ni ilẹ ayanfẹ , ogún daradara , ani ogún awọn orilẹ-ède ? Emi si wipe , Iwọ o pè mi ni , Baba mi ! iwọ kì o si pada kuro lọdọ mi .",glot500
Yoruba,"Agbẹnusọ fawọn ọlọpaa ipinlẹ naa, DSP Abdullahi Haruna Kiyawa to fi iroyin ọhun to wa leti lonii, ọjọ Abamẹta, Satide jẹ ko di mimọ pe ọkan lara awọn ara agbegbe Kwanar Ganduje, Sharada Phase II Quarters, lo ta wọn lolobo loṣu to kọja, ti iwadii si bẹrẹ.",glot500
Yoruba,"Ilana Federal ati imudaniloju wọn ti ko dara pẹlu awọn ọlọtẹ ti ṣe orukọ titun kan, ipe-ipero kan ti njade fun ẹgbẹ awọn ẹgbẹ ti o ni ẹdun (Militants) ti Niger Delta; wọn nick-oniwa ti a npe ni ""Amnesty"". Awọn eniyan ọlọrọ pupọ ti o ṣe aiṣedede ti o yẹ, (ọkan ko le da wọn lẹbi) ti bẹrẹ lati ri ohun gbogbo bi ailopin ifarada ti awọn ọrẹ ati awọn alailẹgbẹ wọn, awọn anfani ti ọrọ ati ọlá. Ibeere naa ni, tani o nilo Amnesty; awọn oniwadawadi tabi awọn ti ilẹ ati aisiki rẹ ti wa ni sabọ?",glot500
Yoruba,"9:22 wipe, ""Nitori Ọmọ enia gbọdọ jìya ohun pipọ, ao si kọ ọ lati ọdọ awọn àgbagba ati awọn olori awọn alufa, ati awọn akọwe, ao si pa, ati lori awọn ijọ kẹta jí dìde. """,glot500
Yoruba,"Dongguan Zhantuo Optical lẹnsi Co., Ltd jẹ ọkan ninu awọn asiwaju ọjọgbọn olupese ni opitika ile ise siwaju sii ju ewadun, be ni ""Logistic Center of China"" - Humen. Pẹlu rọrun transportation wiwọle, gbogbo awọn ti wa awọn ọja ni ibamu pẹlu okeere didara awọn ajohunše muna ati ki o ti wa ni gidigidi abẹ ni orisirisi kan ti o yatọ si awọn ọja jakejado aye. Bi ọkan pataki agbara specialized ni R & D ati ẹrọ orisirisi ti ṣiṣu opitika lẹnsi, a ileri lati pese awọn onibara wa ti o dara ju didara pẹlu ifigagbaga owo, ni kikun pade rẹ opitika awọn ibeere.",glot500
Yoruba,Ile-iṣẹ yiyalo ọkọ ayọkẹlẹ Limo pẹlu awọn iṣẹ giga. Ile-iṣẹ bẹwẹ awọn ajeji ni ilu Dubai. Iwọ yoo ni nini Lexus-Toyota ati pupọ diẹ sii !. Ile-iṣẹ yii jẹ ile-iṣẹ ti o nifẹ si pupọ pe iwọ yoo fun wọn ni ipe kan. Ọna ti o dara julọ jẹ ododo nirọrun beere wọn nipa awọn aye ati gba wọn ni iyara bi o ṣe le.,glot500
Yoruba,"Ó jẹ́ kó di mímọ̀ wípè, oyún kejì òun ló fún òun ní ìwúrí láti ṣe àgbékalẹ̀ eré náà, àti pé eré Grey's Anatomy nípa pàtàkì lóri ṣíṣe eré náà.[2] Eré náà gbaa àmì-ẹ̀yẹ ti eré tẹlifíṣọ̀nù tí ó dára jùlọ níbi àjọ̀dún Vues d'Afrique tó wáyé ní ìlú Montreal.[1]",glot500
Yoruba,"Awon nkan merin apeere gbogbo fi hàn pé a alagbara nwon.Mirza ni ojo iwaju yoo jẹ lati bùkún ńlá data orisun, eyi ti ko ba wa ni gba fun iwadi, pẹlu afikun alaye ti o mu ki wọn siwaju sii o dara fun iwadi (Groves 2011) . Boya ti o ba bẹrẹ pẹlu awọn Custommade tabi awọn Readymade, yi arabara ara Oun ni nla ileri fun ọpọlọpọ iwadi isoro.",glot500
Yoruba,"Ọba alaye naa, to ni awọn ko ni fi ọwọ yẹpẹrẹ mu isẹlẹ naa tun fikun pe ko yẹ ki irufẹ rogbodiyan bayii waye nitori gomina ipinlẹ Eko, Babajide Sanwo-Olu tete dide si ibeere awọn ọdọ naa.",glot500
Yoruba,"14 Wọ da guọnọ dia ugbeyan rẹ ohwo, die yen orọnvwọn ẹsosuọ wọ cha vuẹ? Odẹ wẹn. Ọghẹnẹ vwo odẹ? Ẹga buebun yonori nẹ odẹ rọyen Ọghẹnẹ yẹrẹ Ọrovwori, ẹkẹvuọvo enana dia oderhi rọye-en. Enana edova, kirobo rẹ “ovie” vẹ “iprẹsidẹnti” je dia edova. Ọghẹnẹ vuẹ avwanre nẹ odẹ rọyen Jihova. Une Rẹ Ejiro 83:18 (NW) da ta: “Jẹ ihwo riẹn nẹ wẹwẹ, rẹ odẹ wẹ dia Jihova na, Wẹ ọvo yen Me Kpenu vwẹ akpọ na ejobi.” Ihwo ri si Baibol na, si odẹ rẹ Ọghẹnẹ phiyọ abọ uriorin buebun. Jihova guọnọre nẹ wọ riẹn odẹ rọyen, ji se ọkeneje. O se odẹ na kẹ wẹ rere wọ sa vwọ dia ugbeyan rọyen.",glot500
Yoruba,"Awọn aami-iṣowo yoo forukọsilẹ ati boya LIVE tabi DEAD, ninu ọran yii, o fẹ lati wo awọn aami-iṣowo ifiwe pẹlu ibaramu deede ti orukọ iṣowo rẹ lati rii daju pe ko si ija kankan. Imọran miiran ni pe awọn ami-iṣowo sọtọ awọn ẹka, nitorinaa o le ni aami ọrọ ti o forukọsilẹ fun ile-iṣẹ rẹ tabi eka ati nkan miiran le forukọsilẹ ọrọ ọkọọkan ọrọ ni ẹka miiran fun awọn idi miiran.",glot500
Yoruba,"13 Aliho he mẹ mí sọnú te gán yinuwado nukun he mẹdevo lẹ nọ yí do pọ́n Jehovah po omẹ etọn lẹ po ji. Mí jlo na nọ wà “nulẹpo na gigo Jiwheyẹwhe tọn.” (1 Kọlintinu lẹ 10:31) Mẹdehihọ́ bẹ sisi nina numọtolanmẹ po pọndohlan mẹdevo lẹ tọn po hẹn. Enẹwutu, eyin mí to avọ̀ he mí na do kavi nuhe mí na do doaṣọ́na míde lẹ de, mí nọ flindọ nudide mítọn lẹ nọ yinuwado mẹdevo lẹ ji.​—1 Kọlintinu lẹ 4:9; 2 Kọlintinu lẹ 6:3, 4; 7:1.",glot500
Yoruba,"Alagbada ni bi ajọ kan ṣe so laipe yii pe ipinle Osun ni iye awon talaka re kere ju ko seyin afojusun tisejoba Gomina Aregbesola ni lati so gbogbo awon araalu to setan lati sise di eeyan pataki lawujo, ti won si gbe oniruuru eto kale fun imuse afojusun naa.",glot500
Yoruba,"Lọjọ ti iṣẹlẹ ọhun ṣẹlẹ, ọtọ ni yara ti Barry Jhay wa, nigba ti Kashy ati ọrẹbinrin rẹ naa wa ninu yara mii.",glot500
Yoruba,Sopọ lori Linkedin pẹlu - Bastian Kiendl - Nọmba awọn oṣiṣẹl'apapọ ni ile-iṣẹ Alakoso ni Marriott International,glot500
Yoruba,Gbẹtọ lẹ to Numẹsẹ̀n Daho Ise tọn he to Japon po Grotto Massabielle tọn he to Lourdes to France po dlapọn,glot500
Yoruba,"9 Vwẹ ọke ọfa, Jesu ta ota kẹ Nataniẹl kerẹ ugbeyan, ohwo rọ vwẹ ẹro ọchọchọ vwo nẹ ihwo rẹ Nazarẹt. Ọ da nẹrhẹ Nataniẹl wene iroro rọyen. O de rhi mu ẹwẹn kpahen iyono rẹ Jesu, rọ dia ohwo rẹ Nazarẹt. (Jọn 1:46-51) Ọtiọyena, ofori nẹ e yono ighwoghwota kpokpọ oborẹ ayen sa vwọ vwẹ aghẹnghẹn vwọ ta ota kẹ ihwo kerẹ igbeyan. [2] Ighwoghwota tiọyena cha mrẹ aghọghọ siẹrẹ ihwo ri vwo ẹwẹn esiri de dje omavwerhovwẹn kpahen omamọ uruemu rayen.",glot500
Yoruba,"Oríṣun àwòrán, @NGF Àkọlé àwòrán, Adamu ṣalaye pataki radio Fulfulde pe kawọn darandaran le ni ẹkọ to peye ni Nibi ipade asegbẹyin awọn minista yii ni Adamu ti ni inu oun ko dun to nitori oun ko ri awọn ọmọ ko pe lọ sile iwe de idaji.",glot500
Yoruba,"Isele pataki inu ija yi nipe gegebi akosile ofin, akoko igbimo nwon ti pari nigbati ise kiko Mossalassi ti pari. Awon musulumi ko mo nipa ofin yi titi di ojo ti mo salaye re funwon lekunrere.",glot500
Yoruba,"Ohun ti ile sọ ni pe, orilẹede China ni awọn irinṣẹ igbalode nile iwosan ti wọn le fi dena aarun coronavirus ju Naijiria lọ.",glot500
Yoruba,"Bẹẹ ni ọrọ ri pẹlu agba osere kan to gbajumọ ninu ere tiata lede Yoruba, Alhaji Tajudeen Oyewole, ti ọpọ eeyan mọ si Abija ati ọga rẹ, Alhaji Yekeen Ajileye. Abija lo jẹ ọmọ isẹ fun Olaleye, to si maa n ko ipa to tọju ninu awọn ere ti ọga rẹ naa ba se bii Koto Aye, Koto Ọrun, Ọpa Aje ati bẹẹ bẹẹ lọ. 'Iṣẹ wá burẹkẹ síi tórí Covid-19, owó ńlá ló wà nínú dídáná sun òkú, ìsìnkú Zoom, Live streaming' Nigba to n salaye ohun to mu oun kuro ninu ẹgbẹ osere Ajileye ki onitọun to di oloogbe, Abija sọrọ yanya ninu fido kan to gba ori ayelujara kan ti ileesẹ Mohunmaworan Ojopagogo gbe jade. Ohun to fa ija laarin emi ati ọ̀ga mi Ajileye ree: Abija ni awọn osere tiata kan lo wa ba ọga oun pe ki oun wa ba awọn kopa ninu ere kan, ti wọn si san gbogbo owo ti ọga oun beere lori oun fun. O ni sugbọn ọga oun wa fi gbedeke kan le pe, oun ati Fadeyi Oloro ko gbọdọ kopa papọ ninu ere naa sugbọn ọrọ yiwọ nigba ti awọn de Eko, nibi ti ere naa ti n waye. ""Ṣé ẹ léró pé ọmọ mi ṣì lè padà wá bá mi láàyè báyìí? Òbí akẹ́kọ̀ọ́ Kaduna Abìjà: Bàbá mi fi iṣẹ́ ọdẹ ti ń pa lémi lọ́wọ́ ni nítorí babaláwo ni ""Nigba ti mo de Eko, awọn to ni ere naa gbe emi ati Fadeyi Oloro papọ, ta si dijọ kopa tori n ko le pada sẹyin mọ pe n ko se mọ. Ọga mi gan ko kọkọ ka ọrọ yii kun nibẹrẹ nigba to gbọ pe emi ati Oloro ti koju ara wa ninu ere naa, afi igba ti ọkan lara awọn iyawo rẹ mu lọ wo ere naa l'Eko, nigba ti sinima naa jade. Ẹsin obinrin ni ọga mi gun, bo si se jade kuro ni gbọngan sinima naa ni oju rẹ ti pọn nigba to ri omilẹgbẹ ero to wa wo sinima yii. O dabi pe oun naa ti n gbero tẹlẹ lati gbe emi ati Fadeyi Oloro papọ ninu ere, tawọn yẹn si ti siwaju rẹ se bẹẹ."" Tóò bá fẹ́ràn àti máa pọ́n ọ̀rọ̀ tàbí èèyàn lé, ẹ̀kọ́ ráńpẹ́ yìí yóò wúlò fún ọ Ọga mi yọ orukọ mi kuro ninu awọn ti yoo re Mecca, mo fẹ pokunso Abija ni oun bẹ ọga oun titi, tawọn agbaagba elere naa si pe awọn joko lati pari aawọ naa amọ ọga oun ko gba, to si kọ lati fi ori jin oun. O fikun pe nigba to ya, awọn kan ni awọn fẹ ran awọn osere Ajileye lọ si Mecca, ti orukọ oun si wa lara wọn. O ni akoko ti awọn fẹ se adura Mecca yii ni oun gbọ pe oun ko ni ba awọn yoku lọ si Mecca naa tori Ajileye ti fi orukọ ẹnikan to pe ni Musibau rọpo oun. ""Ẹsẹ kan soso ti ọga mi sẹ mi ree, o dun mi pupọ, koda, o dun ẹlẹda mi, nitori ko sọ fun mi nibẹrẹ pe n ko ni lọ. hhhhhh Iya ati ẹgbọn mi ti wa ba mi nilu Eko lati Osogbo ni ọjọ ti mo da pe maa se adura Mecca, bi mo si se fẹ maa salaye fun wọn nipa ohun to sẹlẹ, ẹkun ni mo bu si. Iya mi fẹ lọ ba Ajileye amọ mo ni ko ma lọ, ti oun ati ẹgbọn mi si pada si Osogbo pẹlu ibanujẹ. Ọjọ kẹta ni mo mu okun pe mo fẹ pokunso, amọ mo pade tọọgi kan to fi ohun ọmọ ita ba mi sọrọ pe se opin aye de ni, ti eeyan ko ba lọ si Mecca."" Abija tẹ́siwaju pe bakan naa ni ọrọ ri nigba to yẹ ki oun lọ si ilu London, ti iwe irinna Passport oun si lo ọdun marun lọwọ eeyan kan, koda, o ni o bajẹ sọwọ ẹni naa. Wùnmí Toríọlá: Toyin Abraham kìí se ọ̀gá mi nínú tíátà Bi ọna Mecca se la fun mi ree lẹyin aisan ọdun mẹta - Abija Abija ni bi ọdun mẹta sẹyin ni oun se aisan kan to lagbara, koda gbogbo aye lo gbọ nipa rẹ amọ ni kete ti ara oun n bọ pada sipo, ni ọna la fun oun. ""Redio Ayefele ni Ilumọọka Presenter ti pe mi fun ifọrọwanilẹnuwo, to si fi owo ọkọ ransẹ si mi amọ mo na owo naa jẹun ni, ti n ko si ka ipe rẹ si. O tun pe mi lẹẹkeji, to si tun fi ẹgbẹrun marun naira ransẹ bii owo ọkọ, ti mo si lọ. Lẹyin eto naa ni obinrin kan ti wọn pe no Alhaja Keromylee pe mi. O fun mi ni ẹgbẹrun lọna aadọta naira, to si tun leri lati ran mi lọ si Mecca nigba to gbọ pe n kii se Alhaji."" Abija salaye pe oun ko ka ileri naa si, ti oun ko si fi ọkan si tabi sọ fun ẹnikẹni pe oun fẹ lọ si Mecca\. O ni koda, oun ko sọ fun iyawo oun nile titi di igba ti wọn ni kawọn wa fun idanilẹkọ ati gbigba ẹru tawọn n ko lọ. ""Asiko yii mni mo ke si aya mi, ta si jọ lọ sibi idanilẹkọ naa, ibẹ si lo ti mọ pe mo fẹ lọ Mecca eyi to fa ija nla, diẹ si lo ku ki aarin wa daru."" Bọlanle Ninalowo: Ọ̀rẹ́ lásán àti olóore mi ni Mercy Aigbe Ajileye se adura ni Mecca pe ki Ọlọrun gba gbogbo oore to se fun mi Abija tun tẹsiwaju ninu ọrọ rẹ pe nigba ti oun de Mecca, ni Alfa kan to mọ oun ati Ajileye sọ fun oun pe ibẹ ni ọga oun ti tọrọ lọwọ Ọlọrun pe ko gba gbogbo oore to se fun oun. ""A se ẹsẹ ti mo sẹ Ajileye, o gbe de Mecca. Alfa kan sọ fun mi pe nibiyi ni ọga mi ti gbadura si Ọlọrun pe gbogbo oun ti Ọlọrun se fun mi lati ara oun, eyi to n dun mi ninu, ni ki Ọlọrun gba lọwọ mi. Alfa naa ni isẹ kan soso ti ọga mi se ni Mecca ree lọdun naa, ti ko si ba wọn kopa ninu isẹ yoku mọ titi to fi pada wale."" Mo n wayawo - Falz ti kigbe fun awọn ololufẹ rẹ Ẹsẹ mi da ninu ijamba ọkọ, mo wa nilẹ fun ọdun meji abọ: Alhaji Tajudeen Oyewole tun mẹnuba ohun ti oju rẹ ri lọdun 2007 lasiko to ni ijamba mọto, eyi to da gunlẹ fun ọdun meji ati aabọ. ""Location ni mo ti n bọ, nibi ta ti lọ ya fiimu mi ti akọle rẹ n jẹ Ibinu Abija, mo ko ijamba ọkọ nigba ta n pada sile, ti ẹsẹ mi si da. Ọdun meji aabọ ni mo lo nilẹ lẹ, lai le rin tori ẹsẹ mi ti da. Sinima Ibinu Abija naa ko si tii jade titi di oni, mo sẹsẹ tun fẹ gbe sita ni."" BBC gbalejo ọmọ Ibadan Emi ati ọga mi si dijọ se papọ bii ti tẹlẹ, ko to ku Alhaji Tajudeen Oyewole wa kede pe oun ati ọga oun pari aawọ aarin awọn, ko to di pe o jẹ Ọlọrun nipe. O ni oun ti dari gbogbo ẹsẹ ti ọga oun sẹ oun jin in, ti awọn si pada rẹ pada. ""Ajileye pada pe mi lati wa kopa ninu fiimu rẹ ko to jade laye, ti n ko si ka ẹsẹ kankan si lrun, nitori pe ẹgbọn lo jẹ si mi, ta si sun mọ ara wa pẹki pẹki.",glot500
Yoruba,"Lọ́dún 2006, Zhou Bing ṣe olóòtú àti adarí orin ìbílẹ̀ Kunqu. Bẹ́ẹ̀ náà, ó gba àmì ẹ̀yẹ ti Outstanding Documentary Award of 24th China TV Golden Eagle Awards; àti àmì ẹ̀yẹ ti Award of TV Art Features of 21st Starlight Award lọ́dún 2006.",glot500
Yoruba,"Aare Alagba, Dokita Abubakar Bukola Saraki, tun ti ṣe atilẹyin fun igbimọ ijọba ti agbegbe ni orilẹ-ede.",glot500
Yoruba,"Awọn maaluu to to bii igba (200) lawọn ẹsọ amọtẹkun ẹka tipinlẹ Ondo gbẹsẹ le lẹyin ti wọn ba nnkan ọgbin agbẹ kan ta a forukọ bo laṢiiri jẹ niluu Irẹsẹ, nijọba ibilẹ Ifẹdọrẹ.",glot500
Yoruba,"ÁÑÁ êëèåíòòåð³  Қàçàқñòàííûң áàíêòåð³, қàðæûëûқ æәíå қàðæûëûқ åìåñ ұéûìäàðû. ÁÑÁ  íåã³çã³ êëèåíò³  Қàçàқñòàí Ðåñïóáëèêàñûíûң Ұëòòûқ Áàíê³. Àâòîìàòòàíäûðûëғàí àқïàðàòòûқ øàғûí æүéåëåð³ Oracle, Sybase, Lotus Notes ïëàòôîðìàëàðûíäà әç³ðëåíãåí æәíå ïàéäàëàíûëàäû. Áàíêò³ê ñåðâèñ áþðîñûíûң Ұëòòûқ Áàíêòåã³ ÀÀÆ қûçìåò êөðñåòóä³ң ïûñûқòàëғàí òåõíîëîãèÿñû áàð.",glot500
Yoruba,"A gbọ pe ọdun Ọṣun Oṣogbo ti le ni ẹẹdẹgbẹrin ọdun to ti bẹrẹ, a ko si lee sọ nipa isẹdalẹ ọdun Ọṣun Oṣogbo, ka ma mẹnuba itan idasilẹ ilu Osogbo funra rẹ.",glot500
Yoruba,"TI: Buffon baba, Adriano Buffon jẹ a weightlifter. A bi i ni 15th Sep 1945 ni Latisana, Italy nipasẹ Masocco Giorgio (baba) ati Paolini Teresa (iya). Ni isalẹ jẹ fọto ti ọdọ Adriano.",glot500
Yoruba,"Web site design jẹ miiran agbegbe ninu eyi ti titun ilé le gba tisan mole. O jẹ ko pataki lati ṣẹda titun kan aaye lati ibere. Gba lori Google o si wa fun dede. Lo free tabi ilamẹjọ bi ti anpe ni, Squarespace ou Wix. Wa a onise ti o le lo yi awoṣe ki o fọwọsi o pẹlu akoonu ati awọn aworan.",glot500
Yoruba,"Fun itọju BPH, o yẹ ki o mu iwọn lilo itọju 5mgs ti igbega tadalafil lẹẹkan ni ọjọ kan ati rii daju pe o mu u ni akoko kanna ni gbogbo ọjọ fun awọn ọsẹ 26. Dọkita rẹ tun le mu tabi dinku iwọn lilo ojoojumọ ti o da lori bi ara rẹ ṣe dahun si awọn iwọn lilo fun awọn ọsẹ akọkọ. Ni ọran ti awọn igbelaruge ẹgbẹ eyikeyi ilọsiwaju nigbagbogbo kan si dokita rẹ ni akoko ṣaaju ki ipo naa ba buru.",glot500
Yoruba,"Ní ọdún tí ó tẹ̀le, Assih ṣe adarí àti agbéréjáde fún fíìmù tí àkọ́lé rẹ̀ jẹ́ Bidenam, l’espoir d’un village ní ìlú Johannesburg, pẹ̀lú ìrànlọ́wọ́ ẹgbẹ́ Goethe Institute. Fíìmù náà dá lóri ayé Bidenam, ẹnití ó padà sí abúlé rẹ̀ lẹ́hìn ọdún mẹ́fà tí ó ti wà láárè, tó sì pinnu láti kọ́ àwọn ẹbí rẹ̀ bí wọ́n ti ń ṣe ètò ọ̀gbìn ní ìlànà ìbomirin. Àbúrò rẹ̀ obìnrin tí ó lọ kẹ́kọ̀ọ́ ní orílẹ̀-èdè Mòrókò ni ó mú àbá ìtàn eré náà wá. Ní ọdún 2012, Assih ṣe adarí eré ìrírí gígùn kan tí àkọ́lé rẹ̀ jẹ́  Le Rite, la Folle et moi.",glot500
Yoruba,"8 Legeoko tongana Jonathan, e lingbi ti fa so e yeke be-ta-zo na Jéhovah tongana e mä yanga ti azo ti komande na yâ ti ambeni ye tongana ti so Nzapa ahunda, e yeke sara ni même tongana e bâ so mbeni zo akpa pëpe ti tene e ne lo. Na tapande, mbeni kota zo ti gouvernement alingbi ti duti mbeni zo so aye tënë ti goro, me e yeke ngbâ ti ne kamba ti kua ti lo ndali ti so e yeke woko tere na gbe ti “akota zo ti komande”. (Diko aRomain 13:1, 2.) Biani, e kue e lingbi ti fa so e yeke be-ta-zo na Jéhovah na lege so e ne azo so lo mû komandema na ala.—1 aCor. 11:3; aHéb. 13:17.",glot500
Yoruba,"Ogbeni Enilolobo so wipe, fifidiremi awon oluko naa waye nitoripe awon oluko ayee’sin ko mo nipa ilo imo ero igbalode Computer. Beeni, pupo ninu won ko mo nipa ero igbalode rara; Idanwo naa si je eyi ti won fi ero igbalode computer se.",glot500
Yoruba,Lo ọjọgbọn ile gbigbe awọn software lati mu awọn ohun elo ti iṣamulo nipa ni o kere 7%. Awọn odo aaye laarin awọn elo le jẹ àjọ-eti ge.,glot500
Yoruba,2014 - Awọn Academy bẹrẹ ni retraining ti 9000 ilu iranṣẹ lati Crimea ati Sevastopol nipa ibere ti awọn Russian NOMBA Minisita Dmitry Medvedev.,glot500
Yoruba,Awọn ogogorun ti awọn iyatọ ti o jẹ ominira ti Bitcoin ni o ni awọn koodu orisun ara wọn. Ohun ti Mo n gbiyanju lati sọ ni pe Cryptocurrencies funni ni anfani lati di ominira lati eto atijọ.,glot500
Yoruba,"Maryam Sanda, ìyàwó tó pa ọkọ rẹ, ri ìdájọ ikú he Okada Ban: ọjọ kini oṣù keji ni òfin tuńtun yóò bẹ̀rẹ̀ Olùkọ́ fásitì gba ìdájọ́ iku 'torí pé ó sọ̀rọ̀ òdì sí Ànọ́bí lórí ayélujára Máṣe jẹ́ kí ibà Lassa pa ọ́, wo ọ̀nà láti dènà rẹ̀ Àgádágodo ní wọ́n fi ti ẹnú ọ̀nà káńṣù l‘Ọyọ, ọlọ́pàá gbàródan síbẹ̀ Amọ melo ni iru awọn eeyan to daran ipaniyan, ti ile ẹjọ dajọ iku fun, ti ẹyin ranti?",glot500
Yoruba,"Àwọn ará Róòmù máa ń pa àwọn ọ̀daràn kan nípa gbígbé wọn kọ́ sórí òpó igi oró. Àwọn Júù sọ pé kí wọ́n jẹ́ kí wọ́n ṣẹ́ ẹsẹ̀ àwọn ọ̀daràn méjì tó wà lẹ́gbẹ̀ẹ́ Jésù. Èyí máa mú kó ṣòro fún àwọn ọ̀daràn náà láti mí, á sì mú kí ikú wọn yá kíákíá. Nípa bẹ́ẹ̀, kò ní jẹ́ pé wọ́n á wà lórí igi ní gbogbo òru. (Diu. 21:22, 23)—5/1, ojú ìwé 11.",glot500
Yoruba,"11:20 ṣugbọn o, ju, despising ọrọ Israeli, yoo ko laye u lati kọjá nipasẹ rẹ aala. Dipo, apejo ohun ainiye ijọ enia, o si jade lọ si i ni Jahasi, o si ija strongly.",glot500
Yoruba,"Ọkan lara awọn ọmọ Alaafin, Bunmi Labiyi fi idi ọrọ naa mulẹ fun BBC Yoruba ni aarọ yii ninu ifọrọwerọ kan.",glot500
Yoruba,"Àwọn àmúyẹ fun gbígbọ́ orin ko le ṣiṣẹ lori ẹ̀rọ rẹ Àkọlé fídíò, Ogun Cholera: Ọdọọdún ni àrùn onígbá-méjì máa n ṣọṣẹ́ ní Nàìjíríà-NCDC Ìròyìn tó ṣe kókó Kí ni abẹ̀ṣẹ́kùbíòjò Anthony Joshua fi n wu àwọn ọmọ Naijiria tí gbogbo wọn fẹ́ tan mọ́ ọ?",glot500
Yoruba,"""Idaji ti awọn osisẹ wa n ko ẹru ti wọn lo bọ wa si ijọba ibilẹ wọn, ni awọn eeyan kan n yinbọn soke, eyi to mu kawọn osisẹ ọhun juba ehoro. Awọn eroja bii ẹni, apoti ti wọn fi dibo ati ẹrọ amunawa nikan ni wọn wa ja silẹ.""",glot500
Yoruba,"8:8 Gẹgẹ pẹlu gbogbo wọn iṣẹ, eyi ti nwọn ti ṣe lati ọjọ ti mo mu wọn kuro lati Egipti, ani si oni yi: gẹgẹ bi nwọn ti kọ mi silẹ, ati ki o yoo ajeji oriṣa, ki bayi ti won tun ṣe si nyin.",glot500
Yoruba,"Laisi ani ani, Festival of India Lagos ni Tafawa Balewa Square, TBS, Onikan ni ilu Eko Lagos lorile ede Nigeria.",glot500
Yoruba,"Saaju la ti kọkọ s fun yin pe ikọ ijọba ipinlẹ Oyo to lọ sibi adura Fidau ọjọ mẹjọ fun Gomina ana, Abiola Ajimobi ni wọn ko jẹ ki wọn wọle sile Ajimobi to wa ni Oluyole nilu Ibadan.",glot500
Yoruba,"Baba yii ni agbegbe kan ti wọn n pe ni Lagelu, n’Ibadan, nipinlẹ Ọyọ, ni wọn n ta awọn ayederu aṣọ ọhun si, ati pe awọn ẹṣọ Amọtẹkun ti wa ni gbogbo agbegbe naa bayii lati ṣawari awọn to ra a.",glot500
Yoruba,"Awọn ""irony"" ni pe awọn ọmọ ti awọn ọmọkunrin lati akosile wa ara wọn bi awọn aṣaju-ija ti Dutch dudu. Bẹẹni Wọn ti ṣiṣẹ smati Wọn akọkọ sìn wọn ati ki o mu wọn daradara ati bayi bi awọn ti a npe ni 'protectors'. O nigbagbogbo ri ilana yii ti o farahan ni gbogbo imulo ni Madurodam. Ati awọn eniyan wọpọ ya awọn ere ẹgbin naa.",glot500
Yoruba,"Nibẹ ni o wa meji pataki caveats si yi kedere aseyori, sibẹsibẹ, ati agbọye awọn wọnyi caveats yoo ran o akojopo ki o si ṣe asọtẹlẹ ati nowcasting. First, awọn iṣẹ ti Google kooli lominu wà kosi ko Elo dara ju kan ti o rọrun awoṣe ti siro iye ti aisan da lori a PCM extrapolation lati awọn meji julọ to šẹšẹ wiwọn ti aisan itankalẹ (Goel et al. 2010) . Ki o si, lori diẹ ninu awọn akoko akoko Google kooli lominu wà kosi buru ju yi o rọrun ona (Lazer et al. 2014) . Ni gbolohun miran, Google kooli lominu pẹlu gbogbo awọn oniwe data, ẹrọ eko, ati awọn alagbara iširo kò bosipo outperform a rọrun ati ki o rọrun lati ni oye oni wakati. Eleyi ni imọran wipe nigbati iṣiro eyikeyi apesile tabi nowcast o jẹ pataki lati fi ṣe afiwe lodi si a ipetele.",glot500
Yoruba,"Àpèjá AAVE duro fun African-American Vernacular English, ìyẹn ni, ede Geesi tí àwọn ọmọ Afrika Amerika n so ni ile Amerika.",glot500
Yoruba,"Agbegbe ilu Zeytinburnu, awọn ilu ti ko le de ọdọ iftara, Cevizliṣe iranṣẹ bimo ti o gbona ni Iduro Ajara Ọgba. Awọn ara ilu ti o gbawẹ ni ibi iduro pẹlu awọn onkan ti a nṣe, ti fi han pe wọn lọpọlọpọ pẹlu ohun elo naa. 5 TI IDAGBASOKE TI RAMAZAN [More ...]",glot500
Yoruba,"Ẹni ti o jẹ alaga agba fun ẹgbẹ NURTW, Alhaji Tajudeen Ibikunle Baruwa ni o yan an ti o si fa a kalẹ.",glot500
Yoruba,"b. Àṣìlò Awọn iṣẹ ti a nṣe lori Ayelujara. O kò gbọ́dọ̀ lo iṣẹ́ yòówù tí à nṣe lórí Ayélujára ni ọ̀nà yòówù tí ó lè mú ìpalára bá a tàbí lọ́nà tí yoo dí bí àwọn ẹlomiiran ṣe nlò ó tàbí nẹtiwọki aláìlowáyà náà lọ́wọ́. O kò gbọ́dọ̀ lo iṣẹ́ náà lati gbìyànjú lati wọlé, láì ní àṣẹ, sí iṣẹ́ yòówù, détà, àkọọ́lẹ̀, tàbí nẹ́tíwọọ̀kì, lọ́nàkọnà.",glot500
Yoruba,"Bi ẹ ko ba gbagbe, o ti le ni ọsẹ kan ti awọn ọdọ kaakiri Naijiria ti gunle ifẹhonuhan, lori bi awọn oṣiṣẹ ẹka to n gbogun ti iwa idigunjale ni ileeṣẹ ọlọpa, SARS, ṣe pa awọn eeyan lọna aitọ.",glot500
Yoruba,"Iroyin to n tẹ wa lọwọ ni yajoyajo ni gbajugbaja oṣere tiata Yoruba, Babatunde Omidina, ti ọpọ awọn ololufẹ rẹ mọ si Baba Suwe ti jade laye.",glot500
Yoruba,"Apo Fruity ká free ajeseku online play itatẹtẹ ti a ba tun wo lo, ko pese Live Casino ere, ṣugbọn wíwọlé soke lati gba a free 50 spins kaabo ajeseku ti wa ni a nla ona lati to bẹrẹ lori ni opopona si VIP Casino ogo! Pẹlu oto iṣootọ ere fun VIP Club ẹgbẹ pẹlu pataki ìparí fi opin si, igbadun spa pampering ọjọ, inawo ọjọ jade ni awọn meya, ati paapa iyasoto awọn ifiwepe si oke kilasi akariaye, ga sẹsẹ awọn ẹrọ orin yoo kò ni a ṣigọgọ akoko.",glot500
Yoruba,"Ni ọkan ninu awọn ayanfẹ mi avvon, Charles Spurgeon nrọ wa lati da nwa lati ara, ati lati bẹrẹ nwa to Jesu. O si wi:",glot500
Yoruba,Justin Timberlake fa flak fun asọye flirty lori fọto Jessica Biel lẹhin ẹtan itanjẹ Justin Timberlake ati iyawo Jessica Biel dabi ẹni pe wọn ti n ṣe daradara pupọ julọ lẹhin ti iṣaaju tubu si ni itanjẹ ẹlẹtan pẹlu idiyele rẹ Al…,glot500
Yoruba,"Ọpọ eeyan lo wa ki Davido lẹyin, ti wsn si n rawọ ẹbẹ si Lawal pe ko mase gbiyanju lati da ẹmi ara rẹ legbodo.",glot500
Yoruba,6) Ara eniyan ni apẹrẹ tabi ero ti Agbaye iyipada; ninu rẹ awọn ẹka iseda kọja nipasẹ lẹsẹsẹ awọn ipinlẹ mẹrin ti iseda-ọrọ.,glot500
Yoruba,"Bi o ba ti dishing jade idogo baramu imoriri, iṣootọ ere, ki o si Loorekoore Player kompu Points won ko to, awọn ẹrọ orin le reti ani diẹ. Deede Live Casino imudojuiwọn ti wa ni ti lọ soke si ọna fifun ẹgbẹ diẹ ẹ sii ti ohun ti won n nwa fun, ati awọn ti o dabi wipe o ni ga-tekinoloji ẹrọ!",glot500
Yoruba,Wọn mẹnuba ewu to rọ mọ irinajo yii nitori ko si ẹwu idaabobo rara ṣugbọn pataki ẹkọ fawọn ọmọ wọn lo mu wọn moju kuro.,glot500
