language,text,source
Yoruba,"Hogbe ehe nọ yin yiyizan nado basi lẹdogbedevomẹ hogbe Glẹkigbe tọn lọ ai·onʹ tọn to whenue e dlẹnalọdo ninọmẹ nulẹ tọn kavi nujijọ delẹ he hẹn ojlẹ de gbọnvona devo. Biblu dọho gando “titonu dintọn” go dile e to alọdlẹndo ninọmẹ nulẹ tọn to aihọn lọ mẹ to paa mẹ podọ aliho gbẹninọ tọn aihọnmẹnu lẹ tọn. (2Ti 4:10) Gbọn alẹnu Osẹ́n tọn lọ gblamẹ, Jiwheyẹwhe hẹn titonu de wá aimẹ, ehe mẹdelẹ sọgan ylọdọ ojlẹ Islaelivi lẹ kavi Ju lẹ tọn. Gbọn avọ́sinsan ofligọ Jesu Klisti tọn gblamẹ, Jiwheyẹwhe yí ewọ zan nado hẹn titonu devo wá aimẹ, yèdọ dehe gando agun Klistiani yiamisisadode lẹ tọn go na taun tọn. Ehe dohiagona bẹjẹeji ojlẹ yọyọ de tọn, yèdọ ojlẹ he mẹ nuhe alẹnu Osẹ́n tọn lọ nọtena lẹ jẹ hẹndi mọ ji. To fie hogbe lọ yin yiyizan na nususu te lẹ, e nọ dlẹnalọdo titonu voovo lẹ, kavi ninọmẹ nulẹ tọn to ojlẹ he ko wayi kavi dehe ja lẹ mẹ.—Mt 24:3; Mk 4:19; Lo 12:2; 1Kọ 10:11.",glot500
Yoruba,"“Laasigbo to wa lori owon gogo epo-robi , eyi ti o mu ki ajo  DPR gbe igbese oju-lalakan fi-n sori,  lati je ki  awon ibi  igbonpo to n tapa si ofin ati ilana ajo naa fi oju wina ofin ijoba”.",glot500
Yoruba,"Aarẹ ẹgbẹ FIBAN, Desmond Nwachukwu lo fi lede ninu atẹjade kan lati fesi si iṣẹlẹ to ṣẹlẹ laarin Wasiu Ayinde ati oniroyin Wole Sorunke ti wọn n pe ni MC Murphy.",glot500
Yoruba,"Ni kete ti o ba ti gbasilẹ fiimu tabi iṣẹlẹ si ẹrọ rẹ, o jẹ tirẹ lati tọju. O le wo o bi ọpọlọpọ igba bi o fẹ laisi eyikeyi awọn idilọwọ ipolowo tabi jijo. Ko si opin si iye awọn akoko ti o le wo.",glot500
Yoruba,Ó sọ pé òun díje fún ipò àarẹ́ pẹ̀lú olóyè Olúsẹ́gun Obásanjọ́ ní ọdún 2007 láti fihàn wí pé òun lẹ́tọ̀ọ́ láti ṣe bẹ́ẹ̀ ni gẹ́gẹ́ bíi ọmọ Nàíjirìa.,glot500
Yoruba,"Miyetti Allah ní kí wọn wọ́gilé Amotekun, Sunday Igboho yarí Sunday Igboho yarí, ó fohùn ránsẹ́ sáwọn èèyàn tó ń pẹ̀gàn rẹ̀ Miyetti Allah ní kí wọn wọ́gilé Amotekun, Sunday Igboho yarí Àwọn ọmọ onílẹ̀ lọ ṣe àmúṣẹ àṣẹ iléẹjọ́ ní Soka, làwọn ‘Jàǹdùkú’ fi dá wọn lọ̀nà - Iléeṣẹ́ ọlọ́pàá Ọyọ Ọpọ eeyan ni awọn adunkooko mọ ni yii ti pa nilu Kishi to wa nijọba ibilẹ Irepo nipinlẹ Oyo, ti wọn si ti sọ awọn miran di alaabọ ara.",glot500
Yoruba,"Venus Ebony Starr Williams (ojoibi 17 Osu Kefa, 1980) je ara Amerika agba tenis alagbase to wa ni ipo karun lagbaye fun awon adije enikan ati ipo kinni lagbaye fu awon adije enimeji. O ti wa ni ipo kinni lagbaye fun awon adije enikan latowo WTA ni emeta otooto. O bo si ipo akoko lagbaye ni igba akoko ni ojo 25 Osu Keji, 2002. Venus ni egbon Serena Williams to un na je agba tenis.",glot500
Yoruba,"Iroyin to tẹ AWIKONKO lọwọ laipẹ yii ti fi ye wa pe ẹnikan ti gun gbajugbaja sọrọ ori redio nni, David Ekanem pa lopin ọsẹ to ṣẹṣẹ kọja yii.Opopona marosẹ Murtala Mohammed to wa nilu Calabar, ipinlẹ Cross River la gbọ pe iṣẹlẹ ọhun ti waye ni nkan bi aago mẹwaa owurọ, ọjọ Abamẹta, Satide, ọjọ kẹfa, oṣu yii.A gbọ pe odu ni David Ekanem, kii ṣaimọ foloko lagboole sọrọsọrọ, koda, ti wọn ni ede Ẹfik lo fi maa ṣeto fawọn ololufẹ rẹ lori redio FAD FM to wa nilu Calabar.Wọn ni titi di asiko ti a ṣakojọpọ iroyin yii tan ni ko tii sẹni to le sọ patọ ẹni to gun ọkunrin tọpọ awọn eeyan tun mọ si Itiat Zion pa",glot500
Yoruba,"Awọn Kristian alaigbagbọ mọ pe awọn ẹlẹṣẹ ati pe wọn sọnu nigba ti wọn ṣe afiwe ara wọn pẹlu oore ati iwa mimọ ti Baba wọn ọrun. “Ko si eni ti o dara biko se Olorun” (Matteu 10:18). A kun fun awọn aṣiṣe, awọn ikuna, sisọnu ati da ni ẹbi ẹda ara wa. Ko si ẹda eniyan ti o dara ninu ara rẹ. Pipe ti Baba wa jẹ ki ẹbi wa (Matteu 5:48). Awọn ẹṣẹ wa ati awọn irekọja wa lati inu abuku ti ko ni ailopin. Oore-ọfẹ Jesu Kristi nikan ni ireti wa. Ẹjẹ rẹ wẹ wa kuro ninu gbogbo awọn ẹṣẹ wa, ati Ẹmi Rẹ n ṣe ẹda tuntun ninu wa. Ti Musulumi ko ba ṣe idanimọ bibajẹ rẹ ninu ina Ọlọrun ko mọ pe o jẹ ẹjọ ainireti, ṣugbọn tẹsiwaju lati ronu pe ko nilo olugbala kan tabi irubo ni aye rẹ!",glot500
Yoruba,3 days ago by orisuntv #IroyinJakeJadoLoriOrisun Iroyin ohun ti o nlo layika wa ATI kaakakiri agbaye. Ohun tuntun ti a mu wa fun yin ni o n lo lowolowo Lori orisun channel 168,glot500
Yoruba,"The Congo Free State was a large area in Central Africa which was privately controlled by Leopold II, King of the Belgians.",glot500
Yoruba,"Nítorí náà ó sọ fún wọn pé, “Ọkunrin ìjòyè pataki kan lọ sí ilẹ̀ òkèèrè, wọ́n fẹ́ fi jọba níbẹ̀ kí ó sì pada wálé lẹ́yìn náà",glot500
Yoruba,"Lisa Mitchell, Oluṣakoso Aṣeyọri Onibara ti Awọn ohun alumọni Awọn iṣẹ onibara, ṣe alabapin iriri rẹ ati apejuwe 11 awọn aṣiṣe titaja akoonu.",glot500
Yoruba,"translate Yoruba to Indonesian, Yoruba to Indonesian translations, Yoruba to Indonesian Google Translate ,",glot500
Yoruba,"Telecommunication atoôna: O le fojuinu bi o Elo MTN, Glo, AIRTELL ati ETISALAT laarin awon miran san awon eniyan fun osu to kan erect wọn atoôna sile ile wọn? Ti o da lori rẹ agbara ti onisowo ati awọn ipo rẹ, o le sunmọ Telecommunication ilé (nwọn igba akọkọ ona ti o lonakona) lati fi soke wọn atoôna lori diẹ ninu awọn ajeku egbin ti aaye lori ilẹ rẹ ki o si jo'gun laarin N250,000 - N350,000 fun osu. O ko ni lati se ohunkohun ju o kan gba wọn lati fi soke wọn sẹẹli ni ayika ile rẹ, ati awọn ti o jo'gun lara ti $2,000 fun osu - boya fun osu lai ta eyikeyi ọja tabi Rendering eyikeyi iṣẹ ninu awọn ti o muna ori ti awon oro.",glot500
Yoruba,"""Awọn iroyin kan sọ pe Ọgbẹni Fẹmi Osibọna jẹ agbodegba fawọn eekan kan ni ijọba, awọn miran tilẹ so o pọ mọ igbakeji aarẹ, nigba ti awọn kan fi ọgbọọgbọn n darukọ gomina ipinlẹ Eko.",glot500
Yoruba,Circle Markets VU Limited wa ni pipin iyọda ti o jẹ ile-iṣẹ Vanuatu kan ti a fun ni aṣẹ lati ṣe iṣowo ti awọn iṣeduro ni awọn ààbò.,glot500
Yoruba,"Kenan Çalışkan, Alaga ti Ọkọ irinna-Sen, TCDD Taşımacılık A.Ş. Ṣabẹwo si Oluṣakoso Gbogbogbo Kamuran Yazıcı ninu ọfiisi rẹ ati beere ni igbega ti akọle ati Iyipada awọn ibere ijomitoro akọle lẹẹkansi. [More ...]",glot500
Yoruba,"9S6-AA8B11-069 Моноблок MSI Pro 20E 4BW-069RU 19.5"" HD+ Cel N3150 (1.6)/4Gb/1Tb 7.2k/HDG/DVDRW/Windows 10 Home Single Language/GbitEth/WiFi/BT/65W/клавиатура/мышь/Ca",glot500
Yoruba,"Fúnra rẹ lo gbé ìṣẹ̀lẹ̀ náà sáwọn èèyàn létí lórí ìkànnì ayélujára tí Fesibuuku laipẹ yìí, tí wọn sì ń bá a dúpẹ́.",glot500
Yoruba,"Gẹ́gẹ́ bi nǹkan tí awakọ̀ náà, Lateef Akanbi sọ, ""wọ́n dá mi dúró, ṣùgbọ́n bí mo ṣe rí pé jàndùkú ni wọ́n, pé wọn kii se ọlọ́pàá, mo bẹ́ wọ igbó ni,",glot500
Yoruba,"‘‘Ohun to fun wa ni anfaani yẹn ni pe eto ẹkọ ti awọn Awolọwọ gbe wa ran awọn Yoruba lọwọ pupọ.  Nigba kan to rẹ mi ti mo lọọ gba itọju ni South Africa, nibi ti mo ti n duro de dokita to maa tọju mi, ni mo ba ri patako kan ti wọn kọ orukọ awọn dokita si loriṣiiriṣii, ninu orukọ mọkanlelogoji to wa lara patako, mẹtadinlogun ninu wọn, ọmọ Naijira ni wọn, ọmọ Yoruba ni mẹrindinlogun ninu awọn mẹtadinlogun yẹn, ẹni kan yooku, Osagie lo n jẹ, awọn ẹya kan ti wọn tun fara pẹ wa diẹ ni. Nnkan ti mo n sọ yii, igbesẹ awọn aṣaaju wa lori ọrọ ẹkọ ti wọn ti sare gbe lọwọ lo jẹ ki a maa wa nipo aṣaaju.",glot500
Yoruba,"Wọn ni gbogbo ibi ti Funkẹ Akindele ti ṣe fọnran fun wọn ati awọn aworan rẹ ni wọn ti yọ danu, ti wọn si ti n wa ẹlomi-in ti wọn yoo gbe iṣẹ naa fun bayii.",glot500
Yoruba,"Nitorina emi o dá nyin lẹjọ , ile Israeli , olukuluku gẹgẹ bi ọ̀na rẹ̀ , ni Oluwa Ọlọrun wi . Ẹ yipada , ki ẹ si yi kuro ninu gbogbo irekọja nyin ; bẹ̃ni aiṣedẽde kì yio jẹ iparun nyin .",glot500
Yoruba,Awọn ẹsẹ ti awọn sokoto jẹ opo tẹlẹ fere setan fun ẹyọ ọrun tabi awọn apo-kere kere julọ. Pẹlu awọn ohun elo daradara ti a ṣe apẹrẹ awọn ẹbun le dide. Awọn baagi kekere ti o ni kupọọnu kan - gẹgẹbi ọkan ninu awọn ọna wiwakọ pupọ.,glot500
Yoruba,"6 Etẹwẹ klọ́we gbigbọmẹ tọn yin? Nado na gblọndo kanbiọ enẹ tọn, mì gbọ mí ni gbadopọnna nuhe Jehovah dọna Juvi lẹ dile yé jlo na tọ́n sọn kanlinmọgbenu to Babilọni to owhe kanweko ṣidopotọ J.W.M. (Hia Isaia 52:11.) Whẹwhinwhẹ́n tintan he wutu yé lẹkọ jei Jelusalẹm wẹ nado vọ́ tẹmpli lọ gbá bo vọ́ sinsẹ̀n-bibasi nugbo hẹngọwa. (Ẹzla 1:2-4) Jehovah jlo dọ omẹ etọn lẹ ni jo nuhe gando sinsẹ̀n Babilọni tọn go lẹpo do dọ́n. Doayi gbedide debọdo-dego he e na yé lẹ go dọmọ: “Mì doalọ onú mawé depope go blo,” “mì tọ́n sọn ṣẹnṣẹn etọn” podọ “mì hẹn mìde do wiweji.” Sinsẹ̀n-bibasi lalo ma dona hẹn sinsẹ̀n-bibasi wiwe-ṣeke hlan Jehovah flu. To whelọnu lo, tadona tẹ kọ̀n wẹ mí sọgan wá? Nado nọ wiweji to gbigbọ-liho, mí dona nọla na nuplọnmẹ po aṣa sinsẹ̀n lalo tọn lẹ po.",glot500
Yoruba,"Ní gbígba ọmọ tọ́, awọn òbí tí ó bí ọmọ náà gangan yóò fagi lé ẹ̀tọ́ tí wọ́n ní gẹ́gẹ́ bí òbí, kí tọkọ-taya mìíràn le è ṣe òbí ọmọ náà.",glot500
Yoruba,"Ara gbajumọ oṣere nni, Muyiwa Ademọla ko ya o. Bi a si ti n wi yii, ọsibitu ni ọkan pataki ninu awọn oṣere ọmọ Yoruba naa wa. Funra rẹ lo gbe e si ori ẹrọ abẹyẹwo, instagram, rẹ, ohun to si kọ sibẹ ni pe ojojo n ṣogun, ara ogun ko le. O ni oun ko kọ iru eleyii sita ri, ṣugbọn bi kinni naa ṣe wa lasiko yii yẹ ki oun wi, nitori awọn ọriṣiriiṣ iṣẹ to wa niwaju oun. Muyiwa Ademọla ya fọto ara rẹ, nibi ti wọn ti so omi mọ ọn lapa gan-an si ni.",glot500
Yoruba,"Gẹgẹbi oluṣakoso aaye ayelujara, o nilo lati ṣiṣẹ lori bi a ṣe le dabobo aaye ayelujara rẹ lati jijeti gepa. Fifẹnu lori bi alejo ṣe wọle si oju-iwe ayelujara iṣowo rẹ jẹ ẹya kan ti o le ṣe iranlọwọ fun ọ lati dabobo aaye rẹ. Rii daju wipe ko siAwọn iwe-ẹri ti wa ni afihan. Ṣe ojulowo olumulo rẹ si ojula nipa wíwo aabo aaye ayelujara rẹ.",glot500
Yoruba,Idi ni yi ti Alaaji Atiku Abubakar ṣe sọ pe oun ko mọ ẹni toun yoo fa lọwọ soke gẹgẹ adije laarin Buruji Kaṣamu ati Ladi Adebutu.,glot500
Yoruba,Lori ilẹ pakà nibẹ ni kan kafe ibi ti awọn ile-iwe le jẹun ọsan. Bakannaa ni isalẹ ni ile-iwe ile-iwe ati awọn yara afikun ti ile-iwe naa nlo nigba awọn akoko iṣẹ.,glot500
Yoruba,Kìí ṣe ààrùn Covid-19 ló pa adájọ́ àgba ìpínlẹ̀ Kogi-Kọmísọ́nà ìlera 'Rọ́bọ́ọ̀tì ni yóò máa yẹ̀ yìn wò kẹ́ẹ tó rìnrìnàjò òfurufú ní Nàìjíríà' Ìgbà mẹ́jọ tí awuyewuye wáyé lórí ìṣèjọba Ajimobi!,glot500
Yoruba,"Ìwé ìròyìn Vanguard jábọ̀ pé àwọn aṣòfin láti ilé aṣofin méjèéjì panu pọ̀ láti sọ pé, kí Attahiru Jega fi orúkọ àwọn aṣòfin tó jẹ̀bi ẹ̀sùn nàá sí ta láti lè gbe ẹ̀sùn tó fi kàn wọ́n lẹ́sẹ̀.",glot500
Yoruba,"A gbọdọ wa pẹlu awọn solusan gidi ti o tun le gba awọn ti o ṣiṣẹ fun 'eto'. A gbọdọ wa pẹlu awọn solusan gidi ati ṣeeṣe ti o rii daju pe eniyan ko padanu awọn idaniloju, ṣugbọn pe wọn ni ọrọ kan. Ni bayi a gbẹkẹle patapata lori awọn ipinnu ti a fi ofin de lati oke. Eto eto oselu lọwọlọwọ ipa wa lati gba awọn ipinnu wọnyẹn laisi eyikeyi ilowosi eyikeyi. Eyi le ṣee ṣe lọtọ. Iyẹn gbọdọ yatọ.",glot500
Yoruba,"Àwọn iròyin tì ẹ leè ní ìfẹ̀ síí: Ẹ́ gbaradì, to bá lo jẹnẹrátọ̀ àbí tà á, ò ń fi ẹ̀wọ̀n ọdún mẹ́wàá ṣeré - Sẹ́nétọ̀ ń dábàá Agbófinró, tó bá wa ọkada àbí kẹkẹ maruwa l'Eko, o rugi oyin - Sanwo-Olu Ará Yúróòpù ẹ fìdí mọ́lé yín, mo ti gbé ìlẹ̀kùn Amẹ́ríkà tìpa torí Coronavirus - Trump Ìjọba ń ṣe afárá Eko Bridge l'Eko, àwọn ọ̀nà àbùdá tí ẹ lèè gbà nìyí O ni arun asekupani Coronavirus to n se ọsẹ kiri yika agbaye lo ko okuta ba epo rọbi lọja, pẹlu orogun owo ti ilẹ Saudi Arabia n ba Russia se nidi okoowo epo rọbi, eyi to mu ki owo epo ja wa silẹ.",glot500
Yoruba,"Awọn akoonu ti o wa lori aaye rẹ kii yoo fa awọn alejo deede. Ni iru awọn iru bẹẹ,awọn oniṣowo e-ọja yẹ ki o ṣe iyatọ awọn akoonu. O ti ṣe nipa fifi akoonu ranṣẹ si awọn aaye miiran ti o ṣafihan awọn akoonu alejo ni aaye ayelujara rẹ.",glot500
Yoruba,"""Mu ara wa, ṣe awọn ti o dara"" ni Girinilandi ká ori ti tọ. A wa ni igboya lati ran o pẹlu dara ojutu si ifẹ si gbangba ati ki o ṣiṣẹ aṣọ ni China.",glot500
Yoruba,"Àkókò ń bọ̀ tí n óo run gbogbo àwọn ọdọmọkunrin ìdílé rẹ ati ti baba rẹ kúrò, débi pé kò ní sí àgbà ọkunrin kan ninu ìdílé rẹ mọ́.",glot500
Yoruba,"Enu na vwo sikoko emerha, Ilaija da vuẹ Ehab: ‘Ogiribo cha. Ro akpẹrẹ wẹn, wọ djẹ kpo.’ Enu na de rhi biphiyọ, odju ko djuẹ, okposio rode da rhe ton ẹrhọ phiyọ. Ọkanrovwẹ rẹ ame na te oba re. Ehab da djẹ akpẹrẹ rọyen na gangan. Ẹkẹvuọvo, womarẹ ukẹcha rẹ Jihova Ilaija da tobọ djẹ kpata vrẹn akpẹrẹ na! Dedena, ebẹnbẹn rẹ Ilaija na vwoba vwẹ etiyin? E jẹ a mrẹ ẹkpahọnphiyọ rẹ onọ nana.",glot500
Yoruba,"19, 20. (a) Dọ nuhe jọ do Samuẹli go to zánmẹ gbèdopo to gòhọtúntún lọ mẹ. (b) Nawẹ e yinuwa hẹ Eli gbọn? (c) Nawẹ Samuẹli wagbọn do yọ́n mẹhe to hodọna ẹn?",glot500
Yoruba,"Hisbollah, Hamaas, al-Djihad ati awọn ẹgbẹ miiran nko awọn ọmọ-ogun wọn jọ fun awọn ipaniyan ati ipara-eni laiṣe. Kuran tun sọ pe Allah tikararẹ yoo kọ igbagbọ Islam si ọkàn wọn ati pe Allah yoo mu wọn lagbara fun iru awọn irora pẹlu ẹmí lati ara rẹ (Sura al-Mujadila 58:22). Eyi ni ẹsẹ kan nikan ninu Al-Kuran ti o nsọrọ nipa ibasepọ laarin awọn Musulumi ati ẹmi lati ọdọ Allah! Awọn ti a ṣe ileri awọn Martyrs ni Ogun Mimọ ni ibi ti o dara julọ ni paradise (Sura al-Baqara 2:154, Al 'Imran 3:157-158,161-171,193-195, Al-Nisa 4:74; Muhammad 47:4-6, ati bẹbẹ lọ) . Yoo jẹ ti ko tọ lati pe awọn ologun wọnyi, ti o ku ninu awọn iṣẹ igbẹmi ara ẹni, awọn onijagidijagan, nitori pe wọn ri ara wọn gẹgẹbi awọn olurapada ti wọn rubọ aye wọn fun igbala Islam. Wọn sọ fun wọn pe kii ṣe awọn ti wọn pa awọn ọta Islam, ṣugbọn Allah funrarẹ. O yoo ni iyaworan ni ibon wọn lati pa awọn alatako Islam pada (Sura al-Anfal 8:17).",glot500
Yoruba,"Obinrin yii ko ṣẹṣẹ maa fi bileedi ge ọmọ ti ko ju ọmọ ọdun marun-un naa lọ loju ara,o ti n ṣe bẹẹ tipẹ gẹgẹ bi ọmọdebinrin ti iya rẹ ko si lọdọ baba rẹ mọ naa ṣe ṣalaye.",glot500
Yoruba,"Lọdun to tẹle, ẹgbẹ oselu yi ko ijoko mẹtadinlọgọta nile asofin apapọ- to si di ẹgbẹ oselu alatako to dara julọ ti yoo farahan ninu itan orilẹede Zimbabwe",glot500
Yoruba,"9. (a) Etẹwẹ asi de dona wà eyin e ma kọngbedopọ hẹ asu etọn? (b) Ayinamẹ tẹwẹ yin nina asi lẹ to Titu 2:4, 5 mẹ?",glot500
Yoruba,"Adebisi Akanji (ibí 1930) jẹ́ òṣèré tí orílé èdè Nàìjíríà, bákan náà ó sí jẹ́ olóyè Olúwo Ògbóni tí ilé Ìlédì kàrún Ohùntótó, èyí tí ó jẹ́ Ògbóni tí ó jẹ́ gbóògì tí ìbílẹ̀ lodge tí ìlú Òṣogbo, ní ìpìnlẹ̀ Ọṣun ní orílé èdè Nàìjíríà.",glot500
Yoruba,Ti o ba iru a pataki ore ti o ye pataki kan ọjọ fun jije ti o ba wa ati kiko ayọ ni gbogbo ona. Ti o ṣe wa ari ki o si rẹrin pẹlu ohun gbogbo ti o ni ki loni a gba lati fi kan pataki ojo ibi fẹ fun o,glot500
Yoruba,tun so pe “mo tun fi asiko yii ki gbogbo awon osise orile ede yii ku  ayẹyẹ ayajọ ọdun osisẹ lagbaaye” .,glot500
Yoruba,Wo ìdí tí ọmọ ọdún mẹ́wàá ṣe ti àbúrò rẹ̀ ọmọ ọdun kan àbọ̀ sínú kàǹga Ọsẹ́ tí ọkọ̀ aképo tó gbiná lẹ́bàá Otedola Estate l'Eko ṣe rèé Òṣèré tíátà Yorùbá yìí la orí mọ́lẹ̀ nígbà tó ń ṣe sinimá lọ́wọ́ Ọmọ Risikat olójú búlúù méjèéjì jẹ̀bùn oríire àti ìfà ńlá Ta ni obìnrin tó fẹ́ bá Dino Melaye ṣe ìgbéyàwó lọ́jọ́ kejì Kérésì?,glot500
Yoruba,"Ṣugbọn bi aiṣododo wa ba nyìn ododo Ọlọrun , kili awa o wi ? Ọlọrun ti nfi ibinu rẹ̀ han ha ṣe alaiṣododo bi ? ( Mo fi ṣe akawe bi enia . )",glot500
Yoruba,"Nigbati Amelia gba ilominira re o fe James Roberts, to je alawodudu alainidekun loko; eni yi fun Joseph ati awon omo yioku ni oruko re, o si to won bi awon omo re.",glot500
Yoruba,"Nwọn si jade , awọn ati gbogbo ogun wọn pẹlu wọn , ọ̀pọlọpọ enia , bi yanrin ti mbẹ li eti okun fun ọ̀pọ , ati ẹṣin ati kẹkẹ́ pipọ̀pipọ .",glot500
Yoruba,""" Àwọn àmúyẹ fun gbígbọ́ orin ko le ṣiṣẹ lori ẹ̀rọ rẹ Àkọlé fídíò, coronavirus prevention badge update: Wo òótọ́ àti irọ́ tó wà nínú báàjì àyà náà Wọn ni miliọnu marun un ati igba naira ni wọn yoo fi yanju ọrọ atunse jẹnẹratọ amunawa ti wọn yoo si fi miliọnu marundinlaadọta N45m ra epo jẹnẹratọ.",glot500
Yoruba,"Nibẹ ni ko si iyemeji nipa eyi ti ọna ti awọn keyboard aye ti wa ni ti lọ. Darí itẹwe ba wa ni bulky ati ki o gbowolori lati manufacture. Ya sọtọ itẹwe wa ni Elo kere, ki o si gidigidi poku lati ṣe. Nwọn ba apẹrẹ fun kọǹpútà alágbèéká ti o wa ni ani si tinrin ju darí itẹwe. Ọpọlọpọ awọn eniyan bayi kọ lati tẹ lori awon ti ya sọtọ itẹwe - tabi koda loju-iboju itẹwe - ki Mo reti wọn lati di fere gbogbo eniyan ká ayanfẹ.",glot500
Yoruba,"Awọn ibeere ni yi: Kini nipa miiran meji Sims, X-ofurufu ati P3D, jẹ nibẹ eyikeyi ni kikun ṣiṣẹ afisiseofe Airbus fun eyikeyi ninu wọn?",glot500
Yoruba,"21 Whèvi he to tọ̀sisa lọ mẹ lẹ kú+ bọ tọ̀sisa lọ sọ jẹ wánlùn ji, Egiptinu lẹ masọ penugo nado nù osin sọn Nile mẹ ba,+ podọ ohùn sọ gbọn aigba Egipti tọn pete ji.",glot500
Yoruba,"Manuel António de Sousa Lopes (December 23, 1907 in Mindelo - January 25, 2005) je omo orile-ede Cape Verde olukowe, alaroko ati oludasile litireso odeoni Cape Verde.",glot500
Yoruba,O tẹsiwaju pe awọn pada ribi yọ oku mejila mii lodo ti ọjọ ori awọn ọmọ naa si jẹ bi ọdun mẹrinla si mẹtadinlogun lwourọ ọjọ Aje. Obinrin meji wa ninu wọn.,glot500
Yoruba,Awọn titun ti ikede Doze yoo ran pẹ aye batiri nigba ti iboju wa ni pipa. Aworan: Samuel Gibbs fun awọn Guardian,glot500
Yoruba,"Ninu nkan mi tẹlẹ Mo salaye nibiti Rainbow bi aami kan ti o wa lati. Ni kukuru, Rainbow jẹ aami akọkọ ti ilẹ tuntun lẹhin ikun omi. Ọlọrun fihan irawọ kan ti a ko rii tẹlẹ ni ọrun bi ami si eniyan. Ati pe Ọlọrun sọ pe: Eyi ni ami majẹmu ti [...]",glot500
Yoruba,"Titi dasiko ta a ṣakojọpọ iroyin yi tan ni ko tii sẹni to le sọ ibi ti iyaale ile kan ti wọn loo ṣeku pa awọn ọmọ rẹ mẹta salo, lẹyin to huwa buruku naa tan.",glot500
Yoruba,"O tun le wa awọn ere ti o mu gbogbo iṣẹ rẹ wá ati idaniloju awọn ọwọn awọn ere ere isinmi meji ni ayika agbaye. Boya o jẹ fifuye awọn kaadi tabi titẹ ati sẹsẹ rogodo ni inu roulette kẹkẹ, o le ni iriri ti o gbogbo ni lifelike iwara ati ohun online.",glot500
Yoruba,"Nigbati o ṣe afihan imọran TOGAF® ti o ni imọran, itọsọna yii yoo pese awọn ẹni-kọọkan fun idanwo TOGAF® 9.1 Certified (Apá 2).",glot500
Yoruba,"Kii ṣe gbogbo eniyan rii igbelaruge ninu Dimegilio kirẹditi tirẹ, ṣugbọn ni isalẹ wa diẹ ninu awọn iṣiro gangan ti awọn alabara ti ile-iṣẹ ofin yii ti o gba lati jẹ ki a pin awọn itan wọn. Gbogbo awọn alaye ti ara ẹni ni a dina mọ, ṣugbọn a le fun ọ ni ipilẹ diẹ lori idi ti Dimegilio naa ṣe ohun ti o ṣe.",glot500
Yoruba,"Ṣaaju ki o to bẹrẹ awọn ọna asopọ Justlanded.com jẹ ọkan ninu awọn ti o dara ju ti o dara ju ti o ba wa ni ọkan ninu awọn ti o ti wa ni ọkan ninu awọn ẹya ara ẹrọ, ṣatunṣe awọn faili, tabi diẹ ninu awọn ẹya ara ẹrọ, ni isalẹ. Awọn alaye, ti o jẹ ọkan ninu awọn igbesoke ti o ti wa ni ọkan, ti o ti wa ni ọkan ninu awọn ti o dara ju ti o ti wa ni ọkan ninu awọn iṣowo.",glot500
Yoruba,Igunwíwọ̀n ni eka mathimatiiki to je mo kiko awon ifise pataki awon igun ati imulo won fun orisirisi isiro.,glot500
Yoruba,"""Mo ro pe gbogbo awa ti a wa nidi iroyin, yala ori ayelujara, iwe iroyin, amohunmaworan la gbọdọ wa nnkan ṣe sọrọ ayederu iroyin, ko too bẹrẹ sii gbe wa ṣubu.""",glot500
Yoruba,brigade:n;  (All the membery of brigade were there.) egbé omo-ogun elésin tàbí elésè Gbogbo awon omo ogun egbe elésìn ló wà níbè,glot500
Yoruba,Ọkùnrin kan tó yasó nínú ọkọ̀ Uber rí ẹ̀wọn he Kí ló ń ṣẹlẹ̀ láàfin Oyo táwọn èèyàn fi ń ki Alaafin ní mẹ́sàn án mẹ́wàá?,glot500
Yoruba,"Ọmọ enia , ile Israeli di idarọ si mi : gbogbo wọn jẹ idẹ , ati tánganran , ati irin , ati ojé , lãrin ileru ; ani nwọn jẹ idarọ fadaka .",glot500
Yoruba,"Lati ro bayi yi o je iwa ope ati ti omugo. Bi o ti wu kori, ona kana yi o wu ti awon nkan wonyi gba waye koja oye ati agbara eniyan. Gbogbo wa pata la gba eyi. Eni ti ope ati iyin to si ni alagbara julo – Olorun. Olorun ni o da gbogbo nkan wonyi, O n naa ni o si n se abojuto won. Nitorina, Olorun nikan ni gbogbo iyin ati ogo ye fun.",glot500
Yoruba,"O ni oun kọkọ ra ọkọ bọọsi akero kekere, eyi ti oun tun ṣe ki o le rọrun lati fi maa gbe awọn alaisan to ba wa lori kẹkẹ nitori ailerin.",glot500
Yoruba,"Lẹ́yìn ìgbà tí wọ́n padà wá láti ìsimi ìdajì àsìkò, ìkanran Man City dínkù díẹ̀, ṣùgbọ́n Bernarndo Silva gbá bọ́ọ̀lù s'áwọ̀n ní ẹ̀mejì kí Kevin de Bruyne ó tó gbá ẹlẹ́ẹ̀kẹẹ̀jọ s'áwọ̀n.",glot500
Yoruba,"Ile-ifowopamọ ti ilu okeere dun bi imọran nikan ni o ni ipamọ fun awọn ọlọrọ ti o ni itunmọlẹ. Otitọ ni pe o ni aabo ati irọrun ju apapọ eniyan gbagbọ pe o jẹ. Nitorinaa kini o jẹ nipa ile-ifowopamọ eti okun ti o ṣe ifamọra eniyan si rẹ? O dara, nigbati o ba ṣe iwadi idahun iwọ yoo rii pe ko ni idiju bi o ṣe le ronu. Awọn iroyin banki ti ilu okeere nfunni ni ọpọlọpọ awọn anfani lori ile-ifowopamọ ile. Ọpọlọpọ awọn bèbe ti o wa ni okeere nfunni ni aabo ti o tobi, ikọkọ ti o pọ si ati ominira owo ati irọrun ti o tobi ju ti awọn bèbe ile lọ. Orisun iranlọwọ yii yoo fun ọ ni awọn imọran, tanilolobo ati imọ lori anfani yii.",glot500
Yoruba,"Nitori eyi ijọba apapọ wa ni awọn ti tọrọ aforiji lọwọ ijọba orilẹede India fun 'iwa aṣemaṣe'ti El-Zakzaky hu""",glot500
Yoruba,"7 Ma ṣe lépa fún ọrọ̀ ṣugbọ́n fún ọgbọ́n; àti, kíyèsíi, àwọn ohun ìjìnlẹ̀ Ọlọ́run ni a ó ṣí fún ọ, àti nígbànáà ni a ó sọ ìwọ di ọlọ́rọ̀.",glot500
Yoruba,"Ara ẹni Media, Choyce Brown, ati Oṣere Atike, Bimpe Onakoya ni awọn ayaba ti ailabawọn atike Sin. A n sọrọ awọn lesa ologbon ati awọn iṣawakiri ti o ni ẹyọ ti o funni ni itanran lasan ki a le dojukọ iṣẹ ara. Olorin atike ti orilẹ-ede Naijiria, Teniola A'isha Kashaam AKA onigbagbo tun fihan ni pipa pẹlu ipari awọ ara rẹ ti ko ni abawọn lori 'The White Melanin'. Pẹlu awọn ete ti o ni didan ti o fa ifojusi lati kii ṣe agbara awọ rẹ nikan ṣugbọn imọye gbogbo-yika rẹ. Kini a nifẹ lati ri? O! A nifẹ lati rii!",glot500
Yoruba,eyele lebo Owonrinkanran abori oribashe kawo oribawa ota. ounko Akukan.Gbegbe toroko omode tobarini Irososhe Irosun she olu jeje adifafun aure linjo Launje okan. elese shango marilawe orukpale owo ogoro obori oyeku bawa ifa kalerum owonrinyeku,glot500
Yoruba,"Ṣugbọn pẹlu ikilọ awọn ọlọpaa lẹẹkeji yii, to si tun jẹ ọsẹ tuntun ree, o ṣee ṣe kawọn olokoowo kereje ṣilẹkun tiwọn.",glot500
Yoruba,"Won ṣe e niwaju awọn iwe iroyin kan lodi si abadofin kan ti yoo maa ṣakoso iṣẹ wọn, eyii to kede owo itanra nnkan bii miliọnu marun un naira fun awọn to ba tapa si ofin naa.",glot500
Yoruba,O jẹ aṣayan ọlọgbọn lati bẹrẹ pẹlu diẹ ninu awọn oludasilẹ alayanu nigbati o ba n kọ ile-iṣẹ kan nitori pe o gba akoko pupọ ati olu lati ṣe gbogbo rẹ nipasẹ ara rẹ.,glot500
Yoruba,"Awọn faaji ti awọn ile of Ilu Skopelos jẹ ti pataki pataki. Awọn ipa jẹ lọpọlọpọ ṣugbọn awọn oriṣi ipilẹ mẹrin ni o wa. Ni Chora iwọ yoo rii ile pẹlu awọn ipa ti Venetian, ile itumọ ti lori iru Pelion ati Makedonia, bakanna ile pẹlu awọn ipa lati igberiko ati iru neoclassical.",glot500
